hotel_name,reviewer,helpful_votes,date,text,month,year,extracted_date_str,extracted_date,year_int,sentiment_score
Natura Algarve Club,lisasmith_1966,49,lisasmith_1966wrote a review Oct 2013,"Just back from a weeks holiday. Checked in by Telma who was very pleasant and helpful.Had a self catering studio and these were spacious and clean. everything you needed.We had a problem with the toilet, by the time we got back from breakfast it had been fixed. GREAT service. The pool and pool area were spotless and plenty of sunbeds. Even in the height of the season cant see there be much of a problem finding one. The location of the apartments were ideal, about a 10 minute walk to the strip with many bars and places to eat. The old town was about 35 min walk away, but the bus was only 1.40 euros or just under 5 euros by taxi. Try looking up the side streets and you will find authentic portugese restaraunts.We will return again and would recommend to anyone, families or groups of friends.",Oct,2013,Oct 2013,2013-10-01,2013,5
Crowne Plaza Vilamoura,Luke Jasse,4,Luke Jassewrote a review Jun 2023,"This is not a 5 star standard hotel! Came here with family 7 of us including a 2 year old. Seemed ok on arrival but after we got to the room we found that there is a building site opposite! With no mention of this! Spoke with the reception ( Daniella ) who informed me that they will do nothing to help us. We just spent 8000£ for a week for 3 rooms. They have the cheek to make us pay more money to change rooms. On inspection of the rooms they were thick with dirt, dust everywhere and hallway floors are disgusting. What a joke this hotel is. After being in the hospitality trade for the last 40 years we have never been treated so poorly. The manager leaves early so can't even speak to them till the next day? After going for some food as we'd been traveling all day we got to the rooms at 11pm to find that they hadn't even cleaned the rooms like they promised or made the bed that was requested just completely ignored. When I spoke with reception they said oh the housekeeping has gone home now! Are they for real?!?! Then they swapped our room and just to insult us more they gave us same room on the same side with the building site! What a way to be treated after spending all that money. Words cannot describe the experience we are getting right now. We asked for a refund so we could go somewhere else but they won't honour it. We stayed at the Tivoli last year and you can't even compare them! That was amazing! Wish we had booked to go back there! So don't be fooled you ha e been warned! This hotel doesn't care about you or your satisfaction! This does not compare in any way to previous crown plaza we have stayed in! I will make sure I leave our feedback on all booking sites just to warn people before they waste their hard earned money here! Hotel really let's down vilamoura and should not be here on the standard you would expect.",Jun,2023,Jun 2023,2023-06-01,2023,1
Memoria Porto FLH Hotels,delagioventu,526,delagioventuwrote a review Oct 2023,"Wonderful hotel, great stay. Room was very modern and comfortable. Friendly staff. Position of the hotel is really fantastic. Breakfast deserves a special mention, as it was very nice and special. Only downside is you have to indicate the slot you want to have breakfast.",Oct,2023,Oct 2023,2023-10-01,2023,4
Noah Surf House,Sally E,8,Sally Ewrote a review Sep 2019,"This is a fabulous hotel. The staff are incredibly friendly and upbeat. Our bungalow was great and I loved the log fire! The food was good both in the main restaurant and down at the Beach House. The Beach House has a really nice ambiance in the evening. The pool and deck areas are comfortable and the pool deck barbecue was very enjoyable. There are plenty of activities on offer if you want or you could just chill! The only downside however, and it is quite a big one, is the location. Santa Cruz is really not a very nice place! It may be better in high season (or even at the weekend) when things are open but we were there in early September (mid week) and the whole place was a bit like a ghost town. If the location was better this hotel would be just about perfect!",Sep,2019,Sep 2019,2019-09-01,2019,4
Canto de Luz,Desiree K,0,Desiree Kwrote a review Jul 2023,"We truly enjoyed our stay at Canto de Luz   The hotel was perfect, incredible staff, beautiful place, centrally located. We could not have found a better place to stay. Looking forward to our next visit",Jul,2023,Jul 2023,2023-07-01,2023,5
Ocean Gardens,Dee,3,Deewrote a review Nov 2009,The reviews were correct. A fantatic hotel which had great views (dont forget your binoculars) and very clean.Tips:Try to get a' Bay' rather than 'Sea'  view - rooms 101 to 110 I think. We had room 106 which was not big but had a great view.Food in restaurant downstairs ok but rather unimaginativeDont be affraid to catch the local bus 39 down into the town in the evening - cheap and reliableTown very relaxed - did not feel at all concerned wandering through back streets even at nightRiso is a great contempary resaurant in the Old Town behind the fort - if you like riceLike many hotels with tiled corridors the rooms can be a bit noisy at times but really not an issue as the hotel was always quiet by about 10.30!Pool area is lovely - clean and quiet,Nov,2009,Nov 2009,2009-11-01,2009,3
Vila GalÃ© Tavira,Kirsty M,54,Kirsty Mwrote a review Sep 2022,"Hotel was nicer than expected for the money paid. We didn't pay extra for pool view which meant we had quite a non-private, dark balcony overlooking a garage forecourt. That aside, everything else was good.Rooms clean and spacious enough. Breakfast varied. Staff really nice and helpful. Great location. Room quiet at night despite being roadside.I'd have given a 5 star review had it not been for the utter rip-off of being charged 5.40 euros for 2 small bottles of water by the pool on our first day. Sadly it was without any menu being available and we were thirsty and tired and I couldn't believe it, really OTT pricing for the area and I purposefully didn't give the bar any more custom after that! Lovely bottles of local wine available in the supermarket for 2eur, just for context.",Sep,2022,Sep 2022,2022-09-01,2022,4
Vila GalÃ© Tavira,Molly G,2,Molly Gwrote a review Sep 2012,"Stayed in Vila Gale Tavira last week, lovely hotel, very relaxing, breakfast gorgeous. Kids little pool is great for Toddlers. Would definitely recommend this hotel. Tavira is gorgeous too! Trains a lot cheaper than buses when travelling to markets in OlhÃ£o/ Fuseta.",Sep,2012,Sep 2012,2012-09-01,2012,5
Porto PalÃ¡cio Hotel by The Editory,MyleeG,14,MyleeGwrote a review Jun 2019,"Thanks to Carlos at the front desk we got upgraded in the Penthouse suite.It was the most beautiful hotel room we have ever had! The marble all around in the bathroom, the giant meeting room, the amazing sea views from the 18th floor and not to forget one of the most comfortable bed I have ever slept in.The staff is truly amazing and their level of service is outstanding. WiFi is great, the spa is beautiful and itâ€™s only $5 in Uber to reach the city center.Simply amazing !",Jun,2019,Jun 2019,2019-06-01,2019,5
Canto de Luz,Erin B,0,Erin Bwrote a review Mar 2024,"My partner and I had a wonderful stay in the one room Garden level 2 room. Like all others have mentioned, the breakfast was always lovely. We preordered a to-go breakfast on the days we were leaving before 8:30am. Great, safe and quiet location - we walked everywhere easily - good walking shoes or hiking boots are a must. There was some constructions going on around us, but we couldn't hear any of it while in our room - the walls are very think and the doors heavy. Everything is clean and new!Our room didn't have a clothes washer, so we took advantage of their laundry service (one bag for 20 euros). They washed, dried and folded our clothes and delivered them to our room all in the same day! Keep in mind: if you are sensitive to fragranced detergent, you may want to forgo this service, as it was quite strong. We asked if they could rewash all the clothes in fragrance-free soap, which they happily did. Unfortunately, they were still very fragranced. It took us rewashing an additional two times at home to get the scent out. But, if you like scent, you'll love it! Note: the bed linens and towels in the room did not have a fragrance, which was great for us.Our room had a huge balcony overlooking the breakfast area below and garden. It had an amazing electric blackout screen that we could raise and lower for a wonderful sleep experience. Heads up: the bedroom and bathroom are divided by a sliding frosted glass door - this was no problem for us, but there's a little less privacy.The staff was all unbelievably kind, welcoming and helpful! We will absolutely stay again, should we be lucky enough to visit Porto in the future.",Mar,2024,Mar 2024,2024-03-01,2024,5
Ocean Gardens,Nigel W,13,Nigel Wwrote a review Apr 2013,"This hotel is on the edge of Funchal (or rather its western suburb Sao Goncalo) so is not ideal if you want to be in the centre of Funchal but it does not take that long to drive into the centre and the environment is much nicer than around many of the hotels in the centre.  It is high up above the sea and from the breakfast room and the left hand end of the hotel there is a fantastic view over the bay of Funchal.  The value was excellent.  We booked it with Easyjet from London Gatwick in late March and for the two of us it was only just over £200 each for flights and the hotel (including breakfasts but plus the usual Easyjet charge for suitcases).  Our room was quite nice and of a reasonable size.  The bed was very comfortable.  There was some slight mold growth on a few parts of the grouting to the tiles above the bath but not enough to be a problem and the bedroom and bathroom were generally very clean. Staff were friendly and helpful.  Our room had a sea view.  The disadvantage was that there was some road noise from the road in front of the hotel but the road was not that busy and we did not find it to be that much of a problem.  The buffet breakfast was about average and quite acceptable, not the best but certainly not the worst we have encountered.  We did not use the hotel restaurant, so I do not know how good it is.  The menu did not seem anything special and there were much cheaper ones in central Funchal.  There is a free courtesy bus into Funchal but only twice a day each way.  We had a car so did not use it.  I think there may be other local bus services as some guests appeared to be using them but I do not know enough to comment.  There was adequate free parking at the hotel when we were there.  Overall, we are very happy to have chosen this hotel.",Apr,2013,Apr 2013,2013-04-01,2013,4
São Lourenço do Barrocal,D J,61,D Jwrote a review Jul 2017,"Highly recommend lovely, relaxing oasis, large rooms, quintessential simplicity under the scorching sun - white walls, red tiled rooves, pool. Away from any crowds. Incredible deep tissue massage from Anna! Well intentioned service. Unexpected periodic English language lapses. Very good cuisine. Conscientious entrepreneur owner. Great destination/base to view starlight nights and explore Alentejo area bordering Spain.",Jul,2017,Jul 2017,2017-07-01,2017,5
Canto de Luz,khfs2018,0,khfs2018wrote a review Sep 2018,"We love this small hotel! It's located near the Trinidad station and other bus stations that will take you to the main locations of the city (and outside of the city) in no time and without changes. The area has a fantastic charm and even thought the hotel is near many bars, restaurants and cafes it is still completely peaceful.Our first impression of the hotel was the great taste in design and architecture - It is a completely renovated house. We felt good and comfortable every time we were inside.When we arrived, we were welcomed by the owners who informed us about everything we needed to know to have a comfortable stay. Every morning you will get a \"French-Styled\" breakfast combined with traditional products from Portugal. Delicious, fresh and home made! The staff were so friendly and willing to help whenever we had requests or questions.We recommend that you book in advance because the hotel has more or less 5 rooms (we guess).",Sep,2018,Sep 2018,2018-09-01,2018,5
Muthu Clube Praia Da Oura,AdamSorrell,4,AdamSorrellwrote a review Nov 2019,"Hotel room S23 was disgusting with black mould in the bathroom and bedroom, floors doors and walls were filthy, tiny balcony had broken table hanging from it, dark yellow water coming out of the taps, wouldnt give it 1â˜†. Went to reception following day and asked to change and they had no problem moving us without any questions as to why we wanted to move rooms which ringed alarms.Moved room to a smaller but clean room.Hotel states everywhere including in the hotel that it is family friendly yet there was NO entertainment for kids, they had a big bouncy castle out till Saturday but then took that away to make room for a member only bowls for the winter, then last 2 days they shut the Ocean Bar from 6pm which left absolutely nothing to do apart from sit in hotel room in the evening, was not allowed to use sister hotels that were advertised to be able to use when we booked,NO kid friendly food, 1 drink per person allowed throughout whole meal, no child friendly access to rooms and room they changed us to we had to carry pushchair up and down 4 flights of stairs every day, cleaners wanted us out of the room at 8am but we returned at 1pm and room still wasnt cleaned.",Nov,2019,Nov 2019,2019-11-01,2019,1
Hotel Alegria,Maps25208962298,0,Maps25208962298wrote a review Sep 2024,"This hotel is wonderful.  It is ideally located, making it walkable to almost all of the key parts of Lisbon you would want to visit.  The rooms are very comfortable, and well appointed without being over the top.  The square just outside the front door is a great place for a cup of coffee or breakfast, and there is live music at times in the evening.  The staff are very friendly, and all are very helpful.  We will certainly look to stay here on our next visit to Lisbon.",Sep,2024,Sep 2024,2024-09-01,2024,5
Hotel Principe Lisboa,Paul Tarmas,80,Paul Tarmaswrote a review Dec 2013,"Stayed 3 nights in December nothing really to fault, easy access from airport, hotel right opposite the last station on red line San Sebastio. So getting around from hotel on Metro very easy. Reception staff very friendly and helpful as were all other staff. Good size clean room with small fridge, bathroom big enough, just be careful in shower as floor very slippery, comfy beds and quite at night for major city. Buffet breakfast very good nice selection, no hot food but you don't expect that with a continental breakfast. You could walk to old town from hotel in 30-40 minutes, but walk back quite hard work as it is all uphill, just use metro on return, again metro good value 1:40 euro per trip. So all in all great value for money.",Dec,2013,Dec 2013,2013-12-01,2013,4
PortoSense,Bill M,21,Bill Mwrote a review Jun 2015,We stayed 3 nights here in the apartment on 2 stores right in the heart of busy Praca de ribeira and a stones throw from the river. It is noisy until late be we were tired and slept well. It was great to have a modern little apartment with kitchen and washing machine. Well appointed and great location so we are going back in 2 weeks after our douro river trip.,Jun,2015,Jun 2015,2015-06-01,2015,2
HF Fenix Lisboa,Departure41401,3,Departure41401wrote a review Oct 2019,"It was the first time in Lisbon and the HF Fenix Lisboa was just the ideal place to ensure a great time.  The staff were exceptional by being friendly and helpful.  They spoke English which helps as we don't know their language at all.  The Hotel breakfast could not be better, I highly recommend it to anyone.  We like to walk so going downtown was not a problem and there is no way to get lost if you stay close to the mainstream.  The park next to the hotel was amazing.  The walk up the hill is so worth it as the view of Lison is incredible.  The room was big but the bathroom was a bit small.  But that is common in Europe.  There are lots of good places to eat within a block or two of the Hotel so that was a bonus.  As we went in October there was no problem with crowds, big lineups, etc.  We stayed a week and that was just right to get a good feel of Lisbon.  Enjoy!",Oct,2019,Oct 2019,2019-10-01,2019,5
Legendary Lisboa Suites,Flossie273,24,Flossie273wrote a review May 2017,"We rented a 2 bedroom apartment for a long weekend with family including our toddler grandchild. It's well appointed, clean & tidy. It's a cross between a hotel & self catering. The maids come in & make up beds & change towels every day. There's a lovely little cafe on the ground floor that serves a buffet breakfast.The apartment could sleep six as there is a sofa bed in the lounge.It's situated about 10 minutes away from Pombal & is handy for the tube. Or it's a leisurely stroll down Liberdade to the old town/ front.There's a supermarket nearby & a MacDonalds. We couldn't find many local eating places & so went down into the old town. Maybe we were looking in the wrong place but bear this in mind if you're not very mobile.",May,2017,May 2017,2017-05-01,2017,4
Yes! Lisbon Hostel,VicYutuc,88,VicYutucwrote a review Oct 2017,"THis is hostel is a gem in Lisbon, the staff are great they will welcome you with free shots and they will extend their arms just to help you. I wonder why it is rated 9.8 in hostelworld. The dinner was great and pub crawl was a wonderful experience.You will meet friends here and soon turn them into good friends, it a nice environment to meet people. I love this place, you will never travel solo.",Oct,2017,Oct 2017,2017-10-01,2017,5
Pestana Bahia Praia,nferrans,13,nferranswrote a review Oct 2018,"True its reputation the Pestana group delivers at the Bahia Praia.Rooms are spacious, clean and well equiped, staff are efficient, amenable and pleasantly helpful.The position of the hotel is private, tranquil and convenient.The beach is nearby, the distance to Vila Franca do Campo is walkable, and a shuttle to Ponta Delga makes for convenient daily entertainment.Food choice is good and dining environment is pleasant.",Oct,2018,Oct 2018,2018-10-01,2018,5
Vila Galé Coimbra,Johnny Mascaro,44,Johnny Mascarowrote a review May 2018,"Coimbra was my last city while walking the Camino Portugues and I will come back.Great hotel, probably the best in my whole tour. Was greeted on Arrival and given access to the swimming pool, while waiting for the check-in time.Swimming pool area is really nice and good place to have a drink or something to eat.Staff was always polite, friendly and multilingual.Room was nice and good value for money.Great breakfast with lots of choices!I will be happy to return to this hotel in the amazing city of Coimbra.Obrigado.",May,2018,May 2018,2018-05-01,2018,5
HF Fenix Lisboa,ckruger,12,ckrugerwrote a review Oct 2017,This hotel is nicely appointed. The rooms are comfortable and the beds were the most comfortable of all the places we stayed during our vacation. The staff was very helpful with suggestions for restaurants and getting transportation.It's got a good location near the hop on hop off hub and lots of restaurants. It's also close to the shopping district.,Oct,2017,Oct 2017,2017-10-01,2017,5
Shining View,NCaruana,3,NCaruanawrote a review Apr 2018,"We are a couple with two young kids, who stayed in one of the Shining View Apartments while on a five day trip in Porto. The apartment we had is lovely - spic and span and furnished really nicely. It is equipped with a lot of facilities including a microwave, washing machine and hair dryer. Its location is central, and it is so easy to walk to many main attractions from there. The staff was really helpful, and on the first day, we were given tips and suggestions regarding attractions, restaurants and typical food. Highly recommended.",Apr,2018,Apr 2018,2018-04-01,2018,5
Onyria Quinta da Marinha Hotel,Roam35216394547,0,Roam35216394547wrote a review Feb 2024,"We have booked this place last minute, we are glad we did it. The pools are free of charge , nice touch. Five minutes away by car fron the city center, we found the perfect place to relax a vit. The bar has nice cocktails, the restaurant we did not tried it. The professional staff is amazing careful. Room was very clean wirh a nice fraganxe smell",Feb,2024,Feb 2024,2024-02-01,2024,5
Apartamentos Bellevue Nr. 1,Sue K,3,Sue Kwrote a review Jul 2013,Had a lovely week in Carvoeiro made even better by our stay at these brilliant apartments. We had booked a small studio but we were upgraded to a large two roomed apartment with a sea view and fantastic balcony. Spotlessly clean and the owners are attentive but not intrusive. Large pool and plenty of loungers. Situated on the edge of town it is quiet at night but close enough to restaurants and bars when we wanted them. Would definitely recommend to others.,Jul,2013,Jul 2013,2013-07-01,2013,5
Vila Galé Coimbra,Bob D,10,Bob Dwrote a review May 2013,"We enjoyed our stay at this modern hotel - great service, great room, great restaurant.  Location is not in the Old City of Coimbra but within reasonable walking distance.  Surrounded by businesses and not many restaurants.  Yet, the restaurant in the hotel is modern with a very nice setting - free breakfast buffet was very good.  The evening buffet while a little pricey was well presented and very tasty.  The lobby area is very beautiful and relaxing.  The rooms and bathroom are large. clean and relaxing.  Hotel does not offer free WiFi in the room.  Free WiFi in lobby had good internet connection.  Underground parking while not free was very convenient.Staff was friendly and helpful.",May,2013,May 2013,2013-05-01,2013,4
Apartamentos Bellevue Nr. 1,Austin Tasious,1,Austin Tasiouswrote a review Oct 2016,"An extremely well located apartment. Number 8. Less than a stone's throw from numerous restaurants. From the front of the apartment you are literally amongst the resort facilities. But from the back (lounge and bedroom) there is no sound at all.Full length balcony (2 patio door access) overlooks very good size pool. With only about 12 rooms there is more than enough room for everybody to be around and in it at the same time.Enormous Balcony is large enough for table,  4 chairs, sun loungers, sun umbrella and room to move around to avoid the sun.Lounge is very good size,. Bedroom also. Shower room has separate bath. Kitchen fully equipped, although we ate out.Note for owner.... Cork screw broken, I promise we didn't do it !!!  However we bought another locally and it broke immediately!! Must be something about local corks.Local restaurants we found generally expensive, especially compared to general cost of things elsewhere in Portugal.Avoid market across the street, very expensive. Aldi fairly close by.Would totally recommend the apartment .",Oct,2016,Oct 2016,2016-10-01,2016,2
Vila Galé Coimbra,rmsct,48,rmsctwrote a review Aug 2015,"This is a very good hotel for the price. The rooms are neat (although not huge, they are ok), the restaurant (breakfast) has variety and quantity, and above other hotels in which I have been for the same price. I liked also the \"fado\" theme all around. If offers free spa: sauna, turkish bath and, inside and outside pool. The parking is paid, but on weekends there are free parking nearby. All the staff is nice and helpful. If I return to Coimbra, will probably stay again.On the downside, I consider a little far from the historical center (i.e. almost half an hour walking to the university) if you are planing walk.",Aug,2015,Aug 2015,2015-08-01,2015,4
