hotel_name,reviewer,helpful_votes,date,text,month,year,extracted_date_str,extracted_date,year_int,sentiment_score
Artbeat Rooms,Dave and James,29,Dave and Jameswrote a review Jan 2020,Gosta on reception was brilliant. She kept in contact with me from the initial booking and met me at the property for check in. Very helpful and friendly. The location is right in the centre of Lisbon halfway between the Marina and Restauradores. The room is very comfortable and abstractly decorated which I loved. There tea and coffee available in the kitchen and the shared bathrooms are very clean. Highly recommended,Jan,2020,Jan 2020,2020-01-01,2020,5
Jupiter Albufeira Hotel - Family & Fun,Chris C,3,Chris Cwrote a review Apr 2023,Lovely hotel. Cleanliness excellent. Staff literally clean up spillages in restaurant as they happen. Wi-Fi best I’ve had in a hotel. Download and upload at 50mpbs and can even pick it up other side of pool.Staff so efficient and friendly. Bar service excellent. Drinks in hard plastic recyclable cups in pool area or glasses inside. Big range of all inclusive drinks. Beer is Super bock.Great food selection in all inclusive with themed nights. Be prepared to queue 10-15 mins in the evening for a table if don’t turn up early.Great selection of pools for adults and kids. Even a few water slides. Great swim up bar.There was no towel reserving. No need as plenty of sun loungers. Always got one even on first day turning up to pool at 2pm and we needed 5.Great views from roof top bar.Only negatives are water pressure (we were on top floor) and evening entertainment average. Maybe it’s better in the summer. But in bar area they sometimes have a dj or a singer which were really good.Definitely recommend.,Apr,2023,Apr 2023,2023-04-01,2023,5
Macarico Beach Hotel,Irene L,0,Irene Lwrote a review Aug 2018,"We were looking for a nice restaurant to have local food beyond francesinha and tosta mista (love them, but too much of a good thing...) when we found Bico Real, the restaurant of this wonderful hotel. We have had an amazing dinner, authentic, with local dishes with a twist and a wonderful atmosphere. And dead classy! Highly recommended even by our 13 year-old girl!!",Aug,2018,Aug 2018,2018-08-01,2018,5
Tivoli Carvoeiro Algarve Resort,Venture35193768647,0,Venture35193768647wrote a review Sep 2019,"Stayed here for 4 nights with 6 of my friends. Loved the hotel. I had red petals , balloons, and mini cake with a note from the hotel wishing me a happy birthday. The service was excellent , the staff were very helpful and friendly.  Lovely breakfast & lunch. The sea view was stunning, I enjoyed climbing up the cliff, took lovely pictures , beautiful view. Definitely coming back here.",Sep,2019,Sep 2019,2019-09-01,2019,5
Saccharum,sazzle15,0,sazzle15wrote a review Jun 2016,The hotel is about a half an hour drive from Funchal but the hotel has a daily bus (Mon-Fri) to and from the capital and it is possible to hire a car in Calheta for a reasonable price.  The hotel was gorgeous and the staff were very helpful.  Would definitely recommend it.,Jun,2016,Jun 2016,2016-06-01,2016,4
Jupiter Albufeira Hotel - Family & Fun,CH2708,16,CH2708wrote a review Jul 2024,"We spent a week at the Jupiter Albufeira with our 2 sons, 4 and 2 year old.We booked a private taxi service through Xclusiv4U which was so easy/convenient (highly recommended by the way).On arrival to the hotel, our room wasn’t ready so we went for an explore and our room was ready around 2:30pm. I emailed in advance for a quieter room and we were very pleased with it. We had a sofa bed & travel cot, the room was spacious and clean. The shower was very powerful - impressed! We were lucky to have 30°+ weather & the aircon worked very well.The main pool gets very busy but we enjoyed it there  most days. The AI drinks are ok…. Very small cups even for soft drinks! The lifts can be a right pain, especially as we had a double buggy. Sometimes we wanted 10/15mins to finally have an empty one arrive. The rooftop bar on floor 10 is really nice, could have spent hours up there 🌅The food is average, personally we thought there wasn’t much choice. We’ve stayed in another AI hotel in Portugal last year & we found the food much better. But you will manage to find something.We took a trip to Old Town with Uber (€6) for my husbands birthday/Portugal playing football. We really enjoyed it, worth a visit to mix things up. The atmosphere was great!Overall, we had a lovely week away in the sun. If the food improved it would make this hotel much better but you can’t have it all 😆",Jul,2024,Jul 2024,2024-07-01,2024,4
Jupiter Albufeira Hotel - Family & Fun,ikey1986,0,ikey1986wrote a review May 2023,"Staff and hotel was exceptional, our experience from day one was brilliant.Surroundings and bedrooms were spotless, highly will recommend this hotel.Our kids had great experience and enjoyed all the activities.",May,2023,May 2023,2023-05-01,2023,5
Jupiter Albufeira Hotel - Family & Fun,Bellatrixx2,51,Bellatrixx2wrote a review Aug 2020,"We recently stayed here on our first holiday with our 1 year old. Our stay was absolutely brilliant from start to finish! We had an early flight so arrived 3 hours before check in, but the hotel was able to get us straight into our room. The whole hotel is lovely and modern and our room was very spacious. We had tea and coffee facilities and a bottle of water left in the room on the first day. It was a shame that the tea and coffee do not get refilled, but I made do with taking some teabags up from breakfast.The food at the buffet is easily the best that we have had at an all inclusive resort! I particularly enjoyed the Portuguese and Moroccan themed nights. The pizza at the Italian was incredible as well! We were a bit worried, as 7pm is a bit late for our toddler to eat, but they have a snack bar open in the afternoon which serves chips, burgers etc, so that kept him going! We also really enjoyed the selection of drinks available on the all inclusive. The mojitos are delicious, and the beer and gin were lovely!You are spoilt for choice with the pools. The main pool is absolutely huge, and we loved the swim up bar! There are two children’s pools and two quieter pools tucked away round the side. There are also plenty of sun beds and parasols. As mentioned in other reviews, the pools were a bit on the cold side and our little one would shiver if we took him in during the morning or early afternoon. They seemed to warm up by mid-afternoon though!The staff were all absolutely fantastic! The restaurant staff would bring over extra napkins for our little one and were always happy to fill up his water beaker. Manuel in the a la carte deserves a special mention- he really couldn’t have done more to make our visit to the restaurant more special, even bringing our little one a plate of melon (his favourite food) despite it not being on the menu!We had such a fantastic stay and will definitely be back in the future!",Aug,2020,Aug 2020,2020-08-01,2020,5
Vila Gale Collection Braga,brazilgirl,148,brazilgirlwrote a review Apr 2019,"When we deove up in our taxi, my jaw droped. The setting and property itself is really incredible. And the location could not have been better. However, the hotel lacks in warmth and finesse. There are no special touches. The room was huge, the bed comfortable. But that was it. Bland decor, bland breakfast, boring bathroom.The staff was nice and the building truly amazing. But it could be so much more.",Apr,2019,Apr 2019,2019-04-01,2019,2
Valverde Lisboa Hotel & Garden - Relais & Châteaux,Soya B,120,Soya Bwrote a review Jun 2022,"We do not know where to start. This was one of our top experiences in Lisboa. A great welcome and attention to any allergies. A restaurant manager - young Portuguese - who spoke fluent English. The food was excellent, made with love. The wine recommendation were the right fit - we will defintely come back.",Jun,2022,Jun 2022,2022-06-01,2022,5
Captain's Log House,Eric E,3,Eric Ewrote a review Jun 2013,Had a great week stay at the Hostel. Breakfast was amazing and it was the perfect base for my surfing in Peniche. I was there early season but did not feel alone at all as there was a great crew of people staying at and running the hostel. Thanks so much for everything.,Jun,2013,Jun 2013,2013-06-01,2013,5
Estalagem Da Ponta Do Sol,Tibor Weber,16,Tibor Weberwrote a review Apr 2023,"We were here for 1W (7 nights) and everything was very nice at this place. The hotel has ocean view from pool, pool bar, jakuzzi, room, restaurant and bar as well. You can eat, drink and enjoy the ocean!The breakfast was very selective, different cheese, salami, fruit, bred, cookie etc. Really good, you also get different fresh made breakfast from egg, bacon. The room was clean and cleaned every day, the room is big, beds has a good quality, i slept very well at nights (normally i sleep bad in hotel), big wardrobe with mirror, safe, fridge and you also get enough towels and bathrobe. Hotel has sauna, jakuzzi, indoor outdoor pools also with ocean view. The staff was very kind, they booked tours, you get free transfers, also free transfers from/to airport, you get picknick if you leave earlier then the breakfast starts. I really recommend this hotel, we would book for our next trip in Madeira.",Apr,2023,Apr 2023,2023-04-01,2023,5
Hotel Madeira,Climber40472853932,0,Climber40472853932wrote a review Aug 2025,"Horrible experience, too noisy, construction everywhere, cars and motorbikes passing loudly every time, last time I’ll stay here with my family or even alone, not the best relaxing place to be",Aug,2025,Aug 2025,2025-08-01,2025,1
Quinta Nova Winery House - Relais & Châteaux,Fernando G,69,Fernando Gwrote a review Sep 2016,"Beautiful place for some relaxing days, enjoying a perfect view, great wines and very good food.The region is perfect for relaxing moments.The olive form this \"Quinta\" is one of the best I ever tried.",Sep,2016,Sep 2016,2016-09-01,2016,5
Hotel Madeira,scantheman_9,28,scantheman_9wrote a review Mar 2018,"We went as 2 couples for 4 nights, 20th - 24th March. Short 20 minute transfer from airport, easy check in, if arrive early they will look after your bags at reception. Rooms light and airy all with A/C and very clean. Basic toiletries in room, plenty of clean towels,TV but limited channels in some rooms, very comfortable beds and do get turn down per se in the late afternoon/evening. You can pay for a safe just a few euros a day. Unfortunately no kettle/fridge or iron which is disappointing and we would have expected this for a 3 star hotel. You can pay approximately 3 euros per item and they will iron and pop in your wardrobe whilst out and about. Whole hotel is spotlessly clean and staff are very friendly and accommodating. Roof top bar and pool on 5th floor, accessed by a lift, fantastic views over the roof tops and lovely at night when dark and you can see all the lights. Hotel is in a perfect location, just short walk to bars/restaurants/shops and marina/port. Breakfast continental buffet style basic but fine, you cannot take a coffee or anything food/drink from the area so bear that in mind. We thoroughly enjoyed ourselves and would return",Mar,2018,Mar 2018,2018-03-01,2018,4
Captain's Log House,Jana D,1,Jana Dwrote a review Sep 2014,"Hi, thanks for a friendly treatment again. This time with the nice breakfast included. Captain s is very clean place which I appreciate a lot. I loved again checking every morning the waves in Gigi which is 2mins walking from Captain s and you have this beautiful view from the cliff to the beach. And thanks for amazing cakes baked by Captain s staff for free. I hope to  come back soon.Jana",Sep,2014,Sep 2014,2014-09-01,2014,5
Horta de Torrejais,An U,1,An Uwrote a review May 2014,"Waauw! What a great discovery! At the end of a dirt road, you bump into a little paradise.  A place to entice all your senses.The house is beautifully renovated, surrounded by a huge garden with a large pool. A green oasis, with trees, flowers and vegetables. There is even a little waterfall.The rooms are nice, rather small, but renovated in an authentic style. If you are planning on sleeping in, you have to take in account that you will probably be woken by birds, who make their nests in the roof above you. But this didn't bother us. It's in fact charming to get this close to nature.We enjoyed our breakfast at a beautiful decorated table. In the house there are several places to relax.The owners are friendly and speak different languages.We highly recommend this place!",May,2014,May 2014,2014-05-01,2014,5
Lisbon Destination Hostel,claire679400,6,claire679400wrote a review Nov 2015,"This is one of the best hostels I've stayed in ever, and I have stayed in many.The location is very central, the staff are friendly and helpful, the communal area is very trendy and welcoming, breakfast was great and the rooms are lovely. We had an en suite double and it would rival any hotel. I especially like the little touches such as the clean towels and fancy air fresheners. Thankyou.",Nov,2015,Nov 2015,2015-11-01,2015,5
PortoBay Liberdade,judiko,180,judikowrote a review Oct 2017,"This was a lovely stay, the room, which was a junior suite was large enough, not quite a big as you might expect but certainly good enough. It had a small balcony and super bathroom.Breakfast was included and very good. The staff were both helpful and friendly.We had one evening meal here which was excellent.No complaints at all.Great spa and wonderful massage with Denise. Would stay again. Hotel was consistently fully booked.",Oct,2017,Oct 2017,2017-10-01,2017,5
Lisbon Marriott Hotel,(JLB),101,(JLB)wrote a review Mar 2014,"Although the location is great, the staff attentive & friendly, and the service excellent, the property is a bit on the tired side of the typical Marriott experience. Although the rooms were clean and the beds somewhat comfortable, the bathroom and shower facilities are outdated compared to other hotels in the same price category. A slightly above average stay overall.",Mar,2014,Mar 2014,2014-03-01,2014,4
Casa Pinto,Wojteks,3,Wojtekswrote a review Sep 2011,I do recommend!!! I love this hotel and Monsaraz... One of the best hotels I have ever stayed at!!!,Sep,2011,Sep 2011,2011-09-01,2011,5
Luna Clube Oceano,Jillybean,0,Jillybeanwrote a review May 2019,"We have just returned on Saturday from this hotel. From the moment of arrival we felt relaxed, from the lobby, to checking in to the hotel accommodating my request of high floor. The 1 bed apartment was spacious and had everything needed, little extras like iron and board in storage cupboard also clothes hanger/dryer, hairdryer etc. Kitchen had everything but an oven which I wouldn't have used anyway, I dont go on hols to make a roast chicken dinner but there was a hob, a microwave, toaster, a coffee maker, a kettle and all kitchen essentials. The sitting room was large enough with a table and chairs also and a lovely balcony with sea view. The bedroom was large with super kingsize bed (2 singles combined) a large wardrobe and a dressing table. The bathroom and shower over bath were great. Our room was cleaned daily.The staff were more than accommodating and friendly and a special mention to Daniella who organised our car hire for us, she is a very sweet girl and nothing was too much hassle for all the staff. The breakfast was also good and we worked out it was around €1.5 more than the local restaurant BUT in the hotel it was buffet style so you eat as much as you want and there was a great selection of fruit, cereal, breads and fried foods, also cakes and juices and tea/coffee, whereas in the local restaurants you get one serving of a fry on your plate so the hotels is well worth the extra €1.5.The pool and hot tub area are nice and clean and the bar service  is good also.The beautiful beach is literally on the doorstep and a few shops/ restaurants and bars also. 10 to 15mins walk either direction you are on \"the strip\" of the new town or in the old town. I thought the Luna Clube Oceana was perfect. I would love to return and hope to do so in the future.A******",May,2019,May 2019,2019-05-01,2019,2
Luna Clube Oceano,TravelAgent25,1,TravelAgent25wrote a review Jul 2008,"My boyfriend and I stayed at the hotel at the end of June 2008 and found the apartments were- clean, spacious and in a good location for the beach.We stayed in a studio and were located on the ground floor which although was a little dark around the corridors, our terrace got the sun from early morning until mid afternoon which was nice to sit out first thing.The apartments are mixed nationality but mainly dutch and british, the hotel staff were pleasant and helpful, small pool bar good for drinks etc and local excursions are bookable at the reception, i.e waterpark- slide and splash.The location is good for the beach, however as it is situated half way between montechoro and fishermans beach be prepared to walk a little for large choice of restaurants and nightlife. ( the old square far better than montechoro strip)I work within the travel industry and believe you get what you pay for- if you want the sea views and the bigger rooms then book and pay for a one bedroom apartment- all in all a good accommodation away from the hustle and bustle...",Jul,2008,Jul 2008,2008-07-01,2008,4
Lisbon Marriott Hotel,corrosio,68,corrosiowrote a review Oct 2014,"In fact we were in this hotel from July 28 to 29, 2013 excellent, spacious and comfortable room, with a king size bed and cozy pillows. Bathroom with bath and very good shower, everything spotlessly clean. Attentive to the extreme staff in all areas of the hotel that were frequented by us. Continental breakfast served from 6:30 AM on, but as our plane would take off at 9:00 AM we were allowed to have breakfast at 6:00 AM without asking if it was possible: just the kind attendant invited us into the restaurant and told us to enjoy!The hotel is well located, halfway between the airport and the center of Lisbon, with a taxi costing around EUR 15.00 to EUR 10,00 (airport or downtown, respectively). A 15-20 minute walk is the University City metro station, where one can go to the airport without the need for a taxi. The amount spent in this hotel was very attractive (less than EUR70.00), an excellent cost x benefit ratio. We will certainly stay in this hotel when we return to Lisbon in a near future.",Oct,2014,Oct 2014,2014-10-01,2014,5
"Reid's Palace, A Belmond Hotel, Madeira",Chris W,0,Chris Wwrote a review Feb 2024,Everything was perfect from the ambience and old world welcome to the impeccable service.  Breakfast was a particularly special experience and the swimming pools wonderful.  We loved it and cannot wait to return.  Congratulations and thanks to the whole team.,Feb,2024,Feb 2024,2024-02-01,2024,5
Tivoli Carvoeiro Algarve Resort,N1553JValanr,0,N1553JValanrwrote a review Jul 2016,"Great location, Staff very friendly and helpful. Accommodation good some fittings a little dated but very comfortable. The hotel looks very bland from the road but is great from seawards set in a cove with access to a small beach, a great poll and garden area. Shuttle Bus to Carvoeiro town centre.",Jul,2016,Jul 2016,2016-07-01,2016,4
Saccharum,Vacation602056,5,Vacation602056wrote a review Jul 2017,Would definitely recommend this hotel as it provides luxury at a very affordable price. I would suggest you book a room with a sea view to really enjoy sitting enjoying a drink while watching the world go by. The facilities are excellent and couldn't find any fault,Jul,2017,Jul 2017,2017-07-01,2017,4
Tivoli Carvoeiro Algarve Resort,ericklei,2,erickleiwrote a review Apr 2016,"We had a very pleasant stay in your hotel. Very good service and a beautiful view.the breakfast was good too., a lot of choices. The garden with swimmingpool was relaxing. Unfortunately we could not go to the beach because it is too dagerous because of falling rocks.",Apr,2016,Apr 2016,2016-04-01,2016,4
Saccharum,Ben Gee,0,Ben Geewrote a review May 2022,"We haven't even checked out yet but I have to write this glowing review. This hotel is amazing! First and foremost the staff provide the absolute best service and are so kind, attentive and go the extra mile to make your stay special. We have had a double celebration with an anniversary and birthday and on both occasions the staff have remembered and complimented us with champagne in our room, a lovely surprise....thank you so much! Our room is perfect with the most idyllic view and I thank the cleaning staff for the welcome tidy and perfectly clean room that we come back to each day. The hotel as a whole is luxurious, relaxing and extremely peaceful and we especially love the 8th floor facilities with infinity pool and its incredible views and the whole layout centred around the bar/restaurant. We had the most memorable afternoons lazing on this level gazing out on the beautiful ocean in front of us. Other details? Breakfast - so many choices, something for everyone and fresh delicious food as well as champagne if you're in the mood for celebrating like we were. As I've said before, the staff are beyond brilliant! People making other people happy, it's that simple! No fake charm, genuine human warmth! Thank you Saccharum, we will be back again, and again and again......",May,2022,May 2022,2022-05-01,2022,5
Villas D. Dinis Charming Residence Adults Only,TheWrights72,48,TheWrights72wrote a review Oct 2019,"Great place to stay and visit Lagos. Only a 15 min walk from Lagos and a 5 min walk from the best beach in the area. This is an adult only hotel so quiet and restful. It has 3 pools, well equipped rooms and the most stunning breakfast selection. The staff are very helpful and friendly. The hotel is clean and the maid service is unobtrusive and excellent.",Oct,2019,Oct 2019,2019-10-01,2019,5
Torel Palace Porto,Vanessa T,1,Vanessa Twrote a review May 2024,One of the best hotels we have stayed. The staff were so kind and helpful and the service was second to none. The breakfast was everything one could wish for and any request was accommodated. We dined one night at Blind and had an exceptional meal.,May,2024,May 2024,2024-05-01,2024,5
"Reid's Palace, A Belmond Hotel, Madeira",baar2018,2,baar2018wrote a review Jan 2018,Great hotel with an breathtaking lovely garden and surroundings. Location of the hotel is perfect - great sea-view and just next to Funchal.Nice big rooms and great bathroom with all you can dream of.Very helpful and friendly staff.Breakfast is fantastic.,Jan,2018,Jan 2018,2018-01-01,2018,5
"Reid's Palace, A Belmond Hotel, Madeira",Paul B,14,Paul Bwrote a review Jul 2017,"We visited with friends for afternoon tea and it was 5 star service and and experience that everyone should try.  It will be expensive however it is bound to be given where you are visiting.  We were impressed and suitably wowed.We also had a tour of the hotel be the reception team which was an added bonus.  It was great to share in their passion about the history of such a prestigious hotel and see exactly what we could get if we had £5,000 for a night in the presidential suite-awesome!Finery at its finest-thank you",Jul,2017,Jul 2017,2017-07-01,2017,5
Tivoli Carvoeiro Algarve Resort,janisScotland,62,janisScotlandwrote a review Jun 2017,"Just back from a week at this hotel.  Nice enough hotel but definitely not 5 star. The room we had was lovely  beds  and pillows very comfortable, also the view was fabulous. We were on the 4th floor with large balcony which had the sun for most of the day. This was the highlight of the holiday.  Most of the negative points raised in other reviews still apply, with exception of the Spa which opened while we were there. Before going I felt people were being a bit picky, however the management don't seem to be taking any action to rectify points raised. Air con not good, toaster is not up to the job. No shuttle bus available. Also you need to be fairly agile to go to the beach at the hotel, steps down don't take you the full way,  Only one restaurant available in the evening with limited menu. Mostly fish dishes. What we had was very nice, however we had to eat out for a bit of variety. Staff seemed fairly efficient and pleasant. Most days our room was not cleaned until nearly 4.00, and then turned down just after seven. Not efficient time management.I am being quite harsh with my review mainly due to my expectations which unfortunately were not met.Also check your bill carefully as we were charged for drinks twice. Only noticed when we got home.",Jun,2017,Jun 2017,2017-06-01,2017,3
Crowne Plaza Vilamoura,Revolver_Cenous,7,Revolver_Cenouswrote a review May 2017,"Everything about this hotel was excellent. The atmosphere, the service, the cleanliness and the food were all outstanding. When we arrived a very polite and friendly gentleman took our bags for us whilst we checked in and then brought them to our room afterwards. The breakfast choice each day was outstanding, certainly something for everyone and everything was constantly being refilled and topped up when running low. The staff were very attentive and would check if you wanted any tea or coffee bringing to your table. They were also happy to assist you with anything else you needed like local bus times or other information. The location is also very good, right on the beach front and only a short walk from the Marina. The pool was great with staff on hand to provide towels and cushions for the sunbeds when required. The price of drinks in the hotel were slightly higher than elsewhere, but it is more than worth it for the service you receive. I would definitely stay here again for another relaxing holiday!",May,2017,May 2017,2017-05-01,2017,5
