hotel_name,reviewer,helpful_votes,date,text,month,year,extracted_date_str,extracted_date,year_int,sentiment_score
Vila Gale Nep Kids,Culture17524367894,0,Culture17524367894wrote a review Apr 2024,"The Hotel is for kids, designed for kids, and with kids in their mind… taking this into consideration, it was a very cool and funny experience for my 2 daughters, aged 8 and 6. They had a blast.Special thanks for @TioBolinha, @TioZeca and @TiaAriel, among the remaining team, they made the experience outstanding for the kids.",Apr,2024,Apr 2024,2024-04-01,2024,5
Villas Barrocal,CaptainRed_11,7,CaptainRed_11wrote a review Nov 2012,"We really enjoyed our stay here, excellent value for money. A spacious, clean, fully equipped apartment. Nice pool area, friendly and helpful staff. Nice location in a small, tranquil village, although a car would be advisable. However there is a nice restaurant within walking distance.",Nov,2012,Nov 2012,2012-11-01,2012,4
Jupiter Albufeira Hotel - Family & Fun,Paul E,9,Paul Ewrote a review Oct 2019,"Just got back after a lovely relaxing week at the Jupiter.  Staff great, food great, rooms great, entertainment good and drinks good.  And the but?  Well the dinning hall (Its not a Resturant) is a problem albeit the food as i said is great.  When you arrive at the dinning Hall your room key is scanned and then your are on your own!  First job is to try and find a table, then one of you stays with the table whilst the other one gets their meal; swap places and hopefully you will be eating a warm meal together!  Then you take turns getting the next course in case the table gets cleared and someone jumps in and claims the table... bit stressy to be honest and something that should be fixed both easily and quickly.  Great coffee from the bars but the coffee from the machines in the dinning room, when they work, is a bit meh.The Hotel has a very minimal/contemporary/sharp interior and that is also reflected in the furniture and lack of any art work; we really quite liked the look.  Overall, I would say that this Hotel is a must for families but if you are a couple be reminded that kids are kids so be prepared.  On the positive there is plenty of room around the Adult Pool, good quality beds and immaculately clean; bit chilly (22Degrees) at this time of year though!",Oct,2019,Oct 2019,2019-10-01,2019,3
Belmar Spa & Beach Resort,PhilC49,1,PhilC49wrote a review Jun 2015,"Stayed in a two bedroom apartment in Block B. The standard of this spacious accommodation was excellent – kitchen looked brand new and bathrooms (2) were extremely clean and well appointed.  Twice weekly changing of towels and cleaning by a team of cleaning staff was swift and unobtrusive. The location of the hotel/apartments is excellent being only a 5 minute walk to the nearby lovely beach of Praia de Porto de Mós. Alternatively there are numerous other beaches in the area only a short drive away. Breakfast selection was sufficient though expensive at €52 for a family of 4 – reverted after day 1 to self-catering – visiting each morning the small local supermarket SuperEureka for freshly made croissants and breads. Hotel Bar area was a little sterile – it would have been nice to able to sip cocktails overlooking the beach and sunset rather than the hotel reception area. Didn’t eat in the hotel restaurant, instead visited O António’s on the local beach, O Camilo overlooking Praia do Camilo plus Lagos restaurants. A taxi into Lagos centre at night costs approx. €7 each way. Our taxis were ordered from reception very efficiently and arrived within 5 mins.",Jun,2015,Jun 2015,2015-06-01,2015,4
Belmar Spa & Beach Resort,ColinSmith2,40,ColinSmith2wrote a review Sep 2012,"Stayed for a couple nights on our way along the Algarve, great hotel, very clean and modern. Good location close to the beach, though a five minute drive to town. Make sure you walk along the cliffs between the hotel and town.",Sep,2012,Sep 2012,2012-09-01,2012,4
Jupiter Albufeira Hotel - Family & Fun,Tinkerbell1987,107,Tinkerbell1987wrote a review Jun 2023,"Just back from a recent 2 week family holiday in May and I was honestly so sad to leave this place. It’s honestly amazing for young families. The hotel complex has so much to offer in terms of activities and things to do. The entertainment staff are incredible and so hard working. I cannot fault them, they were excellent with my young 4 year old son.The hotel is clean and spacious and the restaurants are lovely with great selection of food.The hotel is about 35/40 min walk from the old town so my tip for anyone going is to download the Uber app as they arrive so quickly and it’s really cheap compared to the UK fare prices.If I had to be really pernickety and pick faults with the hotel the only negatives I could comment on would be the lifts and the pool temperature. The lifts are very busy at certain times of the day and maybe not enough of them to accommodate the size of the hotel and the guests staying.The pools are lovely and clean but are definitely on the cold side, they could do with being turned up even just a few degrees as I think personally it was too cold for really young children and babies.Having said that it wouldn’t put me off staying here again and I hope to visit again in the future.",Jun,2023,Jun 2023,2023-06-01,2023,4
Jupiter Albufeira Hotel - Family & Fun,am4193,0,am4193wrote a review Apr 2023,"We loved every moment of our visit to the Jupiter Hotel. The staff and Portuguese people we met were all very helpful and friendly and could not do enough for us. We had 7 days of sunshine and the temperatures were around 22-25 degrees during the day which allowed many hours of fun for our children on the water slides and pools. The water slides are great feature and we all had great fun on them. Our boys also loved the football pitch and played football during the day and in to the evenings. The pool areas are great for adults and kids and have splash areas and slides for younger kids as well as the main water slides. The main pool has a swim up bar which is great, there is also a snack bar which is self service and you can pour your own drinks. You could always find sun loungers available at any time of the day which was great as we believe the hotel was 90% occupied at the time. The hotel also has a separate quiet pool which is fantastic if you want to chill out, we found this a lovely area and there was always sun loungers available at any time of the day.The food and service throughout our stay was fantastic and we always had a good meal with plenty of choice at the buffet. The AI bar and the rooftop bars were also very good and we loved going up to the rooftop bar to watch the sun setting. We never really encountered any ques at the bar and even if there was a few people in front of you, normally you were served within a couple of minutes as the hotel had plenty of staff at each bar. The entertainment at night was good as well, normally having discos etc... for younger children. They have a kids club during the day as well and there is always things happening for the children at the pools.This was a fantastic family holiday and we cant wait to come back!",Apr,2023,Apr 2023,2023-04-01,2023,5
Vila Gale Nep Kids,Tour58232432273,0,Tour58232432273wrote a review Aug 2025,"I really liked the animators and entertainments.The hotel is fantastic, but I would like the hotel to give for people over 12.",Aug,2025,Aug 2025,2025-08-01,2025,4
Lisbon Destination Hostel,richards_jenna,1,richards_jennawrote a review Sep 2015,The most welcoming Hostel that feels like a home. They provide so many fantastic day trips&local experiences such as traditional Fado nights&meals prepared by a Portuguese chef. Would recommend to anyone,Sep,2015,Sep 2015,2015-09-01,2015,5
Valverde Lisboa Hotel & Garden - Relais & Châteaux,Cathy,0,Cathywrote a review May 2023,"The garden is absolutely stunning and once inside you literally feel like u are inside an oasis , tranquility with a touch of luxury!  The staff are discreet and professional. The hotel is filled with treasures. Special thanks for the manager Christelle Penven for her attention to details and politeness.",May,2023,May 2023,2023-05-01,2023,5
Dona Filipa Hotel Vale Do Lobo,Stirlingtec,63,Stirlingtecwrote a review Oct 2020,"Once again stayed at Dona Filipa and played San Lorenzo. Hotel was its usual, really nice, breakfast excellent and bar area very accommodating. The old classic rooms are getting a bit dated and it would be nice to see the hotel bring them up to standard of the new rooms. However, we love it and come back year after year.",Oct,2020,Oct 2020,2020-10-01,2020,4
Hotel Madeira,Ian R,28,Ian Rwrote a review Jun 2019,"Three star hotel in great location in the heart of Funchal. We had bed and breakfast. Rooms are basic but clean, but there can be some traffic noise. Breakfast was very good great selection and plenty of it. Rooftop terrace and pool have great views out over the city and harbour. Staff are very friendly.",Jun,2019,Jun 2019,2019-06-01,2019,3
Dona Filipa Hotel Vale Do Lobo,Paul,4,Paulwrote a review Feb 2016,"First time at this hotel and it was great. Prompt and courteous service from all of the staff, nothing was too much trouble. Stayed here during a 5 day golf trip and the free facilities for storing clubs was very helpful. We dined out each night so I cannot comment on dinner but the breakfast each morning was excellent, especially the omelettes. I would highly recommend this hotel",Feb,2016,Feb 2016,2016-02-01,2016,5
PortoBay Serra Golf,Rullax,7,Rullaxwrote a review Apr 2018,"Very nice, small and clean hotel. Hotel room could be renowated, but everyting worked well, except the hairdryer that was the end of it's lifecycle. Bed was very comfortable. Swimming pool and sauna were great. Breakfast and dinner very good. Acces to golf course  near and a buggy comes and picks you up to the club.",Apr,2018,Apr 2018,2018-04-01,2018,4
Valverde Lisboa Hotel & Garden - Relais & Châteaux,Alexandre V,18,Alexandre Vwrote a review Sep 2023,The hotel is very beautiful and taken care of down to the smallest detail. All attendants are very good and well trained. This delighted everyone. Mainly those at reception. Comfort and cleanliness are very good!!,Sep,2023,Sep 2023,2023-09-01,2023,5
Pure Fonte Velha Bed and Breakfast,Antonio Araujo,97,Antonio Araujowrote a review Jul 2020,A really lovely and cozy place to stay. Super clean and with the kindest owners. Really close to all kind of restaurants and with great facilities. The breakfast was incredible the we had a realyl amazing time exploring the area.Highly recommended !,Jul,2020,Jul 2020,2020-07-01,2020,5
Quinta Nova Winery House - Relais & Châteaux,SaboChabo,80,SaboChabowrote a review Aug 2017,"Absolutely amazing vineyard setting - panoramic views down to the Douro valley; and great common facilities to lounge and relax around this Quinta.There is a restaurant that serves set menu for lunch/dinner; while tapas and simple lunches are also available for hotel guests.Having a light meal and some wine at the outdoor terrace tables were an absolute delight.Winery visit was excellent, with a new visitor centre/ little museum.What perhaps can be improved a bit was the rooms - rooms (we had the standard terrace room) are decent enough but nothing to write home about.  Cleaniness was good.  Minor issue was the door which creaked for our room.  Air con placement not very practical either (on the floor next to the bed)All in all - great stay at a stunning part of the Douro valley.",Aug,2017,Aug 2017,2017-08-01,2017,4
Casas do Porto - Ribeira Apartments,anodent,1,anodentwrote a review Aug 2015,"It locate in the center of the downtown,and just a few walks to riverside. The staff is very friendly and helpful, Every restaurant he had suggested was very good and he can reserve for you. I love this city and will soon back and stay here.",Aug,2015,Aug 2015,2015-08-01,2015,5
Luna Clube Oceano,Ruth B,8,Ruth Bwrote a review Aug 2017,"Well worth the money, I'm so happy I got to stay here. Beautiful area and such a clean complex from the reception right through to the apartment. From early on the pool had people at it but we never stayed by the apartment. Five minutes to both the New Town and Old Town strip and it's no more than €5 each way in a taxi. I'd recommend getting a taxi to and from the Old Town. There's a bit of a hill up to the New Town strip but it's a nice enough walk home and not too far. The staff were extremely helpful. Only downfall was the restaurant as the service was quite slow. One of the days we left before even being served and my only problem was that there was only one family in the restaurant at the time. I mentioned this when leaving so hopefully it will be acted upon as I don't know what it would be like during busy hours. Overall I'm extremely delighted I spent my week here and it was more than worth the money.",Aug,2017,Aug 2017,2017-08-01,2017,4
Lisbon Marriott Hotel,Huntages,18,Huntageswrote a review Dec 2013,Very we'll appointed hotel. Convenient for two metro stations both 15min walk that serve the city centre and the mall should you choose it. Ample breakfast served through convenient times. My only disappointment was with one of the reception staff who found every single one of my requests a chore. Approx €13 from the airport.,Dec,2013,Dec 2013,2013-12-01,2013,4
Lisbon Marriott Hotel,Martijn D,16,Martijn Dwrote a review Sep 2017,Looked good and is quite clean. Several services provided and swimming pool.Service fe check-in are quite slow and unefficient. They made a mistake but called next morning police without explaining problem. The receptionist can make mistakes but a hotel like this should first solve this with client before calling police for 150 euro.It is in fact a remote area as well.,Sep,2017,Sep 2017,2017-09-01,2017,3
Algarve Surf Hostel - Lagos,Jason V,0,Jason Vwrote a review Sep 2015,"Out of all the hostels I have stayed at for the last two months of travels around Europe this hostel has definitely been the best. From the hospitality and smiles that you are welcomed with and the best tips and tricks they give you to really experience what Lagos is really about. The breakfast in the morning was one of the best parts of this hostel. They always had a variety of munchies on the go wether you were hung over or just hungry. Wendy took the time to organise the best boat party, took me and my friends kayaking, surfing, cliff jumping and out into town for feeds and to experience the night life. 10/10 no doubt!",Sep,2015,Sep 2015,2015-09-01,2015,5
Independente Principe Real,Saori M,0,Saori Mwrote a review Apr 2013,"I stayed at the Independente for about a week and had an amazing time. Not only were the rooms and bunk beds really cool, but the whole hostel had a hip, modern vibe and it was very easy meeting new people. I traveled alone but I would also highly recommend it for people traveling with friends. The staff was extremely friendly as well, and informed me of all the good sights to see in Lisbon. I fell in love with the city, and I would definitely go there again if I have the chance!",Apr,2013,Apr 2013,2013-04-01,2013,5
Luna Clube Oceano,sally n,13,sally nwrote a review May 2017,Very cleanFriendly staffGood locationLovely cafes around the hotel that do beautiful breakfastBeach nearbyStayed in a studio which was ideal for us as a coupleVery spacious very cleanLovely shower in the bathroomPool area was lovely also and no issue with beds been reserved i.e. Towels left out no one does itWould definitely stay here again if I came back to Portugal,May,2017,May 2017,2017-05-01,2017,4
"Reid's Palace, A Belmond Hotel, Madeira",927terry,0,927terrywrote a review Sep 2024,"We were welcomed at the door with sparkling wine.  The room was gorgeous and immaculate.  The food was delicious, anything and everything was at your fingertips.  The service could not have been any better.  The setting so relaxing, one never wants to leave.",Sep,2024,Sep 2024,2024-09-01,2024,5
PortoBay Liberdade,juls21,147,juls21wrote a review Oct 2016,"My husband and I stayed here for 4 nights in early October.  The hotel is lovely.  The beds are so comfy and the rooms are very clean and inviting.  The hotel is up a side road off the main street and approximately 15 minutes walk from the main squares with some great cabins serving food and drink on the way down into the main square  Unfortunately, I have to mention the building works going on opposite the hotel; we were in room 635 and on opening the curtains we were faced with a building site!  This is not the hotels fault I know, but nonetheless it is a building site with banging and clunking work going on from 8 in the morning.  After 2 nights and being woken at 8 each morning (which I know is not early but this was a treat for my husband and I and I wanted to wake when I was ready not because of building work) I asked to move rooms; I was told there was only a disabled room available at the back of the hotel on floor 2; this was fine for us although no bath it was very quite which was great.The downside to the rooms though has to be the bathrooms; they are ok not 5 star though to be honest and the door is awful; it is an opaque glass door that slides shut giving very minimal privacy and the doors rattle as they are being closed; you really need to know someone well when staying here!!My other gripe for a 5 star hotel was the coffee situation; a welcome tray is in the room with a coffee making machine which has pods; the pods in the room are included 2 regular coffees, 2 decaf and 2 teas, once these are used you have to pay 2 euros 50 for pods; I have never in all the 5 star hotels I have stayed in had to pay for refill welcome trays.I have to mention Daniel who is a wonderful asset to this hotel; he was always there to greet us with a friendly chat and a smile and he knew our names and used them from day 1!All in all although I have listed a few negatives the hotel was lovely and I would recommend staying there but only at the rear of the hotel.",Oct,2016,Oct 2016,2016-10-01,2016,4
Royal Savoy Hotel,Peter H,270,Peter Hwrote a review May 2019,"We obtained an apartment many years back and delight in the facilities afforded by the Royal Savoy. All apartments face the sea and there is no noise from the road. The most comfortable of all the resorts we have ever stayed in. Almost all you could ask for except they cannot adequately provide for vegetarians. One of the two outside pools is heated. The second I have never entered! A sea option at one end, if the swell is not too great.",May,2019,May 2019,2019-05-01,2019,5
"Reid's Palace, A Belmond Hotel, Madeira",Jim H,7,Jim Hwrote a review May 2017,"Spent 5 days at Reid's. Generally my wife and I really enjoyed our stay. The hotel is exceptionally well positioned with a beautiful view over Funchal. It is a great place for relaxing with excellent swimming pools and a tennis court. Most of the guests seemed to be retired Brits and the atmosphere was like a club. The staff were  very pleasant and the service excellent. The food was generally very good but because we like to eat early we had most of our evening meals at a local restaurant. There are many and they are reasonably priced. Our only criticism is that the coffee at breakfast was terrible, but then most hotel coffee is. We were not impressed with the Cipriani restaurant in the hotel grounds which serves very ordinary food at a high price and was clearly unenthusiastic about a couple who did not have wine.Nothing to do with the hotel, but think carefully before hiring a car. I am a very experienced driver but I took the rental car back early because driving on the island was far too stressful. Also, when walking to the town, you may be offered free trips in exchange for visiting a hotel and listening to sales patter. Do NOT do this!",May,2017,May 2017,2017-05-01,2017,3
Saccharum,gottrup_friis,121,gottrup_friiswrote a review Dec 2017,"We stayed three nights at the hotel. The rooms have a lot of space and we had a room with sea view which is very nice. The beach in front of the hotel has a lot of stones so we can recommend that you bring bathing shoes, the water is clean and nice. You pay 5 Eu if you need an umbrella at the beach because it is a public beach.The terraces are very open at the sides so if your neighbor is smoking it is quite annoying - we suggest that smoking should be prohibited at the terraces. Despite of the smoking issue the terraces are very nice.The breakfast was ok, but quite ordinary considering that is a 5 star hotel.Good things: USB charger, service minded staff, very good beds, lovely terrace, coffee at the room. The area is quiet, and there are a lot of things to do nearby but we recommend that you have a car.Bad things: heavy smoking neighbors, fridge does not cool much, the hotel and the rooms are rather dark, parking is not for free, the prices at the restaurant are high, but you can eat at the good local restaurants at the marina next to the hotel - especially New Era serves delicious food.",Dec,2017,Dec 2017,2017-12-01,2017,3
Royal Savoy Hotel,david1964taylor,0,david1964taylorwrote a review Nov 2015,Underwhelming reception and frontage but very nice bedrooms and lounge areas.Staff very helpful and efficient particularly in the restaurant but food was limited compared to other properties stayed at in the vicinity. External poolside facilities very good and no shortage of seating.,Nov,2015,Nov 2015,2015-11-01,2015,4
SANA Capitol Hotel,roadrunner0820,150,roadrunner0820wrote a review May 2014,This was our second stay at Sana Capitol and it remains great value. Clean with excellent buffet breakfast. Staff is helpful and speak multiple languages and all very friendly. great location near subway and lots in walking distance. Several small family run restaurants within 1 block. Definitely recommended,May,2014,May 2014,2014-05-01,2014,5
Torel Palace Porto,Maria Elena M,1,Maria Elena Mwrote a review May 2025,"We spent three days at this property, one of which was in full blackout. Staff more than professional, he did his best to minimize discomfort. suggestive and beautiful structure. The main staircase takes you back in time. Great experience",May,2025,May 2025,2025-05-01,2025,5
Torel Palace Porto,viviane c,0,viviane cwrote a review Nov 2024,"Home was perfect and smilingThe breakfast buffet excellent, and variedThe impeccable beddingKindness of all staffExcellent palace that deserves its 5 starsWe will definitely return for a new stay in Porto",Nov,2024,Nov 2024,2024-11-01,2024,5
PortoBay Liberdade,braaschristiane4,0,braaschristiane4wrote a review May 2024,Very satisfied will recommend the hotel Location very good Reception very friendly and helpful,May,2024,May 2024,2024-05-01,2024,5
Tivoli Carvoeiro Algarve Resort,davidfM8976AT,0,davidfM8976ATwrote a review Aug 2017,Stayed for a week at theTivoli and had a lovely holiday.Hotel is very nice as are  the rooms that are well equipped. Views are stunning from sea view rooms.Complimentary tea and coffe would have been a nice touch.The staff are very friendly although restaurant service was a little slow at times.Breakfast was very good with a good selection but get there early to avoid waiting.Evening meal could have been a bit more 5 star as choice was a little limited.Consider swapping evening meal for lunch in order to eat out if going half board to avoid getting bored .Be warned if you like to get up early to reserve a sunbed then disappear !!Overall a great place to stay and we will visit again😊,Aug,2017,Aug 2017,2017-08-01,2017,4
Dream Chiado,David S,142,David Swrote a review Nov 2018,"We chose the Dream Chaido Apartments for it location and elevator. After all day walking up and down the hills of Lisbon it was nice to get a ride to your room and the location was perfect. The room was specious, with a kitchen/eating alcove and a very nice bathroom. Service was good.",Nov,2018,Nov 2018,2018-11-01,2018,4
"Borralha Hotel, Restaurante & Spa",Pedro Lisboa,1,Pedro Lisboawrote a review Jul 2024,"We congratulate this magnificent hotel. Missing only a stunning landscape over the pool, all we have to say is the staff and the way we were welcomed. Apart from the quiet in the pool hours, the reception, care and affection of the staff is stunning. Our congratulations to all of them, but especially to Mr. Luis who will make us come back one day. The food in the restaurant is from another world, very well served and prepared.",Jul,2024,Jul 2024,2024-07-01,2024,5
Tivoli Carvoeiro Algarve Resort,simon b,0,simon bwrote a review Jan 2019,"Having just retuned from a 3 night stay I cannot rate this hotel, rooms and restaurant and staff highly enough. The hotel ticks all the boxes for comfort, intimacy for couples young and old, not very suitable for children. The location is picture perfect, I will definitely be returning.",Jan,2019,Jan 2019,2019-01-01,2019,2
Pestana Viking,Douglas D,26,Douglas Dwrote a review Mar 2019,"This was a great find.  Right by the water, perched on the cliffs.   It's a short walk to the beach, many good restaurants are within walking distance and a great central location to do a driving tour of the Algarve.The restaurant on site is alright, but the pricing for supper is a little bit expensive for what you get.  However, the included breakfast buffet is excellent, if somewhat generic and repetitive.  But it is good and the food is fresh.The staff are very helpful and professional, my wife and I will return.",Mar,2019,Mar 2019,2019-03-01,2019,4
