hotel_name,reviewer,helpful_votes,date,text,month,year,extracted_date_str,extracted_date,year_int,sentiment_score
Belmar Spa & Beach Resort,Sukh Pabial,0,Sukh Pabialwrote a review Apr 2022,"Excellent resort. Stayed with my 3 kids in a 3-bed apartment. The apartment was great, and we enjoyed the outdoor pool and indoor pool. The on-site restaurant, Levante, is great for breakfast and have really good options for lunch and dinner. For our first holiday abroad since the beginning of the pandemic, we couldn't have wished for a better stay.",Apr,2022,Apr 2022,2022-04-01,2022,5
Jupiter Albufeira Hotel - Family & Fun,Will,13,Willwrote a review Jun 2022,"Highly recommend this hotel, just maybe address the slamming of doors closing every night.Apart from that amazing hotel and staff are so helpful.The bed was pretty hard too and every morning i woke up with a sore back, but maybe just me getting older.........",Jun,2022,Jun 2022,2022-06-01,2022,5
Mayer Apartments,shelleyc1982,0,shelleyc1982wrote a review Apr 2016,"Just spent a wonderful 7 nights here for a family Easter break.Jan was very helpful, immediately changed my apartment for me to a lower floor so it was easier with the kiddies.Lovely bottle of wine to welcome us, and the apartment was spotless, with maid service every day.Pool area very clean too!Also, had a lovely sea view!Would really recommend here!",Apr,2016,Apr 2016,2016-04-01,2016,5
Belmar Spa & Beach Resort,Noelia T,24,Noelia Twrote a review Aug 2016,"We had the pleasure of spending 5 nights at Belmar at the end of July.  We were pleased with the resort the moment we arrived.  The checkin was quick and the front desk very professional.  The lobby is beautiful with a zen feel - water walls, quiet places to sit, reflection pool.  We had a 2 bedroom apartment in the main building and to our surprised we had a magnificent unobstructed ocean view (room D1G).  The apartment was well equipped and modern.  The beds were very comfortable.  Plenty of space for our family.  The beach is right across the street and it's great beach for families.  Fine sand and clean water.  We loved Porto de Mos beach!  There are two  restaurants at the beach plus a cafe/ice cream spot.  The indoor pool was a hit with the kids as the outdoor pools are not heated and rather cold. We did rent a car for 3 days because town was a good 40 min walk - 2 kms away. The front desk did it all for us.   We did tour Sagres and Cabo San Vicent as well as Pont da Piedade and surrounding areas.  We enjoyed going into Lagos centre for dinners and shopping.  .  We would  recommend this hotel and location.  Loved Belmar, loved Lagos and hope to return.",Aug,2016,Aug 2016,2016-08-01,2016,5
Belmar Spa & Beach Resort,ArcfireSG,215,ArcfireSGwrote a review Nov 2013,"Had a really good week here in late October. The location is superb, less than 100m from a great beach with two nice restaurants. Short drive to the centre of Lagos. The hotel itself is good, average 4 star. The 2 bed apartment was fine, good kitchen, two balconies, washing machine and dishwasher.Beds are like slabs of concrete like most places, this alone means I won't return. Shower is not great, no overhead just hand held in a holder.Staff are very friendly and helpful. Good spa and indoor pool which is good for Oct. Bar is not appealing and we never ate in hotel with two good restaurants on the beach just down the road.Apartment was only cleaned twice in the week.All in all enjoyed the visit though purely based on location, not on facilities.  I need a good bed and shower and this had neither.",Nov,2013,Nov 2013,2013-11-01,2013,3
Belmar Spa & Beach Resort,Margareth J,0,Margareth Jwrote a review Apr 2025,"Everything was perfect during our stay. We celebrated my sister’s birthday and everyone at the reception, service and restaurant were very friendly and punctual, making the surprise very successful. I would only suggest adding a blackout curtain option in the sleeping room.",Apr,2025,Apr 2025,2025-04-01,2025,5
Jupiter Albufeira Hotel - Family & Fun,Loumarie1984,6,Loumarie1984wrote a review Sep 2025,The Jupiter hotel is by far the best hotel we have stayed it . Everything about it was amazing . Will definitely be going back,Sep,2025,Sep 2025,2025-09-01,2025,5
Belmar Spa & Beach Resort,K M,10,K Mwrote a review Jul 2024,DISGUSTING- avoid this place1.  DIRTY2.  OLD3.  BEDS ARE A JOKE- like cinder blocks4. RUDE staff5.  fitly dirty condos6. half the resort not in serviceSheets were filthy dirty- towels are like paper towels and dirty- floors were dirty - couch was disgusting,Jul,2024,Jul 2024,2024-07-01,2024,1
Lisbon Destination Hostel,territakespics,36,territakespicswrote a review Jan 2018,"My husband and I stayed here right before Christmas and since it was our very first stay in a hostel, I was a bit apprehensive. We're mature travelers so I wasn't sure if we'd fit in or not. My fears were totally unfounded as we were made to feel welcome as soon as we arrived. The staff were all very friendly and helpful and answered all our questions cheerfully. They made our stay extra special. There were other over 40 folks staying as well and we enjoyed relaxing and chatting with fellow travelers in the lounge area in the evenings.Besides the terrific staff, other positives for me were the security measures in place, the common areas, the bar, and the refreshments cooler. Once we were in for the night, it was nice to be able to get a beer without having to go out again. Our room was basic with a comfy bed, desk, night stand, wardrobe, and chair. No TV but it did have a mini-fridge which I didn't expect. Also, the staff left some wine, water, and cookies in our room which was a very nice touch. We had a bathroom in our room which consisted of a toilet, sink, and a very small shower. I couldn't turn around in the shower so that may be a problem for a larger person. That's a small thing in an otherwise very great stay!",Jan,2018,Jan 2018,2018-01-01,2018,4
Dixo's Oporto Hostel,Rogerio J,78,Rogerio Jwrote a review Aug 2015,"if you don't mind to share the room with other people this is the right place,even you can do your own thing,great location,really nice clean,awesome staff very helpful,,plus the prices are very good ,showers and toilettes clean .Was a good experience ,a place to go back for sure. Very beautiful decoration",Aug,2015,Aug 2015,2015-08-01,2015,5
Dixo's Oporto Hostel,Atraveller87,7,Atraveller87wrote a review Sep 2011,"There aren´t bad things to say about this hostel. The owners has created a good atmosphore in this hostel, it´s at the same time lively and calm; you can easily make friends and go out in the surrondings and also rest at night in one room of the several flats that this house has. The decoration is also well-designed. Breakfast is ok and the views form the terrace very nice. I recommend to have some coffe or drink at the terrace and chill out with some friends.Stay in this hotel and you´ll enjoy oporto.",Sep,2011,Sep 2011,2011-09-01,2011,4
Grand Muthu Forte Do Vale,johnpw1,34,johnpw1wrote a review Aug 2016,"Just come back from a week at FdV. Stayed on sc basis although used restaurant which was fine.2 bed apartment was large and had everything you needed. Staff were friendly, helpful and gave a good impression. Reception staff in particular very good. No stag or hen parties, with hotel quite quiet overall.Location was great with easy walk to both old town and beach. Will certainly be back, on sc basis. May consider all inclusive but it's really full board.",Aug,2016,Aug 2016,2016-08-01,2016,4
Lisbon Happy Hostel,sigmund84,13,sigmund84wrote a review Mar 2012,"When we got to Lisbon happy hostel we thought we got the wrong addressThere is no sign or anything showing that there was an hotel or hostel in the buildingThe restaurant next to it had a huge table and therefore we couldn't get in the building easilyThe room was pretty and basic so was the toilet but overall very nice.Kitchen was good, free food and clean spaceWifi was not working properly especially because we were located at the end of the corridor.The girls Woking there were nice but their English was not that goodI would love to revamp that hostel. It needs help to get attention out there",Mar,2012,Mar 2012,2012-03-01,2012,3
1908 Lisboa Hotel,Karen R,0,Karen Rwrote a review Jun 2018,"My husband and I recently added on three days to our visit to Portugal and chose the 1908 Lisboa Hotel.  Located within a convenient walk to get anywhere, the hotel is beautifully refurbished and updated.  The building shape is noticeably unique with a triangular shape.  We spotted it right away.  As soon as we walked in, the service was outstanding.  Andrew took care of our car, arranged our luggage, showed us around the room pointing out all the features to make ourselves comfortable, namely the air conditioning and free phone to use with internet as we explore the city.  We were welcomed with a private “get to know the city” talk from Joann.  She spent at least 30 minutes showing us the map and helping us to plan or next 2 days.  She set us up with the bus tours, restaurant suggestions, and a wonderful private tour to Sintra.  We would not have been able to enjoy the city so efficiently without her guidance!  thank you to both Andrew and Joann!Awesome experienceWould love to come back!K and R RasconArizona visitors to PortugalPS the beds were super comfortable andThe breakfast we enjoyed each morning was superb!",Jun,2018,Jun 2018,2018-06-01,2018,5
Lisbon Destination Hostel,Rebecca,41,Rebeccawrote a review Apr 2015,"After staying in about 20+ hostels, this is one of the best I have ever stayed at. The staff is extremely welcoming and enthusiastic about Lisbon. I traveled there by myself and was able to meet so many great travelers from all over the world that were around my same age. Any question you had, the staff was able to help you and everything was kept very clean. I highly recommend eating the hostel's food. The chef is very good for a great price! Additionally, it is a very safe hostel with individual boxes in each room to lock up and 24 hour front desk attendants. I would highly recommend this hostel to my other friends traveling to Lisbon.",Apr,2015,Apr 2015,2015-04-01,2015,5
Lisbon Destination Hostel,livingskywines,1,livingskywineswrote a review Feb 2016,"This is probably the best located hostel we have ever stayed in. We are quite a bit older than the usual hostel crowd but fit right in - the Portugese buffet was wonderful, breakfasts lovely and lots of opportunity to meet other travelers. Our double room with a private bath was clean and quiet.",Feb,2016,Feb 2016,2016-02-01,2016,5
Dona Filipa Hotel Vale Do Lobo,EKO600,0,EKO600wrote a review Jun 2014,A hotel with excellent location and excellent service. We enjoyed every minute of our holiday. A breakfast with everything you can wish for and free transportation within the area. Also enjoyed a round of golf at our favourite course San Lorenzo!,Jun,2014,Jun 2014,2014-06-01,2014,5
Grand Muthu Forte Do Vale,Andy P,4,Andy Pwrote a review Jun 2017,"We stayed Forte Do Vale and had a superb holiday in May 2017.  We had a one bedroom apartment that was superbly serviced by Svetlana every day except Sundays.  While the room did not overlook the pool, we were lucky enough to have a west facing room with a nice balcony where we could wind down with a glass of Spumante from a hectic day of winding down, watching the sunset enabled us to re-charge our batteries for the evening ahead.  Spumante has re-invented itself and we found it tastier than Prosecco.The hotel is very spacious and the staff are superb.  We didn't eat in the restaurant although the menu and food looked good and we tended not to use the bar except for an aperitif.  We did use the pool area every day.The great thing about the hotel is that it is split evenly between 'The Strip' (if that's your thing and the the beach area.  A slightly further walk is the Old Town which is serviced by a road-train that happens to stop at the hotel.  Good atmosphere.  There are too many good restaurants to mention.We hired a car at approx 7.50Euros per day through Gold car and they were excellent - the car was booked a month before travelling and it enabled us to travel to many good beaches and towns.  We also bought insurance in the UK as it was cheaper.There are a bout 5 MGM hotels in Albufiera and we thought ours was the best - the others were under construction. so didn't have a pool etc.We will probably return to Forte Do Vale.",Jun,2017,Jun 2017,2017-06-01,2017,4
Hotel Cristal Porto,normida,112,normidawrote a review Feb 2018,The hotel was extremely comfortable and the staff really friendly. The breakfast was amazing with a huge choice. The buffet dinner was excellent. I can't believe some of the moans of previous reviews.The room was fantastic with a beautiful view bath and an enormous bed. The cost of the room was extremely good value.I really recommend this hotel. Lots of good restaurants nearby and metro 7 minute walk.,Feb,2018,Feb 2018,2018-02-01,2018,5
Lisbon Marriott Hotel,Sharonsmithy,0,Sharonsmithywrote a review Aug 2017,"Stayed last week and weekend for 6 nights, upgraded to exec lounge which was great. Room spacious and clean and lounge very high quality and good offering. The pool area was clean, well maintained and really nice sunbeds. The lobby bar was our best part, we were really looked after with advice on cocktails, tourist sites etc. The bar manager and lovely chap with the large trouser braces were the best barman ever. thanks for the Old Fashioned and Bullet gentlemen, we will come back soon and a huge part of this is due to your excellent service.",Aug,2017,Aug 2017,2017-08-01,2017,5
PortoBay Liberdade,Thomas C,3,Thomas Cwrote a review Oct 2017,"Definitely not to the standards of a 5 star hotel.Too expensive. 220 euros per night without breakfast in a classic room - doesn't worth the price.Staff pleasant but not very efficient (had to ask three times for a simple repair in the room). Hotel facilities and room a bit worn out.Cleaning staff forgot to renew some of the accessories (small towels, hygienic plastic bags).Feels like the hotel is just trying to sell you more services all the time (spa, restaurant) without any effort to provide a genuinely nice experience and without the attention to details that could be expected from a hotel in this category.",Oct,2017,Oct 2017,2017-10-01,2017,2
PortoBay Liberdade,Skipper1360,54,Skipper1360wrote a review Dec 2019,"Beautiful property inside and out. First rate staff in every aspect. Very, very clean and well appointed rooms. Terrific location, right near all the action and a metro station. Really loved this place and suggest you give it a try. Great daily breakfast and the restaurant is also worthy of you time.",Dec,2019,Dec 2019,2019-12-01,2019,5
Dom Carlos Liberty,LoloBoo,40,LoloBoowrote a review Jun 2022,"Had a really lovely stay with colleagues for a work trip here and would love to come back.- Amazing friendly staff who are so welcoming and pleased to help you- Immaculately clean room and bathroom- Quiet hotel with a calm atmosphere- Firm comfy bed- Air con- Plenty of towels and toiletries- Fast free wifi- FABULOUS breakfast including juices, hot drinks, cheeses, meats, breads, cereals, hot items, yoghurts, prepared fruits and cake- Long breakfast availability from 7am-11amWhat’s not to love?!There is plenty to explore all close by and you’re in one of the most beautiful cities in the world! This hotel is fantastic value and they have clearly thought hard about the guest experience. I hope to stay again and highly recommend it for work or pleasure.",Jun,2022,Jun 2022,2022-06-01,2022,5
Independente Principe Real,Max D,0,Max Dwrote a review Feb 2024,Nice staff but gets quite hot in the room and the 3 bunk beds isn’t for everyone. Toilet/showers weren’t great but okay. Free breakfast is a nice addition tho.Location is ideal as it’s pretty much close to everything and the cost isn’t too bad either.,Feb,2024,Feb 2024,2024-02-01,2024,3
Lisbon Marriott Hotel,Rob M,4,Rob Mwrote a review Apr 2024,"Garden view room was a little tired but clean and comfortable, breakfast was excellent along with the waiting on staff service. Concierge services were really helpful - lots of good advice. Bar was well stocked, and Location was very good, 10-15 mins walk from the metro station.",Apr,2024,Apr 2024,2024-04-01,2024,4
Lisbon Marriott Hotel,Mahesh1966,7,Mahesh1966wrote a review Jan 2014,We got a great deal on this hotel for a family of 4 (2+2) including breakfast and extra bed.. The room were quite large enough to accommodate 2 queens and also an extra bed. the location is just perfect as the Hop On Hop Off bus comes nearly for sightseeing. The concierge (who also features in the hotel promo hotel) is the highlight of the place as he is extremely helpful. The breakfast is really the best I have seen with a super wide variety and omlette counters and other hot meals!! Overall an experience to remember!!,Jan,2014,Jan 2014,2014-01-01,2014,5
Lisbon Marriott Hotel,shatulgupta,33,shatulguptawrote a review Oct 2015,if you like to stay away from city this is a good hotel. Good rooms and courteous staff. Dont miss the breakfast. its a huge spread and has a huge dining hall. it starts as early as 630 am and is full. poolside very nice . ideal to sit and enjoy a drink in the evening hours. not when its cold outside obviously...,Oct,2015,Oct 2015,2015-10-01,2015,4
Four Seasons Fairways,Adam W,254,Adam Wwrote a review Dec 2012,"We visit four seasons fairways once a year, and always travel off peak (February and October).Pros:During these times it is fairly quiet, and the food and drink in the bar/restaurant always arrives quickly. The staff are always friendly and go out of their way to help. One example is earlier this year we lost part of our juicing machine in our apartment. They provided us with a new juicer within the hour.The club area that contains the restaurant, gym, bar, snooker room, swimming pool etc is well maintained and staffed. Over the past five years they seem to have been updating their facilities. The last time we went the gym area had brand new equipment and (unfortunately) both saunas were out of action as they were being replaced.2 very well looked after snooker tables upstairs. It's also free.Free wifi.Food and drink prices seem average for the area.All apartments have either a small pool or jacuzzi.Cons:Outside pool is empty whenever we go as its usually around 10c outside, outside part isn't heated. I imagine the area would be very nice in the summer. Indoor pool temperature is also fairly cold, the jacuzzi is also colder than others I've been in.Nothing else really.Always a relaxing enjoyable stay. Recent change in management seems to have kept it to its usual high standards.",Dec,2012,Dec 2012,2012-12-01,2012,4
Tivoli Carvoeiro Algarve Resort,Ed W,74,Ed Wwrote a review May 2016,"Beautifully located hotel overlooking the sea and a magnificent grotto the hotel is built on the side of the cliff, most of the rooms were below reception floor 5, you have to collect your pool towels from reception on floor 5 , the sunbed and pool area are on the ground floor 1 there is one kids pool and one adult pool and plenty of sunbeds with parasols + table tennis,Free wifi if join the Discovery program (GHA Loyalty), I joined online about 4 weeks befor the stay and already had my menbers card you receive a free newspaper every day and free wifi plus 1 bottle of water per stay ( not a day).The dinner restaurant and bar overlooks the ocean but the breakfast room was in a basementHotel is not the newest, it is well worth paying the extra for a sea view . The rooms have mini-bars, televisions (older generation) and hair dryers not very powerful, Storage space is limited  wardrobe hangers of fixed variety and located to high for short people Every day is cleaning, towels, replenishing tea, coffee and toiletries every day,The recption staff always friendly and helpful The bar drinks expensive 20% off for happy hour should be at least 50% offBreakfast was plenty of choice, but the quality of dinner was disapointing.There ars stairs down to the small beach but not right to the bottom you have to climb down the rocks the last 10ft.The town of Carvoeiro is over 1/2 mile down hill with cobbled pavements could be a proplem walking if you have mobility difficulties plenty of reasonable priced taxis are availble",May,2016,May 2016,2016-05-01,2016,4
PortoBay Liberdade,ttf150,0,ttf150wrote a review Dec 2024,We have had a wonderful stay again and will of course stay in PortoBay Liberdade again whenever we are in Lisbon.,Dec,2024,Dec 2024,2024-12-01,2024,5
Saccharum,AlanT905,76,AlanT905wrote a review Jun 2018,I was on a 3 day fishing trip with a friend so chose the hotel due to its proximity to the harbour. Genuinely surprised to find a fantastic hotel upon arrival - great leisure and swimming areas - lots of space creating a true luxury feel. The rooms were equally good (although we were upgraded to a partial sea view room - actually a full sea view in my opinion) - spacious and modern - the open bathroom is a bit quirky. Food was excellent and service/music at the roof top bar equally as good. Highly recommended.,Jun,2018,Jun 2018,2018-06-01,2018,5
Saccharum,DonB,0,DonBwrote a review May 2023,"My wife and I stayed 10 days at the hotel.  We weren't sure what to expect but it exceeded all our expectations.  The premium sea view rooms are worth the extra cost.  The rooms are comfortable and the view spectacular.  I can't praise all the staff enough.  Without exception they were very friendly and provided amazing service, especially Donavon and Michelle at breakfast.  The village also has a great range of friendly restaurants so there is plenty of choice.  The hotel can set you up with whale/dolphin watching which was some of the best we've experienced.I'd thoroughly recommend this hotel and being out of Funchal the surroundings are peaceful with spectacular views.",May,2023,May 2023,2023-05-01,2023,5
Saccharum,Maximilian,1,Maximilianwrote a review Mar 2024,"The hotel is great for exploring the island but also for relaxing days by the pool or sea. Breakfast was generous, but could have used a little more variety. The entire staff was very accommodating and extremely nice. The two biggest points of criticism during the stay were the water temperatures of the indoor and outdoor pools, which could be a little higher. However, the most incomprehensible thing about this hotel is that the spa and the loungers directly by the pool each cost an additional €30 per person. This has never happened to me at any hotel in this category and I don't think it's appropriate for the overall impression of the hotel. The justification for making a unique stay possible, as with some other reviews here, is simply not conclusive. Given the price and the hotel category, the spa area should always be included. And charging another €30 for “better” loungers at the pool is totally incomprehensible.",Mar,2024,Mar 2024,2024-03-01,2024,3
"Reid's Palace, A Belmond Hotel, Madeira",Keith M,29,Keith Mwrote a review Jul 2019,"Just returned from another fantastic break at Reids Palace. The service is second to none, the location is fantastic and the drink goes down a bit too easy. Had a fantastic seaview room in the old building, the stairs kept us fit (as we didn't want to use the lifts). Now have to try and loose the 5lb I have put on, that is the only netative thing, but all my own fault, need more self control.",Jul,2019,Jul 2019,2019-07-01,2019,2
Royal Savoy Hotel,HungarianMermaid,12,HungarianMermaidwrote a review Jul 2023,"Everything about our stay at this wonderful hotel exceeded expectations, we had a perfect holiday there. The staff is very welcoming, polite and professional, they go out of their way to make the guests happy.The facilities are amazing: we loved the large swimming pools, the private ocean access, the beautiful gardens and the indoor spa. There is no rush for the sunbeds either, plenty of them are available any time of the day. The rooms are spacious, comfortable and most of them have sea view from the balcony.The location of the hotel is ideal: Oceanfront, within walking distance to downtown Funchal or to the Lido Promenade. There are also plenty of restaurants, shops and car rental companies around the corner.",Jul,2023,Jul 2023,2023-07-01,2023,5
Tivoli Carvoeiro Algarve Resort,meg061,61,meg061wrote a review Sep 2016,"Another wonderful two weeks at the Tivoli, the setting of this hotel superb, to wake up in the morning to such a fantastic view. The staff remembered us and such a warm welcome from room staff to all staff through this hotel.  Looking forward to next year, and seeing the refurbish of rooms(especially bathrooms). Then the Tivoli will be the no 1 hotel to go to in Carvoeiro .",Sep,2016,Sep 2016,2016-09-01,2016,5
Natura Algarve Club,hayleypugh1988,0,hayleypugh1988wrote a review Oct 2013,"Came back one week ago from a lovely holiday. Friendly staff and a very clean and tidy hotel. Situated I a ideal area not far from the strip and town but quiet if you wanted that too. Will defiantly return to this hotel one day had a lovely stay and would recommend it for a family,friends or couples holiday loads of choice :)",Oct,2013,Oct 2013,2013-10-01,2013,5
Crowne Plaza Vilamoura,Debbie L,1,Debbie Lwrote a review Jun 2017,"Lovely hotel, breakfast was great, but evening meal was the same menu for the week except for Saturday evening buffet.  Be aware of charges for the indoor pool which is 11 Euros a day per person, also charges to use table tennis and pool tables. Great location for the marina.",Jun,2017,Jun 2017,2017-06-01,2017,4
