hotel_name,reviewer,helpful_votes,date,text,month,year,extracted_date_str,extracted_date,year_int,sentiment_score
Crowne Plaza Vilamoura,travellerswales,102,travellerswaleswrote a review Mar 2017,"Had 5 night stay at end of January after getting some cheap flights. Stayed at Ampulis hotel near by about 15 yrs ago. The Crowne I couldn't remember I know it was under a different name but although an old hotel the Crowne group has done a good job of refurbishing it. The rooms are well designed and bathrooms very large. All in all a good quality hotel. Staff all very friendly and breakfast varied and plentiful. A bit disappointed on first night there was no buffet due to time of year but due to number of restaurants in Vilamoura evening food is usually no problem with plenty of choice.The only disappointment is the cost of the health club/spa. I thought that out of season they would have some sort of deal on. The hotel itself seemed less than half full.The hotel gas a great location right on the beach,coastal path. Walk out through the pool area and turn left and its 5 min flat walk to Quateria and its promenade or turn right a 5 min walk into Vilamoura.We will definitely return  next winter.",Mar,2017,Mar 2017,2017-03-01,2017,4
Crowne Plaza Vilamoura,ADK650329,6,ADK650329wrote a review Mar 2018,This was our second stay at the hotel and once again we were treated to a five star experience. The hotel is immaculately clean and the service from all the staff was excellent from being greeted on our arrival until checkout.The buffet style breakfast is by far the best that we have had on the Algarve with everything you could possibly expect for breakfast. During our stay we ate both from the bar and restaurant menu. All the food was of the highest quality and the highlight for me was the stuffed mushroom starter.I would certainly recommend the hotel and will definitely be returning in the near future.,Mar,2018,Mar 2018,2018-03-01,2018,5
Natura Algarve Club,brogang,3,brogangwrote a review Oct 2015,"Once again we stayed at the Natura for a two week break in September.  We had an excellent apartment (No. 12) on ground floor as requested which was spotlessly clean.  The staff are a credit to the Natura.  They are so kind and considerate.Coming back to Albufeira in January but unfortunately Natura closed or would have no hesitation in staying there, but will be back to Natura in May.See you all then - take care.Elaine Grieve",Oct,2015,Oct 2015,2015-10-01,2015,2
Pestana Viking,Karolina,26,Karolinawrote a review Sep 2013,I have spent 10 days with my mum and my little daughter at Prestana Viking this August.We have enjoyed our stay at the hotel. The room was comfortable and with a nice side ocean view from a balcony. The food was tasty and plenty to choose from (excellent fish every day).The staff were very helpful.The hotel entertainment was nice and not imposing. You could still have a good night sleep.2 lovely beaches within 5 minutes walk (with the Cova Rodonda being nicer and less crowded).,Sep,2013,Sep 2013,2013-09-01,2013,4
Crowne Plaza Vilamoura,Zackariya989,3,Zackariya989wrote a review Mar 2015,"So I have just returned after a 4 day stay at crown plaza vilamoura, here's what I though.Firstly location, 5 star! You cannot get a better location, beachside resort, lonely sea and close to the city centre. The tivoli hotel is close by as well.Hotel decor, it a definitely not a 5 star. Decor a little tired, carpet on the rooms floor need urgent attention... Nothing major though.Food... 4/5. There isn't much variety other than the usual steak, fish, salad etc. No Asian, Thai, Italian etc. It's like being in London all over again, anyhow, despite the lack of variety,Food did suffice.Finally customer service, 1/5. This is the only reason I would not recommend the crown plaza. When your away on holiday, staying at a hotel which you have paid a premium for, least you expect is aSmile and a nod. It felt like some of the staff had a chip on the shoulder... No idea why. We often had to make an effort ourselves to strike up a conversation. They were hardly busy, not even peak season. Yet the staff were... Unwelcoming shall I say. The chirpiest bloke was the cook and he was stuck in the kitchen all day everyday.Needless to say, plaza hotel staff need to brush up on customer service. Other than that not a badHoliday at all.Overall 3/5. Would I recommend it? ... No! Because I'm sure neighbouring hotel would offer better customer service with a smile... They must do, surely.Happy holidays!",Mar,2015,Mar 2015,2015-03-01,2015,3
Crowne Plaza Vilamoura,Simonsupascoota,15,Simonsupascootawrote a review Aug 2017,"Booked only a few day before visit, expensive but worth it. Well run and really ideal for beach and harbour. You could always get a sunbed. Ask staff if you need help to get one. Breakfast excellent. Rooms can't fault. Was puzzled when reading room description beforehand as said shower only in deluxe room, but had excellent bath. Will go again as very convenient from uk and no riff raff, just good restaurants at acceptable prices. Had a trip to albufeira which must have been lovely 40 years ago! 10 days was just right for first visit. Lovely for a short break also. Balconies excellent with side view towards marina.",Aug,2017,Aug 2017,2017-08-01,2017,5
Luna Hotel Da Oura,paddyh117,0,paddyh117wrote a review Oct 2024,Not terrible not great. Probably a 2.5 rating toBe honest. Staff ok. Not very friendly. No bar or even coffee available to buy. Overall very much Iâ€™m need of modernisation. Rooms were clean and functional but the shower was the worst o have ever experienced in my life!,Oct,2024,Oct 2024,2024-10-01,2024,2
Vila GalÃ© Tavira,chrisjhorsfield,18,chrisjhorsfieldwrote a review Jul 2016,"The location of the hotel is perfect: close to the riverside and the ferry jetty, and a short walk to the Roman Bridge. The breakfast was superb. We don't usually like buffets but this was beautifully presented. Everything you could wish for, refreshed regularly. We never had to bother with lunch! The room was cleaned every day, and the staff were all helpful and friendly. We had a pool view and were glad. Half the rooms face inwards, towards the pool, and the other half face out to the street. We had dinner at the hotel on one evening and enjoyed it, but the range of restaurants in the town is so good that we wanted to try somewhere different each night. Our only criticism, and it's a mild one, is that some of the fittings are getting a bit tired. We would both return without hesitation.",Jul,2016,Jul 2016,2016-07-01,2016,4
Porto PalÃ¡cio Hotel by The Editory,Maralyn T,25,Maralyn Twrote a review Oct 2018,First time in Porto and this hotel did not disappoint.  The reception staff were so friendly and helpful from the minute our taxi dropped us off.  My friend and I had booked room only.  The twin room was very spacious on the 16th floor with amazing views over Porto.  The hotel has a roof terrace for hotel guests and it was beautiful to sit outside at midnight on a warm evening drinking cocktails.  Food is also served  on the roof terrace and in the dining room and I had a smoked salmon salad served at 10.45pm.  Taxis were on strike whilst we were there and once again the reception staff went out of their way to arrange for transport for us to a restaurant that we had previously reserved which was not in walking distance.  Not only did the driver drop us off but walked with us to show us where the restaurant was and gave his card to the owner so she could call him to pick us up.  I would highly recommend this hotel to anyone wishing to spend a few days in beauifuil Porto.,Oct,2018,Oct 2018,2018-10-01,2018,5
Muthu Clube Praia Da Oura,sf1958875,11,sf1958875wrote a review Oct 2019,"Spent 6 days here, returned yesterday. Only positives are hotel location which is at beach and reception staff who assisted us when our return transfer did not turn up.Our room and the hotel in general is very basic and very dated. We had 1 room (Deluxe!!) and 2x one-bedroom apartments which all require refurbishment. The food was very poor with breakfast being the only half-decent meal of the day.Hotel appears to have self-catering, bed & breakfast, half-board, full-board and All Inclusive. We were on AI which is the worst we have ever experienced. This finished at 23.00 hrs with last order at 22.30?? Only allowed to use one bar, you had to pay at the others?? The drinks were only one per person and were of very poor quality.We (6 of us) would return to the area but never to this hotel. It is sold as a 4* but really is a 2*",Oct,2019,Oct 2019,2019-10-01,2019,2
Quinta das Achadas,annabirdfr,1,annabirdfrwrote a review Apr 2018,"We stayed for a week at the Quinta das Achadas, which is a beautiful place, thoughtfully decorated and well-maintained by the wonderful Jill and Julio. It has easy access to loads of stunning beaches, great beach restaurants, and coastal walks. And itâ€™s great for families: we used the beautiful pool/jacuzzi every day and helped ourselves to the outside play equipment, toys, dvds, feeding the pigs etc... But it was the hostsâ€™ generosity and warm welcome that really made our holiday. We were so well looked after and nothing was too much trouble. We loved it all and hope to return!",Apr,2018,Apr 2018,2018-04-01,2018,5
Pestana Viking,minagaddibalz,1,minagaddibalzwrote a review Jul 2016,"We had a wonderful Easter vacation with all the best a hotel can offer.  Food was good , clean Rooms with a  seaview balcony ,fantastic entertainment -our daughter loved the Kids Club , Indoor and outdoor activities / swimming pools  . My husband and i enjoyed the Evening shows with diverse music for dancing etc",Jul,2016,Jul 2016,2016-07-01,2016,5
Canto de Luz,Linda W,0,Linda Wwrote a review Mar 2024,"Renovated, modern, airy oasis in the heart of old town shopping and restaurant district.  Convenient parking 2 doors down.  Susan was amazing!  So knowledgeable about Porto and helpful with restaurant recommendations and reservations through WhatsApp before our arrival.  Front staff was friendly and gave us a fantastic recommendation for a walking tour.  Breakfast staff were super accommodating filling our water bottles for the day and allowing us to store our picnic items in the fridge.  Breakfast was generous and particularly appreciated the fresh squeezed orange juice and eggs made to order.  Would definitely stay again upon our return to Porto.",Mar,2024,Mar 2024,2024-03-01,2024,5
Altis BelÃ©m Hotel & Spa,Elaine B,16,Elaine Bwrote a review Jun 2017,Beautiful hotel on the Tagus river. Friendly & welcoming staff. We had a lovely balcony room with view of river. Room facilities were good and a very very comfortable bed. Breakfast buffet offered lots of choice & bar food was good. Natalie from customer services delivered a bottle of bubbly to our room along with strawberries & chocolate for our anniversary which was very much appreciated. The spa staff were lovely and the two treatments I had were excellent and very professionally carried out. The spa pool is a lovely warm & clean environment to really chill out in. We won't hesitate to return here.,Jun,2017,Jun 2017,2017-06-01,2017,5
Yes! Lisbon Hostel,BrittyLJ,34,BrittyLJwrote a review Jan 2016,"Yes! Lisbon kind of felt like a destination in itself. I've probably seen most that Lisbon has to offer during the week I spent there, but I want to return just to hang out with the amazing staff that work at this hostel. They are super friendly, welcome you in like family and jump through hoops to make sure your stay is as enjoyable as possible.The place itself is super clean, I don't think I ever saw the bathrooms messy at all and despite the huge mess we left in the common areas as we went off to bed at 4am in the morning, it was always clean when we rocked up for breakfast. Despite the fact that people are often chilling out downstairs or coming in from the pub crawl at all hours of the morning, the noise never travelled up to my room.The common area is amazing- it's super easy to meet people and there were many afternoons spent chilling out the bean bags and watching movies.The walking tours are great- especially if you get Soraria (her knowledge of Lisbon is super), as are the communal dinners which are such a great way to get to know people and also super great value (10 euros for starters, soup, main, dessert and an open bar during the meal).I'll never forget my stay at Yes! Lisbon and I'll be back for sure!",Jan,2016,Jan 2016,2016-01-01,2016,5
HF Fenix Lisboa,PaoloDL,6,PaoloDLwrote a review Sep 2013,the overall impression is good but the hotel seems to suffer when assaulted by groups. On our first day they had not made the room by 3PM and for a 4star this is not acceptable. One of the receptionist seemed also to grant you a big favor to hear your questions and requests. Breakfast is a point in their favour as position just 10 meters from metro station.,Sep,2013,Sep 2013,2013-09-01,2013,3
Muthu Clube Praia Da Oura,serendipitykm,3,serendipitykmwrote a review Apr 2025,"We are so disappointed with our stay and would happily go home early. We arrived Sunday just before 5 and was checked in. Our room is in a block right at the back of the resort but does have a nice balcony and view.When we arrived I noticed the beds had hairs on them and then looked around to find dirty pots in the sink, rubbish in the bin, dirty things in the fridge and general grubbiness.  We went to reception and after much consultation they said the room wasnâ€™t finished and they would ask for it to be cleaned.  We came back 45 minutes later to find the sofa bed not made, only 2 bath towels, the fridge still dirty and had to call down again.Eventually at 7.00 we were checked in and unpacking before dinner.The all inclusive food here is some of the worst I have ever had. It is the same almost every day and nothing for vegetarians. The restaurants are barely  open and they serve a set menu. We have been going out to eat to avoid the food. The drinks are so limited and fairly awful and only available in one bar at the other end of the resort.We are right next to a club that starts at 10.00 every night until 11.00 so no chance of an early night or sleep for kids.Today we have returned to find our daughterâ€™s retainers gone. They were wrapped in a tissue next to the bed and we assume cleaned away by cleaning staff. Our next surprise tonight was a large group of teenagers moving into the block and running up and down screaming and shouting for hours.On the up side the staff at reception try their best to help but told us at check in there was no other room and sadly we need to pay for new retainers!!I would not recommend this hotel to anyone",Apr,2025,Apr 2025,2025-04-01,2025,1
Hotel Principe Lisboa,Daniele_Cremonesi,105,Daniele_Cremonesiwrote a review Aug 2023,"Excellent \"business\" hotel in a nice neighborhood of offices and embassies, not touristy but very quiet. Very comfortable hotel, just outside the exit of the Sao Sebastiao metro station, red line directly connected to the airport.Very large, spacious room equipped with all comforts, including a very large wardrobe and a beautiful balcony with a small table.Very rich continental breakfast, wide choice of everything. To be taken into absolute consideration both for comfort and for proximity to the subway.",Aug,2023,Aug 2023,2023-08-01,2023,5
Altis BelÃ©m Hotel & Spa,mtracy38,6,mtracy38wrote a review Aug 2012,"This hotel is in an excellent location if you want to explore Belem over a couple of days. The hotel is modern, clean and the food is very good. We didn't use the spa facilities but the roof top sun lounge is really nice and has excellent views.The highlight of our stay was being upgraded to a suite overlooking the Tejo as we had arrived early and our room wasn't ready.  Rather than having us wait they gave us the other room which was very kind and completely unexpected. We travel a lot and this is the first time a hotel has done this for us - it was a nice treat so a big thank you to the reception staff.The only (small) criticism I have is that tea and coffee aren't provided free of charge in the room, something which is standard in most hotels. Other than that everything was very good.",Aug,2012,Aug 2012,2012-08-01,2012,4
Muthu Clube Praia Da Oura,Harry W,0,Harry Wwrote a review Jul 2025,"Tidjane was absolutely insane, mad slops in the disabled, really phenomenal experience from the young man, stupendous amount of olive oil, enhanced the experience.",Jul,2025,Jul 2025,2025-07-01,2025,5
ibis Styles Lisboa Centro Liberdade NE,Guilherme Z,0,Guilherme Zwrote a review Aug 2023,"Our stay at Ibis Lisboa Parque das Nações was an absolutely unforgettable experience. As loyal members of the All Accor program, we have stayed in various establishments under different brand banners: Sofitel, Novotel, Gran Mercure, Mercure, Adagio, Ibis, among others. However, we can say with all conviction that Ibis Nações stands out as one of the best, if not the most notable, we have ever stayed at.For a couple of days we enjoyed the premium rooms and subsequently a suite for another two days. The experience in the premium rooms had already amazed us: impeccable service from all the professionals, whether at reception, at the bar, coffee service, cleaning, among others. The rooms are of a superior standard and a rich, delicious and excellent breakfast. Transitioning to the suite was the perfect culmination of our stay. Undeniably, one of the best spaces we have ever had the privilege of staying in, plus the meticulous care taken by the hotel team in providing pampering and attention for our two children.Our decision for this location was considered and is, perhaps, the only aspect to meticulously consider when choosing. Even though it is not exactly in the city center, the hotel is very close to a metro station and bus stops, making any journey easier.It would be a great pleasure and an immense satisfaction for us to return to this hotel in the near future. It is, without a doubt, a superb establishment!",Aug,2023,Aug 2023,2023-08-01,2023,5
Turim Marques Hotel,AlexausWien,41,AlexausWienwrote a review Nov 2019,"The hotel is modern, clean and in a good location for exploring the city. The breakfast buffet offers a lot of variety to cater for all tastes. That’s about it for the pros.A very big con for us was the fact that in the second week of November the heating was still off and the room was cold. On the first day staff at reception told us „it’s not winter yet“ and „the general management knows about the situation but hasn’t reacted yet.“ The second day we were told after breakfast that at 10am the heating would be switched on only to find the room cold as ever at 4pm when we returned to the hotel - this time the staff‘s excuse was that they were waiting for a mechanic to sort the heating out.We came to the conclusion that the Turim management seems to care more about their expenses than guest satisfaction.A word on the rooms: They are, by European standards, relatively big, but badly designed: The sink is separated from the WC/shower and integrated into the main room. So far, so good - it’s just lacking storage space- so no chance for two guests to store their toiletries there. No rack for the hand towel either, no free mineral water or amenities like slippers ... all those small things that would ensure a 4 star experience. We left disappointed.",Nov,2019,Nov 2019,2019-11-01,2019,3
Hotel Alegria,jck67_12,3,jck67_12wrote a review Aug 2025,"Hotel Alegria is a beautiful hotel. Extremely pleasant staff, comfortable bed and delicious breakfast. We enjoyed our last night in Lisbon at this beautiful hotel in an upscale neighborhood.",Aug,2025,Aug 2025,2025-08-01,2025,5
Hotel dos Templarios,SanFran11,78,SanFran11wrote a review Aug 2013,"When we booked this hotel our expectations were not great based on the website, even though it had really good Tripadvisor reviews. As soon as we walked in we were impressed with the décor and luxurious feel and were warmly greeted at reception.  We had requested a river-facing room when we booked.  They offered us a rive view room but advised us that it would likely be loud until early morning because of a festival at that time and offered us a front room which we accepted.  We were amazed at the room.  We had reserved a superior double room and the room (310) was huge suite, obviously an upgrade.  There was a sitting area, desk area and very large deck.  The bathroom was also great with a tub and separate shower.Breakfast was okay with a good selection of rolls,  pastries and cakes as well as fresh fruit and many more choices. The pool area is great.  The rates are low given the quality of the hotel-an excellent value.Tomar is a charming town and definitely worth visiting.  Don't miss the Convento.  It is huge and very beautiful.",Aug,2013,Aug 2013,2013-08-01,2013,4
Casa Vela Boutique House,RedLiverBird,1,RedLiverBirdwrote a review May 2014,"This is the second time that my wife and i have stayed at Casa Vela, the first time being October 2013 when it was just the 2 of us. We had a wonderful suite (Mozambique) which could not have been more perfect. Huge sliding doors allow the entire room to be opened up with views of the beautifully landscaped gardens and the faint sound of tricking water from the amazing water features throughout the grounds. The room was perfect, light, airy, full of fantastic facilities. The main house is beautiful, tastefully decorated and giving it's guests an immediate feeling of relaxation. Breakfast was superb, simple yet perfect - freshly baked pastries, freshly squeezed juices and perfect coffee (Nespresso!) The staff are so attentive yet not at all intrusive, they can not help enough. That was October and it was superb!!We returned to Casa Vela again in late April 2014 this time with pour 18 year old daughter and having described the property to her it had a lot to live up to - it didn't disappoint! Our room was again immaculate, this time with huge bathroom and whirlpool shower. The staff were equally as attentive and again you feel like you're at home rather than in a guest house. We spent time in the lounge, relaxing on the comfy sofas with a bottle of red wine and our visit could not have been any better. The house is a 10 minute walk from the centre of Cascais (or a 2 minute taxi!) in such a peaceful area of the town. If you are looking for a comfortable break in Cascais without feel ing like a 'room number in a large hotel' the Casa Vela is perfect. We cannot recommend it highly enough and will definitely be back for a third time. Well done to all involved!!",May,2014,May 2014,2014-05-01,2014,5
Hotel dos Templarios,Compass49062775651,4,Compass49062775651wrote a review Sep 2025,"I think the value is very exaggerated for what is provided.The toilet smells like mold. The bath products are friendly. The bedroom floor mat is full of nodos.It is an outdated hotel, which needs to be modernized, in the furniture, in the mattresses.Breakfast is very good and all staff very friendly, in the reception and in the dining room.A little note: Despite being a special birthday date, and this has been informed, they did not have any gesture of courtesy. In other years, in other hotels, they always offered parking, a snack, a sparrow or a wine. It wasn't mandatory that they did, it never is, but it's friendly, it always falls well and here it didn't happen.)",Sep,2025,Sep 2025,2025-09-01,2025,3
Pousada Viseu,Erik B,0,Erik Bwrote a review Oct 2023,"We stayed in one of the suites on top floor. The suite was like a jungle. Plants all over the room. You could’nt move in room without having plants in your head, feer etc. The aircondition was not sufficient enough to cool the room. We had +30 as outsider temp. No chargeing by the bed except 1 standard poweroutlet, placed so you have to crawl on the floor to reach it. The entire room gave an old impression.Finally did we ask to check out later then 12 as one of us woke up with a terrible migraine. They extended the check out with 1 hour. I did the double check and knew that the hotel was’nt fully booked.What was good then?- Good location if you’re visiting the city.- Easy to park close to the hotel.- Poolarea was ok but no barservice at the pool.Will we stay here again? - NopeWill we recomend the hotel to others? - Nope",Oct,2023,Oct 2023,2023-10-01,2023,2
