hotel_name,reviewer,helpful_votes,date,text,month,year,extracted_date_str,extracted_date,year_int,sentiment_score
Myriad By Sana,Denverreviewer2,11,Denverreviewer2wrote a review May 2017,"This spectacular hotel is located in an ideal location for travel through Lisbon using the plane (2 miles) or train (one mile).  It's only real flaw is that it is not really convenient (but still doable) to downtown Lisbon.The amenities are first class, particularly if you pay for a suite (very large size, we got a complimentary upgrade when we visited twice in two weeks).  I would guess all the rooms have the spectacular views both of ours did.  The numerous staff are always available and willing to do whatever you need to make your stay go well.The included breakfast was the best we had in Portugal.  The hotel accommodates a variety of travelers, the extensive choices are designed to ensure that every one of them has what they prefer.It's located in a park setting near the aquarium.  There are several restaurants within a block, more only slightly farther.  Nice opportunities for a pleasant walk, be it long or short.The only thing I would imagine someone being seriously uncomfortable with is that the bathrooms are somewhat open to the rest of the room.  The toilet is in a separate room, but it too may not be separate enough for some, the door is sliding, and both it and the walls are glass, with the bottom strategically frosted.None of my comments is enough for me to rate the hotel anything less than five stars.We were flying in and out of Lisbon, and traveling by train to other areas.  I can't imagine a hotel better suited to that.  The train station also has transportation downtown, of course.",May,2017,May 2017,2017-05-01,2017,4
Hilton Porto Gaia,Jackie B,83,Jackie Bwrote a review Mar 2023,"Beautiful hotel a short walk from the river, ideally situated for bars, restaurants, port tasting, cable car and river cruises. Breakfast was varied and of good quality and room was large and airy with an excellent shower. Only downside was housekeeping,on one occasion our room was not serviced until the evening, not ideal after being out all day. Vacuuming the wood floor could have been a bit more diligent as in some places it remained very dusty. Also a small bag containing vital medication was moved from my bedside table and as found stuffed under a pillow!!!!",Mar,2023,Mar 2023,2023-03-01,2023,4
Casa Vela Boutique House,Annette H,38,Annette Hwrote a review Aug 2025,"Boutique hotel in great location, tranquil historic hotel with newer additions in beautiful gardens.Lovely place to spend our 60th birthday celebrations with our family of differing ages.The Kitchenette worked well for those with young children and the pools were good for little ones too though could have been heated as they were very cold.Breakfast area lacked attention and drink choices were limited. Staff pleasant particularly the lady at the outdoor bar.Situated between the newer area and the old town which was convenient for supermarkets, great coffee shops and restaurants. Our favourite being a great night with a singer at “mana”. Within easy reach of the train station for Estoril. The bus for the surfers (bond ) beach and Ubers to Lisbon and Sintra.",Aug,2025,Aug 2025,2025-08-01,2025,4
Altis BelÃ©m Hotel & Spa,CFC1899,60,CFC1899wrote a review Dec 2010,"This was a top notch hotel with excellent staff and in a useful location for the Belem tourist sites.  It wasn't so good for access to central Lisbon, but I would guess most people who come to this hotel are coming for the facilities at the hotel itself. Very hard to fault this hotel. We got it using cultuzz vouchers, otherwise it would have been out of our price range. Only negative would be that it wasn't particularly disabled friendly, as the bath has no grab handles. Style over substance, as in a lot of these designer hotels. In the designer world, nobody ever gets old, and we wouldn't want anybody who wasn't perfect spoiling our vision, would we?  Not the fault of the hotel management or staff, who were brilliant, but just a generic fault of designer body fascism.",Dec,2010,Dec 2010,2010-12-01,2010,3
Residencial Londrina,Mirjana M,2,Mirjana Mwrote a review Aug 2015,"Clean rooms, good continetal breakfast, little bit old furniture but everything was fine. Two old ladies dont speak english but  you can manage with everything. B&B Londrina is good value for the money, is near center of the town (on foot) Enjoyed our stay in Lisbon.",Aug,2015,Aug 2015,2015-08-01,2015,4
Villa Margaridi,Departure816697,0,Departure816697wrote a review May 2024,"Villa Margaridi is simply the best.  After traveling for two months throughout the Iberian Peninsula we found that the combination of ameinities and people made our stay at Villa Margaridi better than all of the rest.  From the comfortable, modern and well designed apartment, to the beautiful, tranquil grounds to the excellent host and staff it was the total package.  Additionally the little touches, such as a well stocked refrigerator,  fresh bread in the morning and port in the evening made us feel special.  In fact we felt so special that we changed our itinerary and decided to extend our stay from two to six days.  Jose was the consumate host and Udo was his conscientious and dedicated second.",May,2024,May 2024,2024-05-01,2024,5
Hotel dos Templarios,Roger D,72,Roger Dwrote a review Mar 2019,"We stayed one night as part of a Globus tour. The facility is on the edge of town with great views of the Convent of Christ. Our room was well appointed, quiet, clean and comfortable. Buffet dinner and breakfast was extensive, hot, and tasty. The staff appeared to be lean, but for the most part kept up with us.",Mar,2019,Mar 2019,2019-03-01,2019,4
Park Hotel Porto Gaia,Frany F,1,Frany Fwrote a review May 2025,"Very good, very clean, quiet and welcoming. The receptionists and people who take care of breakfast very helpful.Good sweet and salty breakfast, gluten-free possibility and vegetable milk.A bit far from the center but fairly well connected (bus)",May,2025,May 2025,2025-05-01,2025,4
Vila Galé Coimbra,Paul T,12,Paul Twrote a review Jul 2022,"First stay back here after the pandemic and although the hotel is still relatively new it still has the same problems as previous staysThe biggest issue is the complete lack of efficiency of the staff, even though I had checked in on line sand was supposed to get my key after showing my QR code it still took nearly 15mins, there are so many staff who just look blankly past you when the should be able to at least greet you politelyThe check in process here is one of the worst I have experienced and I have stayed in more than 300 hotels in the last 10 yearsThey no longer offer you an iron in the room and you have to pay for laundry just to press a shirt or trousers which is ridiculousGym needs some new equipmentDon't Get me started on the bar staff TerribleIf they worked in the UK they would  be firedAwful service attitude was poor and they are slower than a snail 10 mins to make a G&TWill probably stay elsewhere in August when I am returning",Jul,2022,Jul 2022,2022-07-01,2022,1
