hotel_name,reviewer,helpful_votes,date,text,month,year,extracted_date_str,extracted_date,year_int,sentiment_score
Belmar Spa & Beach Resort,MsHT76,4,MsHT76wrote a review Jul 2013,"My husband and i stayed here for a week this June. The hotel apartments are lovely and very modern. They have everything you could want, and it's great to have the best of both worlds - breakfast included as well as self catering facilities.We ate in the restaurant a couple of times. It's good food, but lacks a little atmosphere. Breakfast was okay, could be improved a bit i think.The area is quite quiet, so worth hiring a car to get into Lagos, which is just that little bit too far to walk. You also need one to get to the supermarket, which is a bit of a mission up a big hill!The hotel is right on a beautiful beach, which has a couple of good little eateries. The pool had plenty of space. It was a shame the outdoor pool was too cold for people to use, but useful to have the indoor one.All round great place to stay. If a little quiet, and quite windy!",Jul,2013,Jul 2013,2013-07-01,2013,4
Jupiter Albufeira Hotel - Family & Fun,Adam B,0,Adam Bwrote a review Apr 2025,"Where do we start, arrived on the Friday 18th around lunchtime, when we arrived at the hotel we checked in both families rooms(which took an eternity, very laboured and slow) one room was ready immediately, the other room we were told would be ready within an hour. So we went back around an hour and half later and room still not ready, they took my number and said would call before 3pm to let us into the room. 5pm arrives and still no call, so we went back to reception and was told the rooms been ready since 2.30pm. Obviously not best pleased.  We then went to the room and requested an Iron, didn't arrive for 3 days so had no clothes that we could wear, we asked everyday for the iron.The food, what can i say, the options are very limited and basic, meats are dry as a bone, the kids breakfast station consisted of pancakes only, and in the evenings nuggets chips and plain pasta. If you like fruit for breakfast lunch and dinner you will be ok. Food was cold, bland and no flavour.The children's entertainment was again another shocker, the staff didn't even know the words and dances to the songs, we couldn't believe it, very unprofessional. The evening entertainment i think i could have done karaoke better, the mamma mia show they were all miming out of line with the songs and just very very poor.All of the pools were horrifically cold and kids didn't want to swim in them, the indoor heated pool was not included and had to be paid for which booked up so fast as it was so small. Day 2 they ran out of beer which is all we wanted to drink during the day. Snack bar ran out of beer all week and pumps broken and not fixed.The children's pool one of the metal displays was knocked over by a child and the base was left in the pool all sharp and rugged right next to the bottom of the slide. After we complained the lifeguard stuck a table on top of it and it stayed that way all week, absolute disgrace.Day 3 they had workers digging up 3 big holes around the pool area and sectioned off that part of the loungers.All in all this is not a 5 star hotel and i wouldn't even go as far as a 4 star. We have stayed in way better 4 star hotels. Not worth the money do not bother.",Apr,2025,Apr 2025,2025-04-01,2025,1
Saccharum,Sarah D,0,Sarah Dwrote a review Jan 2016,"We wanted a complete break and found it here. The spa was amazing, nowhere was crowded, we enjoyed finding different places to relax, on the beach, by the infinity pool on the eighth floor, the terraces they all had superb viewsThe decor modern and interesting, lots of green spaces, Enjoyed the buffet meals in a very elegant restaurant",Jan,2016,Jan 2016,2016-01-01,2016,2
Jupiter Albufeira Hotel - Family & Fun,miguel888,1,miguel888wrote a review Aug 2025,"We had a lovely stay here. Very clean hotel, all inclusive, really hard working helpful and harmonious team of staff and hot weather.Our 6 year old had a fantastic holiday and we were happy too - what more could you ask for,The kids club staff work incredibly hard  but so does everyone that i could tell and all with a smile, bar staff, cleaning and maintenance staff, concierge, reception - i could go on.The team all around the hotel are a credit and no doubt contribute to the overall laid back feel of the hotel  which keeps standards high.There was food and drinks available all day and a very wide selection so there should be something for everybody. We enjoyed the themed dinner evenings in the buffet restaurant (american, indian, chinese)Great fun around the pool from scheduled activities to the water slides which were very good. A lot of people stay in this hotel but it never felt TOO crowded - always enough sun loungers for example. The free hourly shuttle to Albufiera (old town) was great and organised well, requiring a ticket from an electronic station.",Aug,2025,Aug 2025,2025-08-01,2025,4
Tivoli Carvoeiro Algarve Resort,Getaway18519,23,Getaway18519wrote a review Aug 2019,What an absolutely beautiful setting . Stunning cocktails . So lovely . Very attentive staff and nothing was too much trouble . This is a must visit again . Thanks to Andre the lovely waiter as you were a pleasure . Memory for life x,Aug,2019,Aug 2019,2019-08-01,2019,5
Quinta Mirabela,HMDunne,35,HMDunnewrote a review Apr 2022,"We travelled as a family group with 3 rooms. We were booked into superior rooms overlooking the pool, but these could not be provided due to C19. However, Victor was so accommodating explaining the situation and the hotel offered to cover our drinks with our DB&B package as compensation.  This more than made up for the switch and our rooms, 301,302 and 302 had stunning views over the terrace to the open sea.  It has to be said Quinta Mirabela must have some of the best views on the Island. The restaurant menu is impressive offering local dishes, lots of fish, and a pasta menu. The restaurant team make your dining experiences so special, with their attention to detail, such friendly manner and can't do enough for you attitude. Marco, Daniel and Nuno are as much an \"entertainment team\" as they are restaurant team. We laughed with them all week and they made all of our family feel fully included and special. I can highly recommend the mussels and for something different the scabbard fish with banana!Breakfast is buffet style with hot freshly cooked options, including pancakes and omelettes.The location of the hotel is perfect to watch the daily passing of the traditional basket rides,  the hotel shuttle bus takes you into town and a trip up in the cable car is so worth it.  Our rooms, were well equipped, except for a tea tray but the available from the bar. All were cleaned daily with toiletries and soft towels and dressing gowns.Town is lovely to wander around with lots of outdoor dinning options, wander the lanes through the old town and admire the door artwork. The market is also worth a visit.We asked Sara and Tanya the reception team to help us with various queries and telephone calls and again this this did with a smile and lovely manner.It just leaves me to say that we would all highly recommend Quinta Mirabela and only wish we had longer!! We will be back - thank you all x",Apr,2022,Apr 2022,2022-04-01,2022,4
Hotel Madeira,Teamkarma,94,Teamkarmawrote a review Oct 2016,"This is a very clean hotel located in a very clean city centre location with everything close by.Staff are very helpful and they explain utilising the various lifts available.Our standard room was spacious, the bathroom was also roomy with a great shower, the C/H was very quiet.The breakfast room was well presented with a choice of hot and cold foods, tea / coffee.There is a rooftop sun lounge area with a bar, loungers, and access to a mid size pool, bar open till 11pm alcohol, tea, coffee snacks etc.Excellent hotel for the price.",Oct,2016,Oct 2016,2016-10-01,2016,5
Jupiter Albufeira Hotel - Family & Fun,tgorri527886,0,tgorri527886wrote a review Oct 2023,"Would highly recommend Jupiter. As family of four this hotel provided a great experience and facilities. Food was exceptional, food, drinks and ice cream which kids loved 😊.This was my second year in a row going for October school break and will definitely be back.",Oct,2023,Oct 2023,2023-10-01,2023,5
Jupiter Albufeira Hotel - Family & Fun,naismithgeorge,0,naismithgeorgewrote a review Jun 2023,Let down badly by poor cleanliness in our room. Shower tray was not touched in the 10days we stayed plus mirror wasn’t clean and balcony never touched either.Apart from that though everything was great about the hotel and is a great base for a family holiday with nice staff and food. Both a La carte restaurants were exceptional,Jun,2023,Jun 2023,2023-06-01,2023,2
PortoBay Serra Golf,CherryClift,150,CherryCliftwrote a review Mar 2014,"We had booked a superior room but were upgraded to the suite which was lovely. The bed in the main bedroom was huge and comfortable.Direct access to the gardens and a walk to pool.I enjoyed my swim under the glass covered roof in the rain and the sauna was relaxing.The night we stayed was stormy, windy, rainy, thunder and lightening.  If this is not a very rare occurrence it would be a good idea to fix the windows to stop them rattling.  The noise from this and the rain on the shutters, was loud and our sleep was poor. ( We live in an much older farmhouse and manage to stop the rattles). I mentioned this to the front desk who said they would inform management.Also as suite is under the kitchen or dining room (I'm not sure which) clearing up footsteps go on until about 11.00pm and breakfast preparation starts sometime after 7.00am which spoils the privacy of a luxury suite.Even so we loved our stay, but the superior room might have been better for us.",Mar,2014,Mar 2014,2014-03-01,2014,4
Quinta Nova Winery House - Relais & Châteaux,janeteheckman,0,janeteheckmanwrote a review Apr 2023,"If you only visit one place  in the Porto/ Dourno area this is where you want to stay.  Only 11 rooms, wonderful views , amazing food , very special wine and a very hospitable team.  If you can’t stay at least go for lunch.One of the highlights was doing wine maker of the day with the Quinta’s winemaker.",Apr,2023,Apr 2023,2023-04-01,2023,5
Dona Filipa Hotel Vale Do Lobo,PEH10000,2,PEH10000wrote a review Jun 2014,My second visit to the Dona Felipa with my dad to play golf.. We stayed in one of the rooms that is due to be refurbished. It was still a great room with everyhing we needed - decent sized bathroom with separate WC which was really handy. Stayed for three nights and played four rounds of golf. Breakfast was superb everyday and we then got picked up by Denis to go to San Lorenzo or Pinheiros Altos (depending on where we were playing). Denis is a great guy who is very friendly (in a genuine way). Very knowledgeable about football especially Portugese and Benfica in particular. His english is better than most english people which heps too! Gave us great recommendations on where to watch the World cup. I'm a big fan of the Dona Felipa and hope to return next year.,Jun,2014,Jun 2014,2014-06-01,2014,4
Lisbon Destination Hostel,Serge G,5,Serge Gwrote a review Aug 2015,"We enjoy everything there. The staff is very competent, pleasant and dedicated. Rooms are clean, quiet and comfortable. All activities that we tried (guided city walk, surfing lessons, Fado Experience, Sintra tour), organized by the hotel, was excellent. The hotel, at Rossio station, is perfectly located in Lisbon (close to everything... or to metro/train stations). Fantastic, this hotel made our week in Lisbon a great experience and discovery. Thanks to all the staff.",Aug,2015,Aug 2015,2015-08-01,2015,5
Grand Muthu Forte Do Vale,SMLR,0,SMLRwrote a review Oct 2018,"Not a 5* at all- not much choice of food, stayed here while a group of Spanish stayed who looked down their noses at people and was ignorant making the stay uncomfortable and making there no room in the restaurant and bar at times as there was so many of them. Entertainment some nights was Spanish so I’m not sure what us English was supposed to do? Also, the bar doesn’t open until 12 and only had snacks between 4 and 5 so had to go out spending money on food as we got hungry inbetween meal times which is a joke as we’ve paid to be all inclusive. Not only was there hardly any choice of food, but not for drinks either, wasn’t allowed certain things of the menu had to pay extra for them.Spa room was a good thing to have however it’s not really hygienic in there. On the first day we complained and they didn’t want to listen to us and shut us off.  Won’t be returning.",Oct,2018,Oct 2018,2018-10-01,2018,2
Convento da Provença,Waimeawahine,71,Waimeawahinewrote a review Mar 2012,"We arrived late in the afternoon sick of driving, hungry, and needing a drink!  We found the place tucked away on a country lane on the way to Marvao.  We asked for something to eat and Louisa asked what we wanted in our salad! It was made to our liking with fresh fruits and vegetables. Breakfast of local products was good and it wad fun to squeeze our own orange juice! The bed was very firm.",Mar,2012,Mar 2012,2012-03-01,2012,5
PortoBay Serra Golf,DocHC,20,DocHCwrote a review Mar 2013,We had two pleasant nights here. The room was very comfortable and well stocked. The pool was lovely. The restaurant was very attractive. The food was very good although not 5 star. This was not a major issue considering the small number of guests and the very reasonable price per night. The staff were very helpful. (We did not play golf!),Mar,2013,Mar 2013,2013-03-01,2013,4
Estalagem Da Ponta Do Sol,ColinM2,20,ColinM2wrote a review Jun 2007,"The 25 Feb 06 review below pretty much says it all but to add/ reiterate a couple of points.This is fantastic value for a genuine design hotel (minimal rooms, infinity pool, lightbox restaurant,  etc.) in an exceptional location overlooking the Atlantic. Bed & breakfast with a full, elevated, cliff top seaview plus airport transfers for €83 per room per night is a genuine bargain. By rights, it should be twice the price and were it on an island that had a reputation for a slightly younger clientele, slightly cheaper flights (though GB´s flights were competitive) and perhaps also a better guaranteed sun record, it would.The one reason for there not being a higher quantity of glowing reviews here is. perhaps, that 90% of the guests are German speaking (although English is the first language of the hotel) with the remainder largely Portugeuse.Do note that Ponta do Sol itself has little to divert. Whilst the hotel does offer a range of free transfers to Funchal (20 mins) and for walking the levadas, a hire car is recommended for those staying anything more than a handful of days.The staff are great but not intrusive. The pool honesty bar is beyond reasonable (coffee €1, beer €2). The restaurant is above average with a superior breakfast buffet.Altogether, highly recommended.",Jun,2007,Jun 2007,2007-06-01,2007,4
Casazul,PaulandIrene,76,PaulandIrenewrote a review May 2014,"Found this lovely little place on Tripadvisor. A great find. Paulo and Natercia were welcoming and friendly. Paulo gave advice nowhere to eat,what to do etc. Breakfast just kept coming. Best of all were the delicious cakes that Paulo made, a different one each day. Thoroughly recommend it. Only slight drawback was finding it.",May,2014,May 2014,2014-05-01,2014,4
Independente Principe Real,DiggerJCB,7,DiggerJCBwrote a review Mar 2024,"On arrival we realised the place was a hostel as well as a hotel, which wasn't clear when we booked through Secret Escapes.  The reception area was chaotic as it seemed everyone checked in at the same time.  There were 2 young women on duty, who were perfectly pleasant but not very efficient.  To get to our room we had to go back outside, as the hostel is in the main part of the building.  The front door is very heavy and slams if you don't grab it before it closes - this was an issue through the night as pretty much everyone let it slam. As our room was directly above it, we were wakened on a number of occasions. It may be an idea to put a notice on it to let guests know.We were disappointed with our room. We expected it to be quirky, which was why we booked it, but the furniture could do with being better. Our wardrobe screeched every time we opened the doors. Saying that, the room was very clean and the bed exceptionally comfortable.  The shower is outstanding and there was always hot water available. The room was cleaned each day we were there and fresh water left for us.  The television didn't work when we turned it on, so my husband went to reception to ask for help with it.  They never came.  We asked a further twice and no one turned up.The hotel is in a beautiful location with fantastic views across the city.  There is a lovely plaza just across the road and there were various types of musicians there every day and also a café, under an awning if you wanted to sit and have a drink and a pastry.As in previous reviews, our room was at the front of the hotel and the traffic is non stop 24/7, as you'd expect in a busy city.  The windows kept out a lot of the noise but the room was very hot at times so we couldn't have the windows open.  There were no instructions on how to work the heater in the room, or to tell us about wi-fi or even recommendations for what to see, where to eat and transport. That would have been helpful.The wi-fi is woefully inadequate in the side where the hotel is; it may be better in the hostel side.  The password is only available in reception.Breakfast was adequate. There is a buffet which was replenished regularly but if you want a hot breakfast, the choice was pretty much eggs or pancakes.  On the first morning we were pretty much ignored; there were 2 young women but they never approached us to tell us how things worked.  The rest of the stay was better as there was a lovely lady there who was efficient and made things run smoothly. It made us smile to hear her sing her way through breakfast and engage with the guests.There is a rooftop restaurant that only caters for private functions and it is above the rooms in the hotel side, with access through the same front door. There was a function on one of our nights and the noise was ridiculous until 2 in the morning. The front doors were wide open and there was a constant stream of people up and down the stairs, past our room. There is a piano in the lobby, which people were playing. I have no objections to that - just not after midnight! We also had the smell of cigarette smoke as the doors were open all night.  If you are going to have a function suite, it should be separate from the guest bedrooms.I hate writing negative reviews, but all the smaller issues just make it impossible to have a really positive experience.All this being said, we loved Lisbon. It's a vibrant city, with lots to see and do. If you have mobility problems, then the many hills would not suit. However, there is an excellent public transport service, lots of taxis and tuk tuks everywhere.We would highly recommend the Benfica Stadium Tour, if you are a lover of football. Our ticket included access to the museum after the tour.  At 17 Euro's each, it was a bargain. We also went to the Castelo de Sao Jorge.  There isn't a huge amount there but the views from it were amazing and it was lovely to walk around the grounds and find out its history.  We arrived about 11am and it was getting very busy, so I imagine it gets more so as the season goes on. There are lots of boat trips available and we did one that lasted an hour and a half. It was wonderful to see the coast of Lisbon by boat and a very chilled way to do it.There are so many different places to eat and drink, you are spoiled for choice and there are many and varied shops to explore. We had a warm welcome wherever we went.There is so much to see and do, you'd need more than one visit to this wonderful city.",Mar,2024,Mar 2024,2024-03-01,2024,2
Algarve Surf Hostel - Lagos,Anna D,51,Anna Dwrote a review Aug 2019,"I’ve been to 50+ hostels around the world and this is the most homely and chilled hostel I’ve ever stayed in! I can’t fault this place, from the amazing breakfast to the adorable pug Lula ready for a cuddle. A great social environment and super easy to meet new people as a solo traveller. Shoutout to Laurie the BBQ king, they’re not to be missed! Beds are super comfy with privacy curtains and dorms and bathrooms cleaned everyday. The surf instructors are informative and really take the time to correct and perfect your technique. Thanks so much for having me guys, would 100% return without a doubt!",Aug,2019,Aug 2019,2019-08-01,2019,5
Valverde Lisboa Hotel & Garden - Relais & Châteaux,JonNYC-UK,4,JonNYC-UKwrote a review Sep 2014,"The Valverde is one of the best hotels I have ever stayed in.Fantastic location, beautiful sophisticated decor and incredibly friendly and help staff.Everything about this hotel is top notch.  I literally cannot think of one thing they could improve on.Do not hesitate to book this hotel. We will be back and we will be telling all our friends about this gem.",Sep,2014,Sep 2014,2014-09-01,2014,5
Luna Clube Oceano,Annie B,10,Annie Bwrote a review Jul 2014,We have just returned from our second visit to this hotel and I can say we were disappointed.  There has been no updating since we were there last and the room we were given this year was quite poor.  The fridge hardly worked and made loud noises all night.  Staff did look at it for us and promised it had been fixed..... The door simply did not fit anymore so the fridge was constantly working or defrosting itself.  The cooker door also looked like it had been pulled off and they had attempted to stick it back together.  Shower curtain rail fell off every time you used the shower....  However the room was very clean and the staff came in at least once every two days to tidy up and change the towels.  Staff were helpful but did very little to control the large number of groups of teenagers that were staying.  Parties were a nightly thing with empty bottles thrown in the pool and broken glass on the poolside.  This is not a hotel for couples who want a chilled out holiday as advertised.  Location is perfect and with a bit of modernisation this would be a lovely place to stay.  I don't want this to sound too negative however it is wrongly aimed at couples wanting a beach holiday.,Jul,2014,Jul 2014,2014-07-01,2014,2
PortoBay Liberdade,hdn h,0,hdn hwrote a review Nov 2015,"Fabulous location however incredibly noisy with up,and coming building projects adjacent to the property.Facade of the building is delightful and the interior very impressive .Bar staff are light on the ground and this is reflected in the service.Breakfast staff are delightful and the breakfast offer is very good.",Nov,2015,Nov 2015,2015-11-01,2015,3
Hyatt Regency Lisbon,Aparna I,0,Aparna Iwrote a review Jul 2025,"We were so happy with our stay here and we are quite discerning travelers. It was clean and the staff was warm, kind, attentive. The rooms were huge and well equipped with everything we needed for ourselves and our young children. It also managed to feel private and personal, despite having other guests there. The breakfast was delightful. We would absolutely stay here again!",Jul,2025,Jul 2025,2025-07-01,2025,5
Casa Mitchell Apartments,bwfcjohn,66,bwfcjohnwrote a review May 2021,We visited the cassa mitchell for 10 days in May. Having read the good reviews we were looking forward to it and we were not disappointed.  The whole place is spotless and the lady who owns it can't do enough for you. No need to rush down for a sunbed as there are plenty to go round. There is also a fabulous restaurant next door the solgamba and a nice cafe for breakfast Leo's is facing. Basically everything you need within a couple of minutes walking distance. This really is a little jem and we would definitely come back.,May,2021,May 2021,2021-05-01,2021,2
"Reid's Palace, A Belmond Hotel, Madeira",matthewj672024,0,matthewj672024wrote a review Jun 2024,"The beaches photographed on the Belmond Reid’s website, literally do not exist on the island of Madeira. The images and narrative descriptions way overpromise while the experience under delivers. Furthermore, there was ongoing construction at the spa that was very disruptive on multiple days of our visit that should’ve been disclosed in advance.",Jun,2024,Jun 2024,2024-06-01,2024,2
Hilton Garden Inn Évora,petergantenbein2022,0,petergantenbein2022wrote a review Jan 2025,"The hotel is  not only of easy access but also within walking distance to the city centre of Evora.The rooms are modern, nicely decorated and very clean. The staff is very efficient, helpful and extremely courteous. The restaurant offers excellent food and service in a delightful atmosphere highlighted by a very original interior decoration.",Jan,2025,Jan 2025,2025-01-01,2025,5
