hotel_name,reviewer,helpful_votes,date,text,month,year,extracted_date_str,extracted_date,year_int,sentiment_score
Crowne Plaza Vilamoura,Caron G,42,Caron Gwrote a review Mar 2016,"This is a fabulous hotel with a great location on the beach and a short stroll to the marina. I travelled with a friend on a long weekend. The moment that we stepped into the hotel, the staff welcomed us and during our stay nothing was too much trouble. The hotel was clean and rooms were contemporary with extremely comfy beds. You are given a free of water each day, and a top tip is to seek out the ice machines which are slightly concealed on various floors. The bathroom is amazing. A fabulous walk in shower, lots of mirrors and even weighing scales! Plenty of free toiletries too. The bathroom is glass, however you can keep the blind down.We planned in advance to use the spa each day, and we were aware of the charge which didn't bother us.If you have a massage, then you don't have to pay the €11 to access the spa. The indoor pool is great with plenty of sun beds and at times we were the only people using it. The steam room, or hamman was lovely. Adjacent to the pool is also a walk in jacuzzi. The spa facilities were the best we have experienced. We both booked massages in advance which were great, with individual changing rooms inside the treatment rooms.The buffet breakfast in the hotel is fantastic, everything you can imagine. we loved the orange juice machine! We used the hotel bar a couple of times and had a jug of sangria which was lush.This hotel was the best that we have stayed in and we can't wait to return!",Mar,2016,Mar 2016,2016-03-01,2016,5
Crowne Plaza Vilamoura,Sarah S,0,Sarah Swrote a review Sep 2025,"First time at here and had a fabulous relaxing 4 night stay, very welcoming staff, great facilities in easy walking distance of vilamoura and Quarteira,  lovely food from the pool bar and excellent service by the pool waiters.  Lovely surprise of wine and chocolate cake left in the room for my husband's birthday.  We will definitely be returning.",Sep,2025,Sep 2025,2025-09-01,2025,5
Hotel Convento de Sao Paulo,Kimberly F,13,Kimberly Fwrote a review May 2016,"Such a lovely find!  On a stormy day in Portugal, we were greeted with warm smiles and a warm room! All details lovingly attended to at this mountain retreat!  We love the rustic restoration process!All around are cork oak, olives, oranges and lemons (we even picked a few with permission of course) 🌹.The staff were all warm, kind and helpful! Am going to butcher her name, but Madilde was soooo kind. We are vegan and she made certain to clearly communicate this to the chefs......🙏🏽We dined at the hotel morning and evening. The chefs were very creative and made beautiful meals for us with local veggies and even found seitan!Best vegan yogurt in the world was served for breakfast!We enjoyed lovely espresso service (pingo) too, complete with soy creamer!Thank you Fabio and all dining staff for a most lovely treat!We loved coming home to our mountain retreat!Blessings to all at Convento de São Paolo!",May,2016,May 2016,2016-05-01,2016,5
Muthu Clube Praia Da Oura,Christine N,46,Christine Nwrote a review Feb 2024,Another enjoyable stay at this resort. Been having at least one  holiday a year at this resort since 1986 due to being owners. Seen a lot of changes some good and some not so good but I feel finally MGM are getting it right. Lovely apartment with good facilities. All staff were friendly yet professional and helpful. Only had one meal in restaurant which was a breakfast. Maybe it is a bit like a staff canteen but there was an excellent choice of food. Both hot and cold buffets with plenty of choice. We tend to self cater because we enjoy trying all the local restaurants but would definatley try the restaurant again.  The Oceon Bar for the evening entertainment can be very cold at this type of year so we used the piano bar more. Looking forward to our next holiday at  CPO.,Feb,2024,Feb 2024,2024-02-01,2024,4
Hotel Gat Rossio,Flavia C,30,Flavia Cwrote a review Jun 2024,"Hotel in the center, convenient to all services, abundant breakfast and friendly and helpful staff. Perfect stay. Thank you all.Flavia",Jun,2024,Jun 2024,2024-06-01,2024,5
Natura Algarve Club,Yasmin M,0,Yasmin Mwrote a review Apr 2023,"Excellent service! Big thanks to Pedro who made sure all the guests were well looked after, we felt very safe in the complex. Would definitely visit again. Great location and staff made the holiday so much more enjoyable :).",Apr,2023,Apr 2023,2023-04-01,2023,5
Crowne Plaza Vilamoura,home457,93,home457wrote a review Aug 2017,"Right on the beach front with great views and a pleasant stroll into busy harbour. Stayed on 8th floor, lovely room with balcony. Super pool, no problem with sun beds as they strictly enforce unattended beds and remove towels if left too long. Amazing breakfast selection. Staff all seem friendly and helpful. Will definitely go again.",Aug,2017,Aug 2017,2017-08-01,2017,5
Hotel Albergaria Dias,Guda de B,0,Guda de Bwrote a review Mar 2025,"What a warm welcome to this lovely hotel. Friendly people, who are always there for you. The location is perfect, you are so near the old town via a nice path. There are many nice restaurants within 300 meters. The hotel is very clean, fresh towels every day and poolside free towels and also great service.Breakfast has everything you want.Tasty fresh fruit, an egg every day, boiled or fried or scrambled and tasty sandwiches.Tophotel, topligging, topservice.I will definitely be back here!",Mar,2025,Mar 2025,2025-03-01,2025,5
Pestana Viking,RichieWestMids,11,RichieWestMidswrote a review Jul 2016,"We had planned this trip for well over a year as it was not only a Family Holiday but our Wedding too !We had liaised with Lili at the hotel for well over twelve months to ensure or wedding would be a dream come true , and with the support of Lili and her fabulous team it was just that.The hotel is set in wonderful grounds with the most fabulous views of the the sea and surrounding beaches.We stayed half board and both breakfast and dinner proved to be outstanding with an excellent choice of well presented foods and good service.The pool was well kept and sun beds were always available and well positioned around the well groomed gardens.Our wedding was set amongst the palm trees which was extremely private with an amazing selection horderves and a few glasses of champagne.The family holiday was wonderful and our wedding day a dream.A big thank you to Lili and her excellent team !",Jul,2016,Jul 2016,2016-07-01,2016,5
Hotel Albergaria Dias,Boveyphil,46,Boveyphilwrote a review Feb 2009,"I booked this hotel following the reccomendations on Trip Advispr and was not disappointed. In fact I didn't think anywhere in this price bracket could be so good but it was even better than expected!Staff - absolutely brilliant. Helpful and informative without being intrusive.Breakfast - superb. Full selection of bread, local fruits etc..Setting - wonderful secluded setting in the old town. Interesting garden with lots of wildlife (blackcaps, canaries & monarch butterflies)Pool - nice (unheated) pool. Even managed to swim in the first week of February!",Feb,2009,Feb 2009,2009-02-01,2009,5
Hotel Albergaria Dias,vwmad,47,vwmadwrote a review Jul 2009,"Slected this hotel on the strength of the reviews on Trip Adviser and to be perfectly honest lives up to most of the reviews say.Hotel is very clean, well situated and the staff are wonderfull you get a guided tour of the hotel on arrival and welcome drink, Mr Dias and his son are always about and are never to busy to talk to the guests, the pool while not heated was quite pleasant once you were in it and their was always plenty of sun loungers available.Snacks are available at the pool bar until 3pm, while i found the choice and quality of the breakfast first class.All in all one of if not the most enjoyable hotel experiences i ahve ever had and i would recommend this hotel to anyone thinking of going to Funchal.I enjoyed Funchal, me and my partner wanted a quiet holiday and certainly got it!Madiera is a lovely place with lots of things to see and do as well as very nice people if i was ever to go back i would certainly stay at this hotel again however i think that might be in few years time when we are bit older!",Jul,2009,Jul 2009,2009-07-01,2009,4
Hotel Albergaria Dias,DENIS K,6,DENIS Kwrote a review Dec 2015,"Returned home Monday 14/12/2015 after spending a wonderful week at this little gem of an hotel situated in a great location in the old town of Funchal. Mr Dias, family and staff are very helpful and could not do enough for you without being intrusive.The fresh fruit available at breakfast is a must and not to be missed. The rooms and the rest of the hotel are spotlessly clean and would recommend anyone looking for the small andpersonal touch hotel this is the one for you. Book now you will not be disappointed.Den & Ann",Dec,2015,Dec 2015,2015-12-01,2015,5
Ocean Gardens,Alina E,5,Alina Ewrote a review Oct 2022,"The hotel is located in Sao Goncalo, at a very short distance from the center of Funchal (you can get there in 10 minutes by bus or hotel car). During our stay we had the most beautiful sunsets, in two mornings we had quiet rain and then rainbows. The room is very cosy and nicely furnished. The hotel staff (reception,  service, cleaning team, kitchen) very kind and good professionals. When we return to Madeira, we will definitely choose the Ocean Gardens hotel!",Oct,2022,Oct 2022,2022-10-01,2022,5
Upon Vila - Alcochete Hotel,Fatima,0,Fatimawrote a review Mar 2024,Very pleasant stay. Very varied breakfast. Large rooms with balcony. Panoramic pool and rooftop bar with fantastic views. Excellent location. Excellent choice of hygiene products. Returning safely,Mar,2024,Mar 2024,2024-03-01,2024,5
Natura Algarve Club,CasaSandy,26,CasaSandywrote a review Sep 2010,"Stayed here 6-16 Sept with husband, and my mum and dad.  Massive rooms, very clean and well equipped (but no kettle - boil water on hob using saucepan).  Air con was available, you need to reduce the reading on the hand held remote to 20 degrees to get the room cool (it was about 30 degrees at least while we were there). No english channels on TV but not a prob for us.  Here are the positives:Good location, very quiet.  Clean spacious rooms with lovely pool area, pool bar/snacks at reasonable prices.   Walk up steep hill to road and there are about 10-15 restaurants/bars + a couple of supermarkets and an exchange facility.  The beach is about 700 metres away. Friendly staff, intercom available in room direct to reception if you need. The strip area which is more lively is about 15-20 min stroll. Few negatives for us though, namely:  there were only approx 6 parasol shades around the pool area for approx 40 sunbeds.  Three of them were non-functional too.  This was a huge problem for us as we need to lay in shade as can't take full sun.  Management told us they had masses of parasols at beginning of season but most had broken and they had not replaced them.  So we used the Ourapraia Hotel pool - turn left at top of hill, walk past supermarket and round corner and you will see wooden steps up to the pool area.  Free to get in, masses of sunshades and comfortable beds/pool bar/snacks etc.  Other negative for us was the bar closed at 11.30pm so you couldn't stroll back later than that and have a night cap before retiring to bed.  There were very few staff around to be honest most of the time we were there.  Although a good location for able bodied, it is not suitable for people with walking difficulties as there is no lift available to get you up with your cases when you arrive (or back down).  We were on top floor and my parents on 2nd so it was a job to get up the stairs with heavy cases (and my dad found the stairs quite tough going, plus walking up the steep hill when you exit the apartments).  The beach is down too so you have a hill to come up - fine if able bodied but not otherwise.  Other than that we had a lovely time!",Sep,2010,Sep 2010,2010-09-01,2010,4
Lisbon Style,eirinicha,24,eirinichawrote a review Jul 2017,First of all very kind staff..very good breakfast. The room was big and nice decorated. The only bad thing is that the bathroom was small! Verry clean room. Good wi-fi. Nice location..near metro station! If i ever travel to lisbon again i'll choose it!!,Jul,2017,Jul 2017,2017-07-01,2017,4
Eurostars Porto Douro,Bar Levi,17,Bar Leviwrote a review Oct 2018,"We took two apartments (4 adults and a child) in this hotel , nice place new and clean . Good breakfast,not so fresh ( the fruits ). there is no equipment in the apartments kitchen . there is parking in payment under the hotel. Good wifi signal.slow Service in the hotel restaurant.Bottom line nice place but it can be better.",Oct,2018,Oct 2018,2018-10-01,2018,4
Hotel Principe Lisboa,pierrejutras777,2,pierrejutras777wrote a review Aug 2016,"I found this hotel in Lisbon for a 2-day stay part of our vacation for my family, while waiting for our flight back to Warsaw. I thought it was an expensive choice, but ended up to be good for what was offered (breakfast, service, AC, Internet, location for Metro).  They have an excellent welcome and service, bar on site to get some food or coffee, and the staff even printed for me my Boarding pass for my flight.  It was an amazing choice as it was located just accross the San Sebastiao Metro station (last station from Red line, from Aeroporto station), we had access to the Lisbon city very easily, and just a 30-min ride to get back to Airport.  We could easily visit many sites from the Hotel, go for walks around in the safe neiborhood, and even go for a TelePizza meal just 2 minutes away (much cheaper than regular restaurant - great with teens!) on the same street. We could go on Sunay at 10 am to the Third Baptist Church of Lisbon for a beautiful service in Portugeese - just 5 minutes away on Filipe Folque St.  We totally recommend!  At Hotel, breakfasts are delicious, and include even those Lisbon-famous \"tarts\" from Belem. Internet access is excellent downstairs and in eating area, but was not that good from our rom on the 8th floor - but no big deal.   Great stay!",Aug,2016,Aug 2016,2016-08-01,2016,5
Altis BelÃ©m Hotel & Spa,petitemarie,8,petitemariewrote a review Sep 2010,"Since we love modern architecture, we decided to try Altis Belem.  The property and the service are top notch.  All the rooms have a view of the water.  From their cocktails to breakfast were superb.  I strongly recommend this hotel to anyone who expects great service,  good view, delicious meals, modern amenities and immaculate rooms.",Sep,2010,Sep 2010,2010-09-01,2010,5
White Exclusive Suites & Villas,Slee,0,Sleewrote a review Oct 2022,"I stayed in this beautiful hotel with my husband to explorer São Miquel Island. It is a small boutique hotel in calming area of Lagoa. We had the ocean suite that looks out south side of the island. A comfy bed, clean room and small kitchen area to make coffees and AC worked great. It’s very zen and quiet place so you can get a good rest. The reception team( Joao, Rebecca & Sandra) were so kind and attentive and always looking out for us. The kitchen & dining team were also lovely. The breakfast was b/t 9-11am and everything on the menu were delicious. They also have the infinity pool which I only used one day but really nice. It felt so good to come back to the hotel after a long hike and just chill by the pool area. On the dry night, they put out a pit fireplace by the pool which is very romantic. Can’t wait to come go back to the Açore and stay here. Thank you everyone at White villas!",Oct,2022,Oct 2022,2022-10-01,2022,5
Legendary Lisboa Suites,boondie_oz,22,boondie_ozwrote a review Oct 2012,"We spent 6 nights at the Clarion Suites and found little to complain about.  On arrival we were told that our room would not be ready until the next day, but that they had arranged a room at another hotel for us at the same price.  So we spent our first night in a different comparable hotel and on our return to Clarion Suites the next morning were were allocated a street facing, third floor, suite.This suite was excellent and much more comfortable than the hotel room we stayed at on the first night.The breakfast room is limited in capacity, so if you want to eat inside be early or be prepared to wait for a table.  We found eating outside on the patio was refreshing on a sunny morning.Overall we found the staff most helpful and courteous, and had no issues with the cleanliness and cleaning of the suite.We would definitely stay at the Clarion Suites again if and when we return to Lisbon.",Oct,2012,Oct 2012,2012-10-01,2012,4
Legendary Lisboa Suites,AnitaBGD,13,AnitaBGDwrote a review Jun 2006,"We stayed at Clarion for 8 nights late April / early May and loved it. The size of the suite was more than adequate with a spacious living area, good size bedroom, kitchenette and dining area, as well as a huge bathroom. The staff was extremely helpful, especialy the lady called Fatima at the reception desk! The room was clean and, even though facing the street, very quiet. Swimming pool area was well maintained, and we enjoyed it on a couple of afternoons, in conjunction with light snacks and drinks from the hotel's bar. Although we were warned that it was not quite centrally located, it is only 20 minutes of pleasant walk from Bairro Alto, and 5 minutes from Marques Pombal Sq metro station.The only downfall we found was breakfast. Though it is meant to be served until 11 AM, if you come down at 10:30, most of the food would be gone and no replenishment made. On the other hand, if you come earlier, you'd always have to wait for either bread, or eggs, or fruit, or coffee - there just seems to be a general lack of organization in the kitchen. Thankfully, Lisbon has many interesting choices for breakfast, so this didn't bother us much. As for Clarion, we definitely recommend it.",Jun,2006,Jun 2006,2006-06-01,2006,4
Hilton Porto Gaia,Go827426,0,Go827426wrote a review Oct 2023,"Location is great!  Easy walk to many waterfront restaurants. Hotel is very nice and quiet.  However, the a/c did not work in our room.  We informed the front desk of this but came back to our room at bedtime, on night two, to find it was still HOT in our beautiful room.  Also the lobby and restaurant restrooms have a weird feel about them  as they are 100% dark until you step into the room.  They need some light in these areas.",Oct,2023,Oct 2023,2023-10-01,2023,4
HF Fenix Lisboa,ANJUGOELA,210,ANJUGOELAwrote a review May 2018,"This hotel is very conveniently located on Pombal square. The metro station is right opposite the hotel and the bus stop right in front of it. The hop on hop off buses and the tours leave just a minute's walk away from the hotel. The city center is a very pleasant and convenient 15-minute walk away from Fenix Lisboa. Our room on the 4th floor was spacious and comfortable, though we found the bathroom a bit small. It had a lovely view of Pombal square. The breakfast spread was good and the staff courteous and helpful.We had a very comfortable stay here and would recommend it to guests who want to stay around the city center, yet away from the hustle, bustle and the crowds.",May,2018,May 2018,2018-05-01,2018,4
Pestana Bahia Praia,jsl898,149,jsl898wrote a review Oct 2018,"The Azores were already beautiful. This just added icing on the cake. We arrived to the hotel and were greeted by super friendly folks at reception, joking and smiling and welcoming. The process was so quick, we were on our way to our room in no time.Our room was ridiculous. We had requested something with nice views for our special getaway. Pestana went above and beyond! There were 360 degree views from every room - of the ocean, mountains, other side of the ocean, park, gardens, etc.We spent so much time on our balcony, watching sunset and enjoying a glass of wine. The beds were so soft and comfy. Bathroom beautiful and marble (also with views!).The hotel itself is pristine. Clean, amazing views everywhere, great design. The grounds are impeccably kept, and there is a beach right nearby that you can walk / swim. It's warm, and no seaweed or anything.Also, this hotel's restaurant may be the only place on the entire island that has reliable dining service :) They don't rush you at all, but your food and check always come out in a reasonable time, which does not seem to be the case anywhere else. We always tipped.The pool is SO amazing. Warm, beautiful, deep, and right on the ocean. Could it be any more picturesque?? We are already so excited to come back. We've recommended the hotel to everyone at home. Thank you!",Oct,2018,Oct 2018,2018-10-01,2018,5
Residencial Londrina,ZiaVicky,4,ZiaVickywrote a review May 2013,"The residencial is located 5 minutes from Marques de Pombal metro station, just 3 stops from downtown Lisboa. It's located on the first floor of a building but you can find it easily because there's a big sign outside. The furniture is old but the rooms and bathrooms are spotlessly clean. Breakfast is simple: tea/coffee, orange juice, bread and spreads but the bread is always fresh and the juice is real orange juice. The owner is very nice and kind and is always there if you need help with a street or a suggestion for a good restaurant. We would definitely go back.",May,2013,May 2013,2013-05-01,2013,4
Hilton Porto Gaia,happymommywith3,80,happymommywith3wrote a review Sep 2024,One block away from the Douro River.  Our room was clean and roomy.  Breakfast options were plenty.  Walking distance to many wine tasting.  The gondola is also a short walk away that takes you to the top of the Dom Luis bridge and the monastery.  The area is very clean and sage,Sep,2024,Sep 2024,2024-09-01,2024,5
Onyria Quinta da Marinha Hotel,Jo M,0,Jo Mwrote a review Mar 2022,"Had stayed at QDM many years ago and was pleasantly surprised on how well it had been renovated. With bright, spacious and modern rooms, and at the edge of the only of two RTJ sr courses in Portugal,  it’s a must stay for golfers. Loved it and will be back with the clubs.",Mar,2022,Mar 2022,2022-03-01,2022,5
Onyria Quinta da Marinha Hotel,Miguel Q,3,Miguel Qwrote a review Jan 2024,"Amazing hotel, spacious bedroom, extra comfortable bed and luxury bathroom. The hotel presents high quality details and the staff is amazing. We also had a round on the golf course which is probably one of the best in Portugal. All around was a great experience!",Jan,2024,Jan 2024,2024-01-01,2024,5
Vila Galé Coimbra,shelley134,41,shelley134wrote a review Oct 2015,"The standard room was extremely spacious, clean, and comfortable. There was a small terrace facing the water, unfortunately the weather was bad!Bed was so comfortable, room quiet, slept great!Breakfast was very good.If you want a coffee pot in the room, it needs to be ordered!Would happily stay here again, if ever in Coimbra",Oct,2015,Oct 2015,2015-10-01,2015,4
Longroiva Hotel Rural,DebMyReview,22,DebMyReviewwrote a review Dec 2016,"This hotel is very cleverly designed and the interiors are playful and ultra modern.The staff are very friendly and helpful. Unfortunately, we don't speak much (any) Portugese, but the staff were eager to practice their English, lucky for us.During our stay, we had asked the lady at reception for an iron and ironing board.  However, she insisted on ironing the shirts herself, which is above and beyond, so thank you to her!Our room was luxurious and peaceful with a view over the outdoor thermal bath. It was just fabulous.All in all, a little bit if luxury and well worth the three hour drive frim Porto!",Dec,2016,Dec 2016,2016-12-01,2016,4
Onyria Quinta da Marinha Hotel,Maclouro,12,Maclourowrote a review Dec 2024,"Very comfortable hotel and modern decoration.  The rooms have a size above the normal and the bathroom has the best showers I have ever tried. Very nice view to the pool.The breakfast is very complete and well made.The staff were all very friendly, helpful and made us feel like old customers even though it was the first time.",Dec,2024,Dec 2024,2024-12-01,2024,5
