hotel_name,reviewer,helpful_votes,date,text,month,year,extracted_date_str,extracted_date,year_int,sentiment_score
Belmar Spa & Beach Resort,Ann M,1,Ann Mwrote a review Oct 2022,This is a lovely place. Our apartment was very spacious with a nice terrace. None of the pools were heated so that was a bit of a disappointment. The complex is large so when booking you need to ask exactly where you’ll be. The garage parking is very cumbersome and confusing. The location is a short distance from the beach. There are 2 restaurants near the beach but no other restaurants to walk to.Suggestions where to eat and shop (other than there) we’re not given.The jacuzzi was nice although the water wasn’t that warm.,Oct,2022,Oct 2022,2022-10-01,2022,4
Jupiter Albufeira Hotel - Family & Fun,Cabarnacus,2,Cabarnacuswrote a review Oct 2020,"Nice hotel and friendly staff. Dinner service began at 7pm which is much too late for younger children. Snack bar is on offer until then but food quality was not very good and there was no variety from day to day, Burgers, chips and hot dogs. This was our only issue with the hotel. If they fix that this place is very difficult to find fault with.",Oct,2020,Oct 2020,2020-10-01,2020,3
Villas Barrocal,HP15Saucey,36,HP15Sauceywrote a review Sep 2016,"Excellent accommodation! Brilliant pool with comfortable sun loungers and reasonably priced pool bar! The lady who works at the bar is LOVELY and the fries are awesome! Really helpful and friendly staff at reception who were very kind printing out documents for us which we needed. Lovely clean accommodation, the cleaning staff do a great job! We will definitely return to Villas Barrocal and would recommend to friends! Thank you team for a great stay!",Sep,2016,Sep 2016,2016-09-01,2016,5
Herdade Da Matinha,Chris S,1,Chris Swrote a review May 2015,"I've been going to Portugal for over 40 years, having been brought up near Lisbon till the age of 14, and having alternated my visits between Estoril and the Algarve.What have I been missing?Well, the Alentejo is Portugal's jewel in the Crown. Why? It has beautiful beaches, authentic and unspoilt villages and it's not been commercialised.This country retreat is the perfect spot to unwind and just be waited upon, eat great fresh food, see real nature, go for walks - do anything you want. The facilities are stunning, the people of Matinha are warm and offer superb service.My wife, sister, and brother in law were all getting over a family bereavement and could not have chosen a better place for our visit.",May,2015,May 2015,2015-05-01,2015,5
Belmar Spa & Beach Resort,sherts744388,0,sherts744388wrote a review Jun 2024,I had a good experience and Vacation. Location was good and easy to get to different places. Overall it was perfect.,Jun,2024,Jun 2024,2024-06-01,2024,4
Belmar Spa & Beach Resort,Negar S,0,Negar Swrote a review Jul 2022,"This was a perfect location in Lagos. The market was close, beach even closer, several restaurants nearby. The only down side is there is only one restaurant at the Belmar itself- but you have a full kitchen and many sweet local restaurants to get take-out. The pools were awesome because each area had their own- and one main pool area with both a large pool and a kid pool so you could always find space and avoid crowds. The main pool had a bar and food- which was lovely. The staff were helpful. We lost hot water one day and they sent maintenance that day to fix it which was great. Would definitely go back. Lagos in general is a fantastic place to be in the Algarve.",Jul,2022,Jul 2022,2022-07-01,2022,4
Jupiter Albufeira Hotel - Family & Fun,_.or.x,8,_.or.xwrote a review May 2022,"My boyfriend and I have just returned from a week all inclusive at Jupiter, we booked last minute, 3 weeks before with Jet2 and so pleased with the good value for money!Highlights for us were beautiful room, tidied daily, fresh towels bed made etc. Bottle of Prosecco was bought to our room on my birthday which was a lovely touch.Location is 5 mins from the strip which was easy to walk to for 1/2 drinks and come back to the hotel. Beach/ old town 10 mins on the free hotel bus which runs from 09:30/ 17:30. It’s €10 in the tuk tuk if you go of an evening, we used the bus quite a times during our stay.Reception staff and staff in Portuguese and a la carte restaurant especially were really friendly. Carlos from reception is lovely are helped us with booking into the 2 complimentary meals in the restaurants and moving a trip to a day with better weather. Nothing was too much to ask.Pool areas are specious, lots of beds, pool bars close by.Rooftop bar was gorgeous of an evening when the sun is setting.Spa was great on our rainy day, around €10 pp for an hour which was more than enough time.We had a 3 course at the a la carte and the steak was unreal. 3 course meal at the Portuguese restaurant was also lovely and the restaurant staff knew it was my birthday (from checking in were assuming as we didn’t tell them) they brought over a dessert and sung which was really nice. When we checked in we were really informed about these complimentary meals and we loved them so ensure to book in, the restaurants book up quickly.We liked that you could have every drink we asked for as some hotels can be funny with local spirits/ cocktails etc.Buffet restaurant was fairly busy no matter what time of day we went we would definitely return to this hotel but probably later than April as the weather was a little cloudy and windy but not as late as July/ August as I can imagine meal times to be chaos. Did find ourselves going for the same things some days but wasn’t an issue.Earlier you get up for breakfast the better as most mornings beans were freezing, eggs were watery. 8ish it’s much nicer and warm.Lots of choice in the buffet, dinner time is the best meal, especially the fresh pizzas and salads. Would recommend a light breakfast and save yourself for dinner.Wish the reception staff member who checked us in explained meal times, spa/ pool, lifts etc to us a little better but wasn’t a major issue we were fine 1/2 days in.We had a lovely stay and we return as Jupiter is perfect for families and young children.",May,2022,May 2022,2022-05-01,2022,4
Belmar Spa & Beach Resort,AliHWatford,85,AliHWatfordwrote a review May 2012,We stayed 5 nights in the 3 Bedroom appt.  Firstly the staff were very welcoming and could not do enough for you.  The standard of the appt was amazing with everything that we could possibly want.  The spa area was excellent very clean with excellent facilities.  It was quiet but more people arrived by the weekend this meant at times we had the pool areas to ourselves.  We did not try the restaurant not for any particular reason just it was nice to walk out in the evening or get a taxi to Lagos.  Would thoroughly recommend the two restaurants down the hill Campimar and Antonio.  The only negative was the the Jacuzzi did not work the whole time we were there and that would have been a treat as it was partly outside.,May,2012,May 2012,2012-05-01,2012,4
Casas do Porto - Ribeira Apartments,D7451NTangelap,2,D7451NTangelapwrote a review Sep 2018,"Excellent service, both pre departure- with emails and their app and locally, providing us with any information required.It was my birthday and they kindly surprised me with a cake and a bottle of bubbles.Totally recommend",Sep,2018,Sep 2018,2018-09-01,2018,5
Lisbon Destination Hostel,Ping L,496,Ping Lwrote a review Jan 2019,"For the newbies that have never stayed here before, upon reaching the Rossio Train Station, kindly make your way to the escalator and travel to the top floor, and that's where you are going to see the Hostel.We truly didn't expect the personable service.  Pedro, the front of house came over to shake our hands and led us to our room.  The highlight was the view from the room, that looked straight to the Piazza below.  Being Christmas time, there were fairy lights everywhere and streets were bustled with commuters that were in jovial and celebratory mood.Entrance to your room was via card system.  Unfortunately, our lock was damaged and Pedro could only do his best to give us a temporary fix, which was perfectly fine.Breakfast here was surprisingly sumptuous.  WiFi was very good.  There were many programs on offer to bring people together.  The only bummer to our stay there was the ratio of the bathroom wasn't high enough for all of us, and so, you would need to plan yourself accordingly to use the facilities.For those of you that wish to go to Sintra for a day trip, the train station is right in front of your door step.  You needn't worry about not knowing how to purchase the train ticket as the front office was very helpful and informative,   On top of that, Libson Public Transport also engaged personal assistants at certain hours to assist newbie travellers or tourists such as us.Lisbon Destination Hostel lives up to its high rating.  It exceeeded our expectation and more.  It's well priced, friendly, and truly a good start for you to put a smile on your face for your Lisbon travels.Highly recommended.",Jan,2019,Jan 2019,2019-01-01,2019,4
1908 Lisboa Hotel,Triantafillos G,37,Triantafillos Gwrote a review Jun 2022,"Beautiful hotel located in a walking distance to the center of Lisbon. And the most important: young, friendly and helpful stuff.Does a traveller need more? I especially mention Andre at the reception - a perfect host!",Jun,2022,Jun 2022,2022-06-01,2022,5
Pestana Vila Lido,Thomas L,0,Thomas Lwrote a review Aug 2024,"We had a suite facing the sea with an exceptional view. Unfortunately if you are a non-smoker, you collect smoke from neighbours who smoke on their balconies. We can't keep the windows open because the smoke gets into the room. Very little hot water in the shower, it's okay l tte, but it's limit for a 5 star. Forget about the breakfast box at Check-out (before opening breakfast), no excuse from the receptionist... very long service at the pool restaurant. In short an exceptional location, but very average performance for the Award.",Aug,2024,Aug 2024,2024-08-01,2024,4
PortoBay Serra Golf,Almerinda F,0,Almerinda Fwrote a review Oct 2024,"My stay at PortoBay Serra Golf was a true romantic haven. Cozy, with an intimate atmosphere, where every detail seemed made to embrace us, even under the rain. That good rain, which invites to tranquility and brings a special charm to the environment. The staff, always attentive, made us feel at home at every gesture, and the warm pool was the perfect invitation to relax. In the room, everything breathed comfort, from the cosy bed to the decoration that transported us to a place where time seems to slow down.",Oct,2024,Oct 2024,2024-10-01,2024,5
Lisbon Destination Hostel,Johan B,0,Johan Bwrote a review Oct 2015,"One of the best hostel i've ever stayd at. Great lobby with pooltable, pingpongtable and chessboard. Nice and friendly staff with good knowles about the city.  Fun pubcrawls with destination sunset. Close to everyting.",Oct,2015,Oct 2015,2015-10-01,2015,5
Grand Muthu Forte Do Vale,Guru0930,0,Guru0930wrote a review Jul 2019,We enjoyed our stay at this hotel.very good location and large rooms. We stayed for a week and would like to return to this hotel when we plan our visit next year. We enjoyed the pool and the additional plus is heated pool. We definitely recommend.,Jul,2019,Jul 2019,2019-07-01,2019,5
"Pine Cliffs Ocean Suites, A Luxury Collection Resort & Spa",MILLSIE1945,8,MILLSIE1945wrote a review Mar 2024,We have been fortunate to have a good few holidays at Pine Cliffs over the past few years and it never disappoints.All the staff are so welcoming and friendly and the service in the hotel and in all the restaurants is excellent.We love the golf course and once again the staff at the Clubhouse and the Golf Restaurant are great too and all go the extra mile to make sure our holiday experience is the best possible.This is by far our favourite holiday hotel and we can't wait to go back again in May!!,Mar,2024,Mar 2024,2024-03-01,2024,5
Hotel Madeira,Jeffrey D,5,Jeffrey Dwrote a review Sep 2018,My wife and I stayed here for 1 week. We think this is a great 3 star hotel with 5 star staff and service. Especially Artur on the front desk reception. The rooms are very clean. The rooftop bar and snack menu are very good and reasonably priced. There are really good restaurants within a 10 minute walk and there is easy access to downtown Funchal. We’ve already booked our return for next year.,Sep,2018,Sep 2018,2018-09-01,2018,5
Lisbon Destination Hostel,Armelle2809,0,Armelle2809wrote a review Feb 2024,"Everything was perfect !The location is really nice. It is easy to get there from the airport, it is close to the center and to the bairro alto (best neighborhood for nightlife) and as it is within the train station, it is also super convenient to go to Sintra.The staff was also amazing. Special thanks to João ! He gave us great recommendations and was always there to help us !The hostel looks super cute, and it is really easy to meet new people as there is always someone in the patio.I would recommend everyone travelling to Lisbon to stay in this hostel !",Feb,2024,Feb 2024,2024-02-01,2024,5
The Boliqueime Inn Hotel,Rui B,0,Rui Bwrote a review Jul 2018,"Nice people,clean Room,Nice bar,amazing price. Private car parking, clean and pleasant swimming pool, just fifteen minutes away from Vilamoura and five minutes from the highway A22. Next business trip ill have a place to Stay. Five stars.",Jul,2018,Jul 2018,2018-07-01,2018,5
Algarve Surf Hostel - Lagos,Natalie A,16,Natalie Awrote a review Jul 2011,"We are four girls traveling through Europe at the moment. We discovered this hostel through hostel world. It was the first place we looked at in Lagos so we went ahead and booked it.We all really enjoyed our time at the hostel. Aside from the basics; clean spacious rooms with ensuite, free wifi, big comfortable common room with plenty of couches and bean bags and TV, a large swimming pool and BBQ area... the hostel really has a great vibe.The people who run it are all really relaxed and become your friends by coming out into town with you for dinner or drinks or organizing BBQ nights at the hostel.The hostel also offers surf lessons on the west coast which are not compulsory but a great added extra. I had never surfed before and I had such a fantastic time! They also provides lunch on these days an all equipment.If there were any drawbacks the only one would be the location depending on your intentions. It is about a 5-10 minute walk into the centre of town however this suited us perfectly because the neighborhood was really nice and quiet so on the nights we weren't partying we got. Good night sleep. Also as the hostel has a kitchen it is really great that it is surrounded by 3 supermarkets all within about 2-5 minute walk.Overall we loved the surf hostel and would definatley stay there again in the future.",Jul,2011,Jul 2011,2011-07-01,2011,4
"Reid's Palace, A Belmond Hotel, Madeira",Jules,0,Juleswrote a review Nov 2023,"Just a quick note to say thank you to all at Reids for making our week stay such a relaxing and wonderful time.From the beautiful room ,exquisite sheets and pillows through to the excellent food,particularly Villa Cipriani and the famous Afternoon Tea everything was top class.Special mention to the pool staff and without doubt the best sunbeds we have ever encountered.It was also well received to have the general manager come around at breakfast to check that we were happy with everything.A Belmond hotel that we will definitely go back too",Nov,2023,Nov 2023,2023-11-01,2023,5
PortoBay Liberdade,sightseer61,13,sightseer61wrote a review Apr 2023,"We loved everything about this wonderful hotel. Super friendly staff, incredibly comfortable beds, a cute little balcony that caught the evening sun, and delicious food in the bistro. We can't wait to return. Thank you.",Apr,2023,Apr 2023,2023-04-01,2023,5
PortoBay Liberdade,537acg,0,537acgwrote a review Apr 2017,"I stayed for two nights. The rooms (or my room:) were very nice, as well as the work out and spa. The breakfast was delicious and - most important - the staff was so very nice and helpful. I would very much like to return.",Apr,2017,Apr 2017,2017-04-01,2017,2
Hyatt Regency Lisbon,rod,0,rodwrote a review Sep 2024,Every staff member was over the top in trying to help.  Hotel property itself is top notch(and I stay at a lot of Hyatts).  Roof top bar has a great view.,Sep,2024,Sep 2024,2024-09-01,2024,5
PortoBay Liberdade,Michael A,4,Michael Awrote a review Jul 2016,Very nice and excellent hotel situated in a very nice area only 15 min walk to downtown Lissabon. Very nice swimmingpool and fitness area. Also do not miss the sky bar and spa on the 7th floor. Brilliant breakfast and very kind staff. Superb service.,Jul,2016,Jul 2016,2016-07-01,2016,5
Independente Principe Real,tambra W,2,tambra Wwrote a review Jun 2023,This was the absolute worst stay of my entire life.  I arrived later in the day my first day and was super tired and went to sleep so I did not notice this until the next day.  There was Black Mold in the Bathroom when I was about to get in the shower.  I had a private room with ensuite bathroom.  Black Mold does not grow overnight.  The Accomodations Manager - Manuel Forbes Bessa stated they would issue me a refund to which he emailed me and asked for my bank routing number and account number.  Who send this information over the internet in an email.  Total bogus.  So this ended up costing me double because I checked out after they did not clean room and went to another Hotel.  Do yourself a favor and stay far far far away from this one.,Jun,2023,Jun 2023,2023-06-01,2023,1
Algarve Surf Hostel - Lagos,halkwak,0,halkwakwrote a review Apr 2019,Couldn’t have had a better experience at this hostel. Staff were super helpful friendly and fun. Smaller hostel with chill vibes and a really nice pool! The Included Breakfast was amazing. Hope to come back again soon!!!,Apr,2019,Apr 2019,2019-04-01,2019,5
Belmar Spa & Beach Resort,Susan Brown,0,Susan Brownwrote a review Jul 2025,I first visited the Belmar in 2013 and have watched it settle into its surroundings ( the plants and flowers are beautiful) and grow into confidence as a hotel where I feel instantly at home. There are many reviews referring to the lovely apartments and the fact that the beautiful Porto do Mos beach is 5 mins walk. I just want to say that the staff have always been wonderful and helpful. The Spa treatments are fantastic. My face glowed and my shoulders are now officially relaxed ! If there was anything I could ever have criticised  it was the food set up BUT wow the refurbishment of the restaurant and the pool side bar menu/ cocktails etc is wonderful to see. This is a unique Resort. And wonderful.,Jul,2025,Jul 2025,2025-07-01,2025,5
Tivoli Carvoeiro Algarve Resort,Z2086FSallanc,0,Z2086FSallancwrote a review Oct 2016,Second year in a row at Tivoli. Great hotel and staff in a fantastic setting. Good facilities...swimming pools...gardens...spa...lovely coastal walks and beaches walkable to Carvoeiro with a good selection of shops bars and restaurants,Oct,2016,Oct 2016,2016-10-01,2016,5
Saccharum,AD,1,ADwrote a review Nov 2022,"From the moment we entered the hotel, the staff were amazing and really helpful!The food was amazing especially at Breakfast!Honestly I couldn't recommend this place more and we will definitely be coming back.Much love A&RRoom623.",Nov,2022,Nov 2022,2022-11-01,2022,5
Saccharum,RJ m,3,RJ mwrote a review Nov 2018,Brand new hotel with fantastic rooms and great choice of relaxing possibilities such as wellness area and several state of the art bars on top floor with sun set view. Very nice staff and excellent breakfast buffet. Only thing to improve is the buffet dinner when waiting for your drinks till your food is done. But it is absolute a place to go back.,Nov,2018,Nov 2018,2018-11-01,2018,4
Saccharum,dannyandamanda,57,dannyandamandawrote a review Apr 2022,"What an outstanding hotel, clean, bright with the most amazing staff possible. It all started badly when we discovered a passport had been left in the airport. The staff could not be anymore helpful. They spoke with the police secured the passport which allowed the trip to continue.The venue itself has the most amazing views, if you can afford it try for a full sea view, the pics do not do it justice. If you can't take a trip the view point on the 8th floor. It's stunningThe bars catered for all tastes, the staff were beyond amazing, friendly, helpful and a real happy bunchWe did a mixology class with Nicholas. It ended up being a  1 2 1 session and it was amazing. The lesson was for a full hour with the amazing cocktail tender Nicholas once again another amazing member of staff, a joy to be with.You must book a trip to the spa, it is amazing if you buy a treatment you get entry all day. It was so so relaxing. It all concluded with an amazing massage.The venue is so good the return trip is being planned to cover all the amazing things we did get a chance to doI cannot recommend this hotel and its staff highly enough",Apr,2022,Apr 2022,2022-04-01,2022,5
Tivoli Carvoeiro Algarve Resort,pieter314,0,pieter314wrote a review Nov 2015,"Tivoli is good value for money, great location (ocean view), nice staff, clean, nice room, loved the food ... It's a very nice hotel so thumbs up from me. On my next visit, I will be staying at Tivoli again.",Nov,2015,Nov 2015,2015-11-01,2015,5
Tivoli Kopke Porto Gaia Hotel,Kimleia,0,Kimleiawrote a review Aug 2025,Everything was perfect from the moment we arrived until we checked out. We truly appreciated the hospitality.,Aug,2025,Aug 2025,2025-08-01,2025,5
"Reid's Palace, A Belmond Hotel, Madeira",Simon B,1,Simon Bwrote a review Mar 2023,"What a wonderful experience we had staying at Reid’s. The tranquility of the location, the history of the hotel and the exceptional staff who made the whole experience the most memorable. We loved Madeira and will definitely be back",Mar,2023,Mar 2023,2023-03-01,2023,5
Saccharum,philipdesens29012001,0,philipdesens29012001wrote a review May 2024,"Nice hotel, we felt very comfortable, the room facilities were great but we had a lot of ants in the room, it would be good if the hotel could set up traps etc. The ambience is great, you can't complain and the room facilities are great too. The ceiling was also great but many of the paint and ceilings had holes and stains which probably never came out after cleaning, it didn't bother me personally but you have to remember that it's a 5 star Savoy hotel. The food was always delicious and varied, unfortunately I found a snail in my salad once which of course can happen but shouldn't. The location was very good, right by the sea!The indoor and outdoor pool were also very nice and attractive. But you should be aware that parking costs €10 per night and you can't get a parking space late in the evening, I personally think it's a shame that parking on the street costs something and €5 would have done the trick.But all in all a great hotel apart from a few minor things, I would go on holiday here again anytime.",May,2024,May 2024,2024-05-01,2024,4
Tivoli Carvoeiro Algarve Resort,W4044MJneilw,0,W4044MJneilwwrote a review Oct 2017,"Hotel is very well-appointed, clean and airy. The views are spectacular and the recent investment appears to have been spent creating an excellent facility. There are the inevitable teething troubles but nothing that cannot be rectified in due course. Front desk needs to be a little more 'on the ball', we were kept waiting for about 30 minutes to receive our room details despite having made staff aware of our presence. Breakfast staff were excellent. Very attentive and helpful. Pool facilities are of a high standard with plenty of space.",Oct,2017,Oct 2017,2017-10-01,2017,4
Tivoli Carvoeiro Algarve Resort,Susan F,5,Susan Fwrote a review May 2016,"Had a wonderful stay at this Hotel. Booking a sea view is a must. A good selection of bars and restaurants within a 10 minute stroll, with the centre of Carvoeiro a little further on. Would recommend this Hotel to anyone.",May,2016,May 2016,2016-05-01,2016,5
Muthu Clube Praia Da Oura,Humberto Ivo,0,Humberto Ivowrote a review Sep 2024,"Regarding the opera night, it was excellent.Professionals.Gentle.Voices from another world.Excellent double.I advise you to listen to these voices.You cannot miss this magnificent show.It was the first time I saw a show like this.They sang songs requested by the audience.It was really good.",Sep,2024,Sep 2024,2024-09-01,2024,5
Crowne Plaza Vilamoura,Elliot G,2,Elliot Gwrote a review Sep 2023,"We stayed in a mid floor side Sea view facing Vilamoura and the Casino next door.The room was excellent with plenty storage, fridge, safe and a great size bathroom with huge walk in shower.We stayed on a bed & breakfast only as there are plenty of restaurants around the marina to dine somewhere different every night.The breakfast selection was excellent and always kept topped up with fresh products. The staff were very efficient at keeping the tables clear quickly to minimize delays at busy times.My only area of disappointment was the grass outdoor area where there were sunbeds and \"some\" parasols.There are many missing parasols and  50% of the ones left had broken bars on them and were a bit difficult to put up. The sunloungers have also seen better days.Not what I expected from this hotel but that was the only thing that they need to address.There is also construction  taking place on the Quarteria side of the hotel but wasn't overly noisy during our stay.",Sep,2023,Sep 2023,2023-09-01,2023,4
