hotel_name,reviewer,helpful_votes,date,text,month,year,extracted_date_str,extracted_date,year_int,sentiment_score
"Reid's Palace, A Belmond Hotel, Madeira",ElleC,47,ElleCwrote a review Jul 2019,"We visites for a week in June this year and had a deluxe sea view room with balcony. Beautiful, clean and peaceful....all that we wanted from holiday - 5 star attention. Only problem was that on the Wednesday night we received a letter on return from another marvellous dinner saying that the pools would be closed to guests from Thursday to Saturday due to a travel awards ceremony. We were so down hearted. We asked to see the manager and he met with us for coffee...he offered us a day trip around the island in a private limo on the Saturday (whilst all the setting up of a stage etc was happening) and a dinner in the grounds with a violinist. This was very kind and we did appreciate it, especially as we had a fab tour of Madeira with our wonderful guide, Ricardo. However, we returned to our room on Saturday night and all we could hear from our 'peaceful' balcony was the sycophantic awards people, who were very ignorant to the fee paying guests, despite them being Travel agents....really!! We phoned down and they agreed was very noisy,,,,stopped about 1130 and we left the following day. We went to pay our bill and it had been waved! Fantastic response by the hotel and we did appreciate it but we really just wanted our quiet holiday! We would love to come back to Reid's as it was one of the best hotels we have ever been to...we are very fussy! I would expect Reid's to let people know prior to travel if there is an event taking place!",Jul,2019,Jul 2019,2019-07-01,2019,4
Royal Savoy Hotel,Pedro Santos,2,Pedro Santoswrote a review Jan 2025,It was the first time I was in this hotel and I recommend it. Not only for the excellent location but also for the sympathy and availability of the entire team.One point that I think can be improved is the fruit offering at breakfast.,Jan,2025,Jan 2025,2025-01-01,2025,4
PortoBay Liberdade,saberus,54,saberuswrote a review Oct 15,"This hotel is conveniently located right near the heart of Lisbon, with many sights, restaurants, and attractions within easy walking distance.While a touch on the small side, the rooms and amenities were very comfortable.The staff were all very friendly, professional, and helpful.",Oct,2025,Oct 2025,2025-10-01,2025,5
Torel Palace Porto,martafrg,0,martafrgwrote a review Jan 2024,"In downtown Porto, this place is close to everything. This old palace like house is beautifully decorated, with a luxurious, yet cozy vibe. The room I stayed (Julio Diniz) is very big and comfortable. The breakfast is very good! The service is what you expect from a 5* hotel!",Jan,2024,Jan 2024,2024-01-01,2024,5
"Reid's Palace, A Belmond Hotel, Madeira",Loraine L,3,Loraine Lwrote a review Aug 2020,"With the Covid - 19 restrictions, Belmont Reid’s Hotel are offering the afternoon tea on Sunday and Wednesday’s. So pleased we booked ours a couple of weeks ago, so we are able to go for the 3pm slot - the proper time for afternoon tea. OMG how much sandwiches and cake, we split each cake thinking that was it. Ohh how wrong we were, you could have sat there for 2 hours and eaten until they had to wheel you out. The views are amazing, the staff float around and appear with top ups ❤️❤️  The most amazing was the eclair oh I still sigh longingly when I think of it. Don’t expect Cornish/Devon scones, as you maybe disappointed; look beyond and enjoy the experience.",Aug,2020,Aug 2020,2020-08-01,2020,4
Predicados do Douro Palace,Jürgen K,23,Jürgen Kwrote a review May 2025,"The hotel is close to the center, it is only about 20 minutes walk (e.g. to the cathedral). Very clean, super friendly staff, well equipped. Very good breakfast. For a short trip to Porro quite suitable and recommended.",May,2025,May 2025,2025-05-01,2025,5
Sant Jordi Hostels Lisbon,tesa503,0,tesa503wrote a review Jul 2022,"The hostel is one of the most beautyful hostels I ever visited. The rooms are clean and look amazing. The offer a lot of activities (yoga, sightseeing, dinner, pub crawl,...). The had delicious breakfast (3,50) and dinner (7+free beer). I reallly liked the gardens there.",Jul,2022,Jul 2022,2022-07-01,2022,5
"Reid's Palace, A Belmond Hotel, Madeira",Bruce C,67,Bruce Cwrote a review May 2023,"Such an elegant hotel with a wonderful garden and lots of outdoor tranquil spaces to chill out. Even although the hotel was full, the outdoor areas were never crowded.Cliff top location with sunrise views and both freshwater and seawater pools.Excellent food, friendly and efficient service in a special location..",May,2023,May 2023,2023-05-01,2023,5
"Reid's Palace, A Belmond Hotel, Madeira",SimonW923,40,SimonW923wrote a review Feb 2017,"Our visits to Madeira would not be complete without a return to this old, reliable favorite which always lives up to high expectations. Preceded by a walk in the gardens, lovely despite still being February, the staff are welcoming, friendly and solicitous ensuring that everything is just so albeit with no extravagant accompanying gestures. The selection of teas is bewildering (the four of us had four different ones which made for a protrusion of the Wedgwood teapots!), there is a perfect balance between savoury, sensible size scones held back so one received them warm after the sandwiches, and a huge variety of cakes reflecting Madeira classics as well as others. At each juncture we were offered seconds and even thirds, at no time were we rushed and we enjoyed the memorable sight of a cruise ship leaving Funchal harbour and sail off into a rainbow. A lovely, old fashioned and elegant experience- highly recommended.",Feb,2017,Feb 2017,2017-02-01,2017,5
Quinta do Mirante - ANC Resort,Kirstine1984,85,Kirstine1984wrote a review Jun 2021,"We stayed here for 5 nights and had a wonderful stay. The place is quietly located and with a nice pool area right at the coast with a wonderful view - and no noise! After 2 nights, we had a weird smell in our room, coming from the kitchen. The staff reacted by upgrading us to another room, very nice! In general, staff was super friendly and helpful. Breakfast was good, rooms were spacious with good beds, and all very clean. We would definitively come back!",Jun,2021,Jun 2021,2021-06-01,2021,5
Royal Savoy Hotel,Delia P,317,Delia Pwrote a review Feb 2019,"Before I start, we Need to reinforce our love of this hotel.  The staff, the service and the accommodation here are outstanding though it is true to say the place is ready for the planned upgrades later this year.My one gripe and it’s a continual one is the food offering. For a five star hotel the choices here are so poor. The Al la Carte menu should be available every day and the buffets should be left to a three and four star facility or an all inclusive hotel. There is no place for it here.The menus are repetitive and almost the same as they were when we first came twenty years ago and to respond each time by saying the food is popular is simply not true.  Read the reviews - please.The discount given to RSVC members  still go nowhere to addressing the issue if the food is inferior, particularly when there are so many fantastic culinary delights on offer in other restaurants nearby at a lot less cost. Most residents of timeshare are driven into their rooms to dine or eat elsewhere having experienced this second rate food offering on previous occasions. We had lunch by the pool and it was woeful. The bread roll was stale, the hamburger costs a fortune and chips were extra and my chicken wrap was in a tortilla that was so old if it had been given another day it would have crumbled rather than rolled into a wrap. Absolutely dreadful. No amount of visual niceties could detract from how bad it was. I would like nothing more than to eat fantastic food in our hotel but at this standard no amount of discount can tempt me to eat here more than once.  The Royal Soiree is the only tempting food offering and at €115 per person it is almost as expensive as the Michelin restaurants and only just hits the mark to be considered an acceptable price.  It is purely our loyalty that makes us continue to try to eat in. Please please consider our comments and take them in the spirit they are intended. We have tried to resolve this matter last year with the food and beverage manager but alas it appears to have fallen on deaf ears. I understand it takes time to introduce change but a menu can be changed instantly if you have a chef who understands innovation and enjoys challenge. Send him to Armazém do Sal, Il Gallo d’Oro, the Beresford and Quinta Casa Branca then he can see what quality and five star food is all about.",Feb,2019,Feb 2019,2019-02-01,2019,2
Villas D. Dinis Charming Residence Adults Only,Jill,4,Jillwrote a review May 2014,"We stayed at Vilas D. Dinis in May 2014 to visit the Algarve region. We had an amazing experience and absolutely loved the place. It was so beautiful with all the flowers and plants. The front desk was very helpful and organized, they even gave us a packed lunch as we were checking out very early in the morning. The location is great, it is about a 10-15 minute walk to town, and only a 5 minute walk to Dona Ana beach (named #1 beach in the world in 2012). The rooms were also very nice and safe. They had a fridge enough to hold some beers, wine and some fruit. There was also a safe, iron, flat screen tv and AC. Overall the rooms were clean, spacious and enough for a couple. If you are planning a trip to Algarve and deciding between Albufeira and Lagos we would definitely choose Lagos. We are a couple who likes to go out and drink and have fun and be close to the beach but does not want the crazy loudness that Albufeira may have. We would highly highly recommend this place and definitely come again.",May,2014,May 2014,2014-05-01,2014,4
Chalet Relogio,Matteo,0,Matteowrote a review Aug 2025,"Leaving aside the room: small, with ridiculous window, with bathroom without areaphores and no air conditioner.Leaving all this aside the most serious thing is the OWNER who acted like a real bully and rude to us, just for leaving a truthful review on the dilapidated structure.Fortunately the owner is no longer a young person and therefore should soon retire.DO NOT GO TO THIS RUDE MAN!",Aug,2025,Aug 2025,2025-08-01,2025,1
Hotel Convento de Sao Paulo,normannkalmus,28,normannkalmuswrote a review Jul 2018,"No doubt it's a great place and a fascinating neighborhood, but areas like the reception, the restaurant and the cloister, cloister smell of mold.The wifi is really bad and available only in few places.It was possible to stay just because our tiny apartment was placed outside the main property. The problems, besides the fact the shower is plastic, is that you don't have wifi there.Really disappointing and dangerous if you have any lung problem.",Jul,2018,Jul 2018,2018-07-01,2018,2
Chalet Relogio,yorkshirejohn,101,yorkshirejohnwrote a review May 2016,"Stopped for two nights , its situated above the old town , easy walk downhill but suggest taxi back the owner great guy as is his dog and cat!! ,yes floorboards creak but its an old place , I cant fault it except needs a toaster in the breakfast room overall a great find gardens lovely",May,2016,May 2016,2016-05-01,2016,3
Natura Algarve Club,Mark R,0,Mark Rwrote a review Sep 2022,"We thoroughly enjoyed our weeks stay at the Natura. All of the staff were excellent and nothing was to much trouble. The appartment was very spacious with loads of room and storage. The gardens and pool area were immacuately kept and sunbeds were always avaiable. One or two people did reserve them but there was really no need. The main pool was divided in to four so it was safe for swimmers of all abilities. There is a smaller toddlers pool so everyone is catered for. We did have snacks from the bar and found them to be good quality and reasonably priced.The Natura is located on a quiet street although its only a couple of hundred metres to a great selection of bars, cafes and resteraunts. Special mention to the Royal Chinese restaurant and the Little Britain Cafe.There is a good bus service next to the toutist information centre again just a couple of hundred metres away. The explorer bus leaves from here and a 22 euro pass covers you for 2 days. The blue route goes to Villamaura and the red route to the Old Town and beyond. Taxis to the Old Town cost 7 euros each way. The strip is a ten minute walk however we either used the local bars or went in to the Old Town.",Sep,2022,Sep 2022,2022-09-01,2022,4
Hotel Convento de Sao Paulo,Rui L,27,Rui Lwrote a review Feb 2016,"Very beautiful place, kind people, good food and rooms are fantastic. You take one day to find the secrets of this convent and also the very nice common rooms heated by a very nice fire. I recommend also for families.",Feb,2016,Feb 2016,2016-02-01,2016,5
Ocean Gardens,Talisker1987,22,Talisker1987wrote a review Jul 2024,"Found this hotel through a Google search. I had some queries before we arrive, responses to emails were very quick and clear.Check in was probably one of the easiest I've ever experienced.All staff were really helpful, courteous and attentive.Room was great, a Superior Bay View, was spacious, bed was big and very comfortable. Plenty of cupboard/drawer space and bathroom was large. Very large balcony with an amazing view. Was immaculately clean on arrival and made up to the same standard every day.Excellent selection for breakfast and lovely breakfast area - airy and cool. You could sit outside if you wanted to.We used the restaurant for a few lunches and dinners. Not a huge menu (which is a good thing) everything we ordered was excellent and reasonably priced.The pool area was very spacious with plenty of loungers and umbrellas. Pool was not big but enough to have a good swim. Spectacular views.Value for money was excellent.",Jul,2024,Jul 2024,2024-07-01,2024,5
Eurostars Porto Douro,Barbara B,30,Barbara Bwrote a review Jul 2019,"This was our third vacation in Portugal and every time we were in Eurostars Hotel. This in Porto has great location, nice rooms, excellent breakfast and great stuff! We will visit Eurostars again for sure!",Jul,2019,Jul 2019,2019-07-01,2019,5
Porto PalÃ¡cio Hotel by The Editory,RonboKirriemuir,198,RonboKirriemuirwrote a review Apr 2016,An excellent hotel with lots of amenities and very comfortable rooms. Within easy reach of the town of Porto. Good breakfast and bar facilities. The only thing that marred our visit was the fact that the Bellhop went to our room and removed our luggage although we wanted to take it ourselves to our coach.,Apr,2016,Apr 2016,2016-04-01,2016,4
Ocean Gardens,DavidL952,20,DavidL952wrote a review Sep 2017,"Lovely hotel with large clean room, large bathroom with bidet and quiet for sleeping. The view of Funchal from the room balcony and the hotel restaurant  is outstanding both by day and at night. On our last morning we were up earlier to witness the full moon reflecting on the sea over the bay. Transport to the town could be made by hotel shuttle if pre booked or by no. 39 bus from just outside the hotel, takes about 10 minutes and a slightly precarious ride depending on the bus driver.The reception staff were helpful, the restaurant staff were friendly but the breakfast staff quiet.The hot food  at breakfast was limited to chopped frankfurters or bacon and sliced mushrooms, eggs , fried poached or boiled  and there was cereal, fruit, yogurts, cake and croissants. The food in the restaurant in the evening was well cooked and the portions on the large size.The view of Funchal  could be appreciated at breakfast at an outside table and at the restaurant in the evening.This is what makes the hotel so attractive.",Sep,2017,Sep 2017,2017-09-01,2017,4
Cidnay Santo Tirso - Charming Hotel & Executive Center,Serg_Christie,39,Serg_Christiewrote a review Jul 2014,"This hotel is located in the small town of Santo Tirso, about 30min from Porto. When we booked to stay here for 1 night we were not too sure what to expect, but ended up being pleasantly surprised. The hotel interior is very tasteful and modern, the layout is also interesting with the rooms on floors below reception. The views from the bar and restaurant are stunning, overlooking the mountains and vineyards. Our room was a \"mountain view\" room which was well worth the small extra cost. Nice touches included the complimentary port from the bar, the pillow selection as well as the tea and biscuits at bed time.Buffet breakfast was included in our rate and we were very happy with the selection. One negative point would be that several of the dishes were practically empty and when we requested a refill we were met with some reluctance. Perhaps this is because they do not want to over cater given a limited number of guests? We also did not have anyone remove our used plates which caused the table to become a bit messy.",Jul,2014,Jul 2014,2014-07-01,2014,4
Cidnay Santo Tirso - Charming Hotel & Executive Center,westsussexmike,8,westsussexmikewrote a review Sep 2012,"Situated in an extremely pleasant small town, the hotel is in a wonderful position with a panoramic viewfrom rooms and resturant and balcony. The service was excellent and the hotel immaculately clean. The price we paid was extremely reasonable. Lovely continental breakfast.",Sep,2012,Sep 2012,2012-09-01,2012,5
Luna Hotel Da Oura,Dean,174,Deanwrote a review Aug 2018,"Stayed in the Luna Hotel da Oura for 5 nights when in Portugal. The hotel itself in located right around the corner from new town area of Albufeira. No more than a 5 minutes walk at most.The room was clean but quite basic, little too basic for a 4 star, the best part of the room was the private balcony. The hotel staff were excellent.There is a nice outdoor pool with a basic bar that serves snacks.Overall a nice hotel but not 4 star in my opinion.",Aug,2018,Aug 2018,2018-08-01,2018,4
Altis BelÃ©m Hotel & Spa,CanadianTraveller,12,CanadianTravellerwrote a review May 2019,"A fascinating modern design from top to bottom.  Rooms have floor to ceiling glass for great views and a lot of light.  The top floor of the hotel provides a panoramic view of the surrounding area and is a quite place to relax.  The restaurant at the back of the hotel is right on the riverfront, providing another relaxing but connected space.  Staff go over and above to be help out.",May,2019,May 2019,2019-05-01,2019,5
Hotel Travel Park Lisboa,Penny C,97,Penny Cwrote a review May 2014,"This is the eighth time my husband and I have stayed at the Hotel Travel Park.  We come to Lisbon annually (from San Francisco) to visit my husband's elderly cousin--she turned 92 in December.  We love Hotel Travel Park for several reasons:  it is very clean, the Staff is awesomely great, breakfast is included and very good, free wifi and the location is excellent.I note that some reviewers have commented that the location is sketchy.  This is not a super ritzy area, but living in a big city--I know what a sketchy neighborhood is--and this one certainly is not! In eight years, we have never experienced the slightest  problem.  Further, the elderly cousin and several of her elderly fiends have lived in the neighborhood for years and love it.  All of the shops and restaurants are not fancy, but typical city places.Added hint: There is a new restaurant a couple of blocks away on Rua do Forno do Tijolo.  It is called Brick CafÃ© and is family run and excellent.",May,2014,May 2014,2014-05-01,2014,4
Vila GalÃ© Tavira,IcemanDenmark,28,IcemanDenmarkwrote a review Dec 2009,"We have stayed there several times,it's a' very good hotel exellent breakfast, but the best is the location.You have the local town outside the door.",Dec,2009,Dec 2009,2009-12-01,2009,4
PortoSense,ABKBB,3,ABKBBwrote a review Jul 2015,"My wife and I spent two nights at Portosense in June 2015 while on an extended visit to Spain and Portugal.  We could not have been more pleased with the apartment - we were in the penthouse overlooking Plaza Ribera - and the location.  The apartment is modern, bright and beautifully equipped.  Plaza Ribera is right on the river and is the main meeting place for residents and tourists.  The plaza and riverfront walkway are filled with restaurants and bars and it is lively late into the evening.  The port houses are just a 15 minute walk away across the bridge and the main part of town is a 15 minute walk.  If you are planning a trip to Porto, we recommend Portosense.",Jul,2015,Jul 2015,2015-07-01,2015,4
Turim Marques Hotel,beth1966,39,beth1966wrote a review Sep 2019,"This hotel is very close to a good subway line, buses are across the street and it’s right by a fashionable (expensive) neighborhood. But as a place to stay, it’s just ok.Our room was small and strange, with the sink outside the shower/toilet room and right near the bed. It wasn’t a great use of space and made it tough for one person to use the sink area quietly and let the other person sleep.The buffet breakfast was adequate: lukewarm eggs, bacon and cereals and yogurt with very good pastries. But the coffee was an embarrassment: it’s not fresh, it comes out of a cafeteria style machine (you press buttons for coffee, cappuccino or milk). My boyfriend got the staff to bring him an espresso.The staff were very nice. They recommended a nearby seafood restaurant they told us was very good but we found it overpriced and mediocre. They were surprised and said everyone else loves it.",Sep,2019,Sep 2019,2019-09-01,2019,3
HF Fenix Lisboa,kato_potato1115,16,kato_potato1115wrote a review Sep 2014,"This hotel was clean and the staff was helpful and friendly.  They had a wonderful breakfast spread, with so much variety and it was included in the booking cost.  The hostess was so sweet and always smiling and happy.  The hotel is a short walk from the main parts of town, and there's not a ton to do right around the hotel, but if you don't mind a 10 or 15 minute walk, there are so many good restaurants, bakeries and shopping.",Sep,2014,Sep 2014,2014-09-01,2014,5
Casa Vela Boutique House,A L,8,A Lwrote a review Mar 2020,"We have been staying at Casa Vela at various occasions. It has always been a pleasant experience. It is very well located (in the historical part of the city), in a very quiet setting. The hotel rooms are well decorated and comfortable. The staff is extraordinary!!! Very friendly and helpful. Breakfast is super. Our latest trip, a few days ago, was reassuring as well. Amid all the turmoil originated by the COVID-19 pandemic situation, the staff of Casa Vela has not disappointed us. Everything was thoroughly disinfected. The staff was totally covered with masks and gloves.  Services were at high top. We felt very safe and we will certainly go back in the future. We have not used the swimming pools for safety reasons this time (due to the COVID-19) but they are fantastic!!!",Mar,2020,Mar 2020,2020-03-01,2020,5
Turim Marques Hotel,eric_et_steph,58,eric_et_stephwrote a review Jun 2023,"Stayed at this hotel from June 14th through the 19th after spending 5 night at the Turim Présidente in Portimao, which we absolutely loved!  We were therefore expecting another great stay.  The hotel is clean although we did have an issue with our first room that had ants on the bathroom floor, when we notified the front desk, we were given an other room which was fine, but I would have appreciated some sort of apology for the inconvenience.  The service at the hotel was uneven, the staff friendliness is not consistant, it’s unfortunate.  The second room we got was clean but very dark, very little lighting, and a very small window, the room configuration was odd.  The bed was small and the mattress was hard, the pillows need to be changed, totally uncomfortable.  It wasn’t a bad hotel but definitely not great, there must be better options in Lisbon!",Jun,2023,Jun 2023,2023-06-01,2023,3
Casa Vela Boutique House,Michele,1,Michelewrote a review May 2025,"A lovely hotel in a quiet residential area which is in the 'museum neighbourhood' of Cascais town. Situated about ten minutes walk from the town centre which is full of restaurants, cafes and bars - and of course the museums.It is about fifteen minutes walk from the train station which is handy for day trips to Lisbon. (Although I would highly recommend if you intend to arrive with your luggage by train that you get a taxi from the station as the route is hilly in places and the pavements are cobbled!) In the other direction are the Boca do Inferno cliffs, about fifteen minutes walk.The hotel itself is set in lush green landscaped gardens with two swimming pools and various water features. Our room (number 28) had a large private patio, a sofa and a kitchenette. The staff were very helpful and approachable; special thanks to Milene for her dedication to customer service. We opted for breakfast which was a continental style buffet, fresh and delicious that was constantly replenished. We enjoyed our stay and would definitely visit again.",May,2025,May 2025,2025-05-01,2025,4
