hotel_name,reviewer,helpful_votes,date,text,month,year,extracted_date_str,extracted_date,year_int,sentiment_score
Hotel Covilha Dona Maria Affiliated by Meliá,Alexinho,1,Alexinhowrote a review Jul 2025,"Traveling as a 21 year old student, I spent 2 nights in this hotel, which was a very good choice with an affordable price, very good quality of services and a good location close to Serra da Estrela.The room and the hotel in general were clean, breakfast offers a wide choice of food and drink and the staff was very professional and patient, especially considering my low level of Portuguese.The pool was clean, heated and large enough, and the gym is well equipped, for both beginners and experienced practitioners, with a staff attentive to your exercises to avoid injuries during your workout 💪🏻.Obviously, I recommend this hotel to everyone and for any type of stay, and especially for long stays (2 days and more), so that we have time to enjoy all the hotel services like swimming pool, gym, spa, etc.Personal rating to the front desk and bar teams: thank you so much for your patience and kindness, it was the first time I travelled alone in Portugal, and your patience with my low level of Portuguese made me feel more comfortable here 🙏🏻😇. I will conclude this comment with the following: \"Muito obrigado a todos para sua paciência!\"",Jul,2025,Jul 2025,2025-07-01,2025,5
PortoBay Liberdade,Philippe_Delphine,19,Philippe_Delphinewrote a review Apr 2024,"We returned to this hotel for the 2nd time, the bar is under renovation, the reception without warmth, the room service needs to be improved, there is always something missing and you have to ask at reception. The catering is still good.",Apr,2024,Apr 2024,2024-04-01,2024,2
SANA Capitol Hotel,GALWAYEGG,34,GALWAYEGGwrote a review May 2013,"It has small rooms with a small bed. The fixtures are modern and the shower is good. It is a 20 minute walk to the Rossio area that has many restaurants. It is close to the metro and also the sight seeing tour buses stops. Staff are nice, the breakfast is plentiful but quality is poor enough in terms of hot foods. Decent choice if you are on a bit of a budget. Can walk to the sea from there also. If you like to shop there are many designer shops close to the hotel.",May,2013,May 2013,2013-05-01,2013,3
Park Hotel Porto Valongo,M99,159,M99wrote a review May 2024,"Simple hotel with good beds and nice staff. Breakfast is from 6.30 to 12! So for the late risers. The quality of the breakfast matches the accommodation and is simply fine. Price/quality very good. Not much to do in the area. A restaurant, bar, supermarket and snack bar within 200 meters.",May,2024,May 2024,2024-05-01,2024,4
Hotel Covilha Dona Maria Affiliated by Meliá,NorthStar14086251400,4,NorthStar14086251400wrote a review Jul 2024,"Perfect quality and price.  The hotel is very good. Large pool, full gym, large and free parking. Very good gastronomic offer. Spacious and clean rooms. The staff very attentive and loving.. hotel that is designed for family. We'll be back for sure.",Jul,2024,Jul 2024,2024-07-01,2024,5
Saccharum,cresy06,0,cresy06wrote a review Jul 2021,"Overall an excellent experience. Calheta is not the greatest location in Madeira (very quiet) but you‘re only a short car ride away from Funchal. The Hotel is amazong, lots of hotels, pools, bars and the staff is really helpful and friendly",Jul,2021,Jul 2021,2021-07-01,2021,4
Hotel Covilha Dona Maria Affiliated by Meliá,dtmota,26,dtmotawrote a review Aug 2012,"Had a 5 day vacation with my wife and 2 month old child. Overall we had a nice time at the hotel. The room was suppose to be noiseless but it wasn't, probably wouldn't notice it if not for the feeding schedule of our little baby. Didn't really found out the cause/source of the noise, but did talk about it with the front desk, and they where as helpful as could be considering I couldn't pinpoint  what was causing the noise or where exactly it was coming from.If you like to workout during your vacation, I can honestly say this was the hotel with the best gym I have ever found. It's quit nice and let's you do a very reasonable workout .One thing I didn't like, and found to be very poor was the wifi service provided by the hotel. I was in the 4th floor and had next to none Internet access. The signal was very poor, and most of the time nonexistent. Once again talked to the front desk, and promptly they tried to get it to work a bit better but with no luck to me.The staff was most helpful. Overall, very nice stay.",Aug,2012,Aug 2012,2012-08-01,2012,4
Tivoli Carvoeiro Algarve Resort,Dream36945889295,0,Dream36945889295wrote a review Mar 2019,Lovely hotel in a fantastic position. On arriving we had no idea on how beautiful the area and friendly the people are. Perfect for a beach or walking or both. Plenty of restaurants serving the local cuisine. We particularly liked A Gale and Taste.,Mar,2019,Mar 2019,2019-03-01,2019,5
Quinta do Furão,LaineVastrik,0,LaineVastrikwrote a review Apr 2023,"A fantastic hotel. The view from our room included the Atlantic ocean and steep mountainsides with waterfalls. Perfect breakfast, very friendly staff and personal service. Easy to get to walkpaths in the surroundings. We rented a scooter for longer trips.",Apr,2023,Apr 2023,2023-04-01,2023,5
Natura Algarve Club,travelthew0rld2016,7,travelthew0rld2016wrote a review Sep 2016,"Was a bit sceptical before travelling as some reviews are not great but I was pleasantly surprised! Travelled with friends but I would also defiantly come here as a couple or family. It really does suit everyone! It is great if you are looking for self catering in a good location but not right in the heart of the hustle and bustle. It is a 10 minute walk to both the beach and the main strip area of Albufeira. There is a supermarket 2 min walk from the hotel with a few restaurants and bars here as well. We ate at a couple of restaurants located close to the hotel and they were really good! Prob better than most of them on the strip.Apartments are clean and comfortable, quite basic but you are self catering at the end of the day what more do you want or need? You can get wifi for about â‚¬5 per day for use in your room and around the pool/lobby area.Was reasonably priced bar and lunch/snack menu at the property.Staff were always very helpful and nothing was ever too much trouble, always happy to help with a smile.Pool area was great, lovely large pool so it was not cramped. It was also good as separate kids pool meant you didn't have to be right on top of kids playing if you didn't want to.Just one thing to bear in mind....when we arrived we had to pay â‚¬100 euro deposit for any damages, which was not a problem but if you are not expecting it, then it may leave you short.Overall perfect location, clean and friendly.",Sep,2016,Sep 2016,2016-09-01,2016,4
Pedras do Mar Resort & Spa,Amy K,2,Amy Kwrote a review Jul 2019,"Pros and cons of this resort:Pros: it is more relaxing than the hustle and bustle of downtown Ponta Delgada. The breakfast buffet is included and great selection, the bartender pours generously and makes great drinks, the food at the restaurant tastes good for the most part. I had local azorean white fish which was delicious. the pool is very convenient and clean, there are walking paths nearby. There are beautiful views and good ambiance.Cons: if you do stay here, we would recommend a car. Also, don’t plan on being able to get into your room a minute before your check in time. We arrived so exhausted and there was no wiggle room on our check in time. They do allow you to use the facilities though. Front desk staff are somewhat rude and they don’t have any basic items like ibuprofen. The bathroom is see through. If you’re comfortable with seeing each other go to the bathroom it’s not a big deal but there is zero privacy. The restaurant and accommodations made by the staff overall seem to be the worst parts. We were hungry by 5:30 and they told us dinner starts at 6:30. So we walked around and came back at 7. There were maybe 10 tables open yet they told us we need a reservation. So we made one for 8. We think there might not have been enough servers. They really try to squeeze money out of you. The bread which we didn’t want was extra. The water had to be bought- no option for tap water ( but the bar will give you tap water. ) if you order meat get it more well done. Medium rare is cold. They really try to go over the top with presentation but neglect the basics such as food preparation. Some servers are rude and the manager runs around like a chicken with his head cut off. One night there was a wedding and we were informed the restaurant would be closed for dinner but they were serving a buffet for hotel guests. We found out later that we needed to make reservations. We were able to sneak in and realized there were tons of tables open and so much food, which made he whole thing seem absolutely ridiculous. The hotel does a poor job accommodating for guests. So many times I wanted to say, “I’m staying here, do you know that?!” It would really be in their benefit to also have a shuttle with more transports.Overall it would be in anyone’s best interest to stay somewhere else. There are other resorts nearby with comparable prices that are probably much better.",Jul,2019,Jul 2019,2019-07-01,2019,3
Pestana Viking,Bianca V,0,Bianca Vwrote a review Aug 2023,"Location/view very nice! We had a room with a side sea view on the fifth floor (see photo). In retrospect, we were very happy with this choice due to its quiet location and direct view of the side garden, beach, cliffs and sea. Rooms with direct sea view overlooked the pool and sea.Very quiet around the hotel. I think it could have been a bit more lively. Boulevard Armacao can be reached within 35-40 minutes via a beautiful cliff walk. There is a cozy and friendly atmosphere on boulevard Armacao.You will be taken via Uber for about €5 (bus transport also possible, but not tried)Sufficient sunbeds available at the pool, but many beds need to be replaced.Extra bed in room is not comfortable. Requested an extra mattress after first night. This was also neatly arranged. Regular beds too hard in our opinion.Reception staff friendly and helpful. Cleaning and service staff were very timid and seemed submissive to us. Even with a friendly greeting, they make virtually no eye contact.Breakfast something for everyone, but standard and no variety. Bread (dry) and coffee (weak) not to our taste.Lunch in an outdoor bar: cost/quality disproportionate. Outside of this, an additional 10% service charge will be charged without request. We recommend lunch outside the hotel. Didn't try dinner in hotel.There is a quiet, friendly atmosphere in the hotel, even in high season. If you like entertainment, the hotel is less suitable.We rented a car. Read a lot about insufficient parking. This is also correct directly in front of the hotel. However, you can always find a spot within a few minutes' walk (in the middle of high season).In general, the hotel could use a makeover. In terms of cleaning, everything is (reasonably) kept up to date",Aug,2023,Aug 2023,2023-08-01,2023,4
Crowne Plaza Vilamoura,Anne C,25,Anne Cwrote a review Nov 2018,"Enjoyed a few days here recently. Staff were friendly and went out of there way to make stay and celebrations a good one. Breakfast had a very nice variety available. Rooms were large, with nespresso machine. Just be aware there is a little step in the shower.",Nov,2018,Nov 2018,2018-11-01,2018,4
Muthu Clube Praia Da Oura,Jenny W,0,Jenny Wwrote a review Jun 2024,Rooms are only okay very basic!!!Bathrooms are ridiculously small. If there is anyone in your group a bit larger than average avoid. Always arguments from other residents every night. No security that we could see.The surroundings were beautiful but every day not enough sun beds to accommodate the large complex. Not one day out of the four we stayed could we avail of sunbedsWe went to the bar and although we were NOT all inclusive and WERE PAYING customers you could only order one kebab at the snack bar at a time. After queuing in the large queue to order this we were then told we had to pay at the drinks counter!!! This should be clearly marked as it wastes a lot of time. Also for PAYING customers the option to buy a number kebabs if you want should be allowed.(without the ignorance of the men working behind the counter) All our group had to que separately rather than been allowed purchase some for our friends.The room from the reception is literally a trek and a half. Would not stay here again,Jun,2024,Jun 2024,2024-06-01,2024,2
Crowne Plaza Vilamoura,Swiftwings,40,Swiftwingswrote a review Jul 2015,This is a nice hotel.. 5* as its advertisement. Clean and friendly staff...We booked the suite...We did however feel that if you state 24 hour room service. .your call shouldn't be moved to voice mail.Also..the bar is empty in your room! Which is not a good thing. (No water etc) no kettle..but a coffee machine without the coffee!Its definitely for family ..good breakfast...but no food in bar after midnight and you cannot take your drinks up to your room... (health and safety),Jul,2015,Jul 2015,2015-07-01,2015,3
Natura Algarve Club,Tysya,0,Tysyawrote a review Sep 2022,We have enjoyed a lot our stay in Natura Algarve Club. We had everything we need in the accommodation and enjoyed a lot the outside area with the swimming pool. The staff are very polite. There was a regular change of towels and the cleaning lady Monica was very nice!We would definitely come back to this lovely place!,Sep,2022,Sep 2022,2022-09-01,2022,5
Altis BelÃ©m Hotel & Spa,David D,14,David Dwrote a review Sep 2019,"We stayed at Altis (for the second time!) in September 2019. We just wanted to say thank you to the warm and helpful staff for assisting with our pre-wedding preparations  (in particular for the help with all of our luggage).We loved relaxing in our room with an excellent view of the marina, at the rooftop pool and in the spa (including having a fantastic massage). We also hosted our pre-wedding drinks in Cafetaria Mensagem. Bruno and the waiting staff were very helpful both beforehand and on the night, and our guests commented on the lovely views and the friendly service. Finally, we went to Feitoria during our previous stay and it was excellent.Thanks again. Hopefully we will be back.",Sep,2019,Sep 2019,2019-09-01,2019,5
Luna Hotel Da Oura,Charlene B,4,Charlene Bwrote a review Oct 2017,"Nice hotel, clean and helpful staff. only thing I didn't like about our room was the bedroom was up stairs. Air con didn't work. Only 2 minute walk to the strip. not much happening at the hotel though, pool is nice but bar snacks are poor only toasties and some sort of breakfast plate on offer... Grand spot if your there for a lively week in the new town, nothing else though ...",Oct,2017,Oct 2017,2017-10-01,2017,4
Canto de Luz,pearlburton27,1,pearlburton27wrote a review May 2023,"Beautiful surroundings with a staff that goes out of their way to ensure your great time.  They serve a delicious breakfast with local foods and beverages. The staff assisted us with obtaining tickets to a Fado performance, recommended several restaurants near the venue and made sure we knew how to order an Uber.",May,2023,May 2023,2023-05-01,2023,5
Vila GalÃ© Tavira,Ian S,4,Ian Swrote a review Sep 2017,"Great hotel ,good location, good food, good staff,good amenities,good pool,its only 25 minutes from Faro airport ,direct route along the A25,they have great underground parking directly under the hotel at. Moderate cost",Sep,2017,Sep 2017,2017-09-01,2017,5
Muthu Clube Praia Da Oura,Christine N,3,Christine Nwrote a review Jun 2019,"A good point about this hotel was the room.The food is nothing to write home about, but if you like plastic scrambled egg and cheap sausages for breakfast and stews made up off left overs for dinner you will be OK.We paid for all inclusive but only one bar in the hotel that served drinks without charge,the other bars charged and were not cheap!The staff did not seem happy in their work, the first smile I got was when they asked if I enjoyed my stay at checkout.My reason for writing this review is to worn other family's that the inclusive package is not up to much and could end up costing you more than you think.",Jun,2019,Jun 2019,2019-06-01,2019,3
Eurostars Porto Douro,Charlie L,25,Charlie Lwrote a review Mar 2019,"The hotel was ideal for us. Location is by the river so the view is always interesting and changing, with activity on the bridges and on the water. It is five minutes' walk from the Ribeiro, where there are a lot of bars and restaurants, buskers, street market, boat trips etc, and also the funicular which takes you up to the top of the cliff where the railway station and the main shopping centre are (2.50 euros per trip; it avoids a hefty flight of steps). The hotel was smart and clean, staff friendly and helpful. Breakfast is a wonderfully leisurely affair, if you want it to be, served buffet-style from 7am to 11am which suited us fine because one thing we don't appreciate about hotel stays these days is being chased out of breakfast early. There was always plenty of variety on the buffet. One thing to be aware of is that the hotel does not do lunch or dinner, except as an order from the room service menu (pizza, burger, crusty sandwiches) which you can eat in the bar area. The bar closes at 11pm, which will be a bit early for some but didn't bother us, specially with plenty of alternatives nearby.  The hotel's best-kept secret is the roof terrace, accessible by the lift (press 'C') which is a wonderful spot to relax and enjoy the sun, along with views of the Douro.",Mar,2019,Mar 2019,2019-03-01,2019,4
Lindo Vale Guest House,KBenitez,29,KBenitezwrote a review Oct 2019,"Room was spacious, well lit and clean. It was near a mini grocery store and a walking distance to the metro/bus stop. I was also very fortunate to meet one of the neighbour who was very kind and helpful. Catarina, the host, was also very nice! They have an option for airport transfer that was very convenient for me since I had to leave by 4am. It was a lovely stay for me in Porto.",Oct,2019,Oct 2019,2019-10-01,2019,5
Porto PalÃ¡cio Hotel by The Editory,Djasta_Prasta,40,Djasta_Prastawrote a review May 2014,"Excellent quality hotel, with very professional staff, spacious rooms and spa with no restrictions for age visits (good for children). I don't know if it was about Portugal, but everywhere we went the service was absolutely excellent, friendly and people genuinely paid attention and always try to help.The terrace on the 19th floor had a great view and service, but there were no cushions on the couches or umbrella's for some shade. I know it was early season, as we visited in May, but still you expect that the facilities will be fully prepared for the guests to enjoy.The breakfast buffet was somewhat poor without any raw vegetables and boring choice of sliced fruit. You cannot really enjoy more than once or twice.This seems to be the hotel of choice for all airlines stopping at Porto, so breakfasts were quite busy. Generally I did not like the taste of water and coffee. I do think Nespresso machines should be a standard kit for any self respectable hotel these days.The bed, bathroom and rooms in general were very good quality and well designed and equipped. The WIFI is 10 euro per 24 hours, but speed is really good and I could stream movies without a problem.The taxis are readily available and the only surprise is that most drivers are well passed retirement age, but some drive as on a race all the time.I fell in love with the cutlery of the hotel and bought a 130 pcs set myself from now my most favourite Portuguese brand Cutipol.I know Portuguese food is excellent, but we found one of the best Japanese restaurants in Europe, I am sure (!) called Ichiban (you need to book it in the evening or there will be no space).Nice holiday! Portugal is a great holiday destination! Would absolutely recommend!",May,2014,May 2014,2014-05-01,2014,4
Pestana Viking,AtkinSoares,34,AtkinSoareswrote a review Jun 2016,"Pestana Viking is no doubt a very good resort, mainly because of what it got to offer to residents.... Pros n Cons would sum it up but definitely a recommend !!!!We were a group of 12 and had an amazing time 👍🏼Pros:-Safe, Well maintained and clean rooms, pools, sauna, jacuzzi (all free to residents)-Smiley and friendly staff all through the hotel, and do not interfere in what you do. Very peaceful and helpful.-Amazing location and just near the beach, also a good 15 min walk to InterMarche( local supermarket)- Not overly touristy, so you get your own space.Cons:-In-room amenities could be improved :AC coolness (was not enough to beat the heat), toiletries were bare minimum(toothpaste, moisturiser, hand wash, were all not included), NO complimentary tea/coffee/water in rooms.-The Sea Facing rooms (310, 312, 414) were a BIG disappointment.... Especially at higher rates.- The food can use some spice in it!- The Table Tennis rackets were pathetic ☹️",Jun,2016,Jun 2016,2016-06-01,2016,4
Hotel El Rei Dom Manuel,SouDoRio,55,SouDoRiowrote a review Oct 2011,"This was our second visit in one year to magic and magnetic Marvão and we stayed again at Albergaria el Rei Dom Manuel. The place has kept the level in every aspect. We had a good reception by the owners(that we hadn't met last year), and actually one employee -Maria- recognized me instantely. This small hotel is very clean, well kept in its relatively simplicity, and breakfast is as good as I described last year. They have honest food for lunch and dinner, but I've heard there is another good place to eat which we will try in our next visit!",Oct,2011,Oct 2011,2011-10-01,2011,5
Myriad By Sana,Ari P,2,Ari Pwrote a review Oct 2016,The level of service was excellent! They made us feel like King and Queen! Special thanks To the front desk staff for their kindness and positive atmosphere! Also the upstairs spa area was truly relaxing! Absolutely a true five star hotel!,Oct,2016,Oct 2016,2016-10-01,2016,5
Varzinn Hotel,800mike59,0,800mike59wrote a review Oct 2017,"We stayed for a week at this hotel. Our room was great. We had a lovely little balcony overlooking the garden. The fridge was a real asset. Everything was spotlessly clean and the linen and towels were changed regularly. The continental breakfast was excellent, with a vast range of items to choose from. All the staff were friendly and helpful. It's about a 10 minute walk from the seafront, and a similar time to walk into the town.",Oct,2017,Oct 2017,2017-10-01,2017,5
HF Fenix Lisboa,Ian M,3,Ian Mwrote a review Jul 2017,Great Hotel. The breakfast was very good and had a lot of variety of options. The location was nice and convenient above 1 of the city's metro stations. It was very easy to get between the airport and this hotel by metro and only took about 20 minutes. It was another 20 minutes walking to get to the old central parts of Lisbon such as Alfama. The staff we interacted with at the breakfast area and front desk were generally quite friendly and helpful.,Jul,2017,Jul 2017,2017-07-01,2017,5
Yes! Lisbon Hostel,Itay L,3,Itay Lwrote a review Oct 2016,"We stayed almost a week in YES hostel in lisbon.Great location. Great and cheap dinner including free drinks for 2 hours.Amazing staff including helpful louis, fabio and funny gonzalo.I have been travelling around the world in many hostels and i can say this one was the best expirience for me. Highly reccomended if you want to have fun time in lisbon and meet great people.",Oct,2016,Oct 2016,2016-10-01,2016,5
Yes! Lisbon Hostel,Adam K,0,Adam Kwrote a review Jul 2015,"Stayed here with two other buddies for 2 nights and had a good experience. Rooms and hostel was clean, staff was fun and polite, etc. group dinners for open bar and cheap are a great way to meet people and pregame for cheap. The pub crawl that goes through their hostel isn't great, way too many people for small bars, just head out to Bario Alto yourself. But overall a very good hostel, would definitely recommend.",Jul,2015,Jul 2015,2015-07-01,2015,4
Pestana Bahia Praia,Tim A,7,Tim Awrote a review Aug 2024,We really enjoyed our two week stay at Pestana Bahia Praia hotel. The staff were so friendly and helpful- especially Carla who cooked our pancakes end eggs every morning! We particularly enjoyed the location of the hotel- it’s a stunning spot with good access to the beach. I would definitely encourage renting a car as Ponta Delgada is around 25 mins away. We loved our drives around the island- it’s absolutely stunning.We really enjoyed sitting by the pool and frequenting the pool bar!This is our second full day at home and we’re missing being at Pestana Bahia!,Aug,2024,Aug 2024,2024-08-01,2024,5
Casa Do Rio Wine Hotel,313clp,29,313clpwrote a review May 2017,"Probabily de best place to rest a few days in Douro. Surrounded by Vineyards, peaceful but at the same time with lot of activities to do. The pool is great, the staff wonderful. Dinner is a delicious experience. Don't forget to pet the enormous dog called Touriga",May,2017,May 2017,2017-05-01,2017,5
Hotel dos Templarios,Becca_RGC_83,98,Becca_RGC_83wrote a review Jun 2013,The hotel was perfectly comfortable and staff were friendly. It is definitely good value. However there is no wifi available in the bedrooms which I consider unacceptable and some of the templar themes are very tacky (lit up neon templar cross outside the hotel for example). Fully fit for purpose though.,Jun,2013,Jun 2013,2013-06-01,2013,3
