hotel_name,reviewer,helpful_votes,date,text,month,year,extracted_date_str,extracted_date,year_int,sentiment_score
ibis Styles Lisboa Centro Liberdade NE,Alessandra W,6,Alessandra Wwrote a review May 2017,"The staff and all the structure at this hotel is really good. The staff is friendly and the room is really comfortable. Plus, the breakfast was really well done. The place is really close to the subway, so you can go to every place using this transportation. I really recommend this hotel.",May,2017,May 2017,2017-05-01,2017,5
Hilton Porto Gaia,amanda,37,amandawrote a review Jun 2024,"This hotel is located on the side of the river that is away from the historic part.The hotel has all modern amenities... except that it lacks enough wall sockets and has no USB charging ports. For a modern, new hotel, I expected better ways to charge devices.The hotel rooms are spacious, and the corridiors are so wide. It almost seems like a waste of space. Overall, the layout of the room could have been much better given the copious space.The lighting is very dull, and decor is dark.Breakkfast selection was typical of Hilton, but the staff seemed a little aloofOne tip is to take the finicular to the bridge and easily walk on the bridge to cross the river. Starts at 10 am. This is much better than calling an Uber. The drive is quite winding and long to the historic center.",Jun,2024,Jun 2024,2024-06-01,2024,3
Turim Marques Hotel,wecatchtheworld,0,wecatchtheworldwrote a review Nov 2024,The rooms (superior) were very clean and well maintained at first glance. But then we found that the windows were not tight and there was so much mold around the genster. In the other booked room of the family members as well.,Nov,2024,Nov 2024,2024-11-01,2024,3
O Castelo Guest House,Carl R,7,Carl Rwrote a review Jul 2023,"Fantastic location   Yes it’s up a hill but views are worth it.  Catia on reception is full of excellent recommendations, The rooms are very clean and cleaned spotless , we will come back again . We had a room with a terrace and could hear the sea in mornings  beautiful Obrigado",Jul,2023,Jul 2023,2023-07-01,2023,5
Hotel dos Templarios,Izabela B,50,Izabela Bwrote a review Jul 2018,"My hubby, baby (22 mths) and I truly enjoyed our stay at the Dos Templarios Hotel. The staff was very helpful. The breakfast was delicious with an excellent coffee. The bar was always open, and the seating area indoor and outdoor was  comfortable and relaxing. The room was big and spacious, the bathroom was large too with all the amenities included. I would recommend a stay in this hotel to everyone looking for relaxing and upscale stay.",Jul,2018,Jul 2018,2018-07-01,2018,5
Vila Galé Coimbra,Retiredrewired,52,Retiredrewiredwrote a review Sep 2016,"We knew this hotel was a bit outside of city center, but needed parking, which most other hotels in Coimbra don't offer. Only about 4 blocks walking to shops and restaurants and easy to catch the hop on bus to the university. The hotel itself is very well maintained, rooms are well done, we had a superior room with no view, but the bed was very comfortable. Only quibble was the quality of food offered here at the buffet..dinner and breakfast both low end tour fare. Upgrading the cuisine would make this place a gem. But for a good nights sleep and safe parking, it does the job.",Sep,2016,Sep 2016,2016-09-01,2016,4
Pousada Viseu,C2E,92,C2Ewrote a review Sep 2024,"Wonderful, quirky pousada; spotlessly clean; excellent location; friendly, professional staff; great buffet breakfast.  Viseu is an attractive small town, safe and well-maintained, with several good restaurants and cafes.  Ideal place to spend a day or so, though probably not much longer.",Sep,2024,Sep 2024,2024-09-01,2024,5
