hotel_name,reviewer,helpful_votes,date,text,month,year,extracted_date_str,extracted_date,year_int,sentiment_score
Belmar Spa & Beach Resort,Katie H,1,Katie Hwrote a review Jun 2015,"My family and I stayed here for the first time for a week and it was so much more than we even hoped for. The hotel was opened in 2011 and is in amazing condition, apartments were of a very high standard, facilities excellent, staff wonderful and great peaceful location.5 min taxi into the old town/marina (6 Euros) Beach is stunning, 5 min walk.Perfect if you want great quality, short hall flight, lots of English speaking locals and bargain prices.",Jun,2015,Jun 2015,2015-06-01,2015,5
Jupiter Albufeira Hotel - Family & Fun,sino565,0,sino565wrote a review May 2024,"Lovely resort, lovely people, my second year coming  beautiful place lovely pools food is great entertainment is great for the kids",May,2024,May 2024,2024-05-01,2024,5
Tivoli Carvoeiro Algarve Resort,Dianne L,9,Dianne Lwrote a review Jul 2019,"They had us at the view! We just finished a week here and overall had a great stay. We debated between 4 and a 5 star rating as some of the other reviewers mention there are some things that could be done better. The drinks and food prices were very expensive. Outside of breakfast that was included , we trended to eat or get drinks in town where quality and prices significantly better. Service in the restaurants was just okay and air conditioning in the room did not work well.Despite that there were many great thing about the hotel. The view is better then the pictures. Our family room was a good size and worked well for two adults and two teenagers. The hotel is beautifully decorated. Breakfast was very good with lots of choices. The front desk was very accommodating and helpful. The location is very good and you can walk to the beach or the town in 10 minutes.We would definitely return to this hotel",Jul,2019,Jul 2019,2019-07-01,2019,4
Jupiter Albufeira Hotel - Family & Fun,irenewelsh2018,1,irenewelsh2018wrote a review Jun 2022,This hotel is superb for families and adults alike. Food and drink choice excellent. very comfortable beds within large rooms. No complaints whatsoever. Would love to return when i can. Beautiful panoramic views from rooftop bar and if breezy up there you can get a cosy blanket from bar staff.,Jun,2022,Jun 2022,2022-06-01,2022,5
Belmar Spa & Beach Resort,Daniel P,4,Daniel Pwrote a review Jul 2017,"Just returned from a 6 day break at the Belmar Spa and Beach resort.Very nice, spacious 2 bed apartment. Everything worked and we were very comfortable.Location is key with the Belmar, it's right on a nice beach but walkable (20 mins) into Lagos town, which at night is vibrant and atmospheric.Why not 5 stars?1. Room was cleaned only once in 6 days.2. Although we were aware that check-in was from 4pm we knew we would arrive early and we phoned to see if we could check-in a little earlier. Although they sounded very positive on the phone about accommodating our request when it came to it they couldn't, which left us in limbo for a couple of hours.3.  We come to the Algarve every year and stay somewhere different. At £1100 (room only) for 6 nights, this is more than double the amount we have ever paid for accommodation, therefore expectations were high. I left feeling the Belmar was over-priced compared to other experiences we have had on the Algarve. However, we've never been so close to the beach before, so I guess the location comes at a premium.Ultimately, I can recommend the Belmar.",Jul,2017,Jul 2017,2017-07-01,2017,3
Belmar Spa & Beach Resort,Rui Menezes,37,Rui Menezeswrote a review Sep 2018,"Belmar Spa & Beach Resort is beautiful. It’s wonderful location on the cliff top of Porto de Mós Beach is perfect and if you have a room with a view you can enjoy great sunsets. The rooms are big and in pristine conditions. Food is great, mainly breakfast, which has lot of variety and great quality in everything. We had dinner once and it was also quite good. Parking is available which is great, especially if you go during summer time. We are definitely returning to Belmar!",Sep,2018,Sep 2018,2018-09-01,2018,5
Tivoli Carvoeiro Algarve Resort,mary s,116,mary swrote a review Sep 2023,"This beautiful hotel does so many things well. But it’s the little things that can hurt the experience. The Wi-Fi in the rooms is so bad it’s almost useless: 12mbs. We had no washcloths in the bath - probably just an oversight and not a big deal, but still annoying. The lack of outlets is inexcusable. There are no accessible outlets near the bed. We had to charge electronics in the bathroom and on the floor across from the bed. Really? The bathroom is laid out so that the soap dispenser is on the opposite side of the counter from the sink. It’s 2 steps to get soap and 2 steps back to the faucet. First time I’ve seen that.The breakfast buffet is outstanding and service is very good as long as you don’t need a refill on coffee.  The sky bar is beautiful but I had the worst martini ever there.I don’t know if it was cheap gin, watered down gin, or no gin, but it wasn’t drinkable.In all, this is a beautiful hotel. If only they could fix the little annoyances…",Sep,2023,Sep 2023,2023-09-01,2023,3
Saccharum,emannah,9,emannahwrote a review May 2016,"I am not entirely sure what I expected, this is a quirky place perhaps more style than substance.  Don't get me wrong, there is nothing bad here, it is just that there is nothing great either.  We went for the top end room, a sea view suite and it is lovely.  The suite comes with free spa access - otherwise 20 euro per person per day.  The enormous bath that overlooks the sea is also great fun.That said the room level design is ill conceived and owes more to pretentiousness than utility.  Storage is poor, the provision of sockets is poor (the kettle is plugged in on the floor by the door), the glass doors are just silly, the glass doors on the bathroom offer no privacy, are noisy and irksome. The bed head/utility centre is not fixed, the shower screen is only 50% rather than the industry standard 70% and so water gets all over the floor.  There are too many lights and light switches and the automatic light under the bed is really annoying at 3am when the other half tries to slip away for a quiet bathroom visit (the doors are especially annoying then too).Breakfast is ok but in 6 days we have only be greeted once.  Sorry but, meet, greet and seat with coffee served at the table is a minimum for 4 stars in my world.The spa again is over thought out and therefore misses its own point.  The pool is too cold, the jacuzzi too chlorinated and we have no idea what the relaxation room and salt room are about..... We are regular spa users and even so we're bemused by it.  I am a gym nut and this is one of the better every day hotel gyms I have seen anywhere in the world, so quite happy there.That said we kind of like the place, most of the staff and the hotel in general are trying to make a poor concept work.  The lynch pin is a chap called Jose (Joe) an engaging local who has nevertheless seen the world and knows how to talk to people.The transfers to Funchal for the day are great but a little prices and if, like me you are easily bored, you will need to find things to do as Calheta has little to offer.  On the other hand my wife loves not having much to do so if you are a contented pool lounger, then this is ideal for you.",May,2016,May 2016,2016-05-01,2016,2
1908 Lisboa Hotel,Anna W,0,Anna Wwrote a review May 2023,"I don't routine review hotels on tripadvisor, unless, for good or bad, they are exceptional. The 1908 Lisboa definitely falls into the good category. I wasn't sure what to expect at this hotel as it wasn't our first choice, but I'm very glad it was our second. From the moment we arrived, we were made to feel welcome. Reception is a small desk between the bar and the restaurant but service is in no way compromised. Receptionis Malfada(?) got us a drink and linked us up on whatsapp so she could help us with sightseeing and other queries. A mid evening arrival and our luggage is whisked up to our room while we are shown into the restaurant for dinner. Rooms and bathrooms  are of a good standard, but some drawers for storage wd be good. Reception and serving staff are all friendly and helpful - with only the odd exception (the trouble with high standards is that the odd minor exception stands out!) The hotel is well located in a pretty square with an outside seated area for drinks and two other restaurants opposite for variety. Hotel decor is stylish and quirky. It boasts a young, fashionable clientele but we didn't feel excluded! Dinner was good, breakfast fab with lots of options, fresh fruit etc.All in all, I would'nt hesitate to recommend the 1908 Lisboa.  (The so called five star hotel where we are currently staying could definitely learn a thing or two from the management at the 1908).",May,2023,May 2023,2023-05-01,2023,4
Grand Muthu Forte Do Vale,bjnewton18,14,bjnewton18wrote a review Mar 2016,"Stayed here for 5 days in a one bedroom apartment in March self catering. It was very quiet but everything still ran as normal eg, shuttle bus to old town was on everyday. The apartment was massive, we hardly used the living room but the kitchen was useful with full appliances in and utilities. The maids brought fresh towels every day for us however we made the beds each day, despite this the room was always kept immaculately clean. On arrival the reception staff were very friendly, gave us plenty of information about our stay and they also ordered taxis for us during our stay (which was a cheap company too!) We also used the spa on one afternoon due to bad weather, which was very relaxing with access to the indoor pool, jacuzzi, sauna and Turkish bath however the only downfall is you have to have a swim cap for the pool which they charge €2.50 for each and after this the pool was actually very very cold. As we were self catering we didn't use either the restaurant or the bar as we went to the old town every night, but we did use the games room a few times for pool which cost us quite a few euros as there is only 1 out of the 3 pool tables which has a white ball! Other than those few little niggles, we really enjoyed our stay and it definitely deserves the rating it has.",Mar,2016,Mar 2016,2016-03-01,2016,4
Hotel Cristal Porto,Ro R,0,Ro Rwrote a review Jul 2024,"Excellent hotel in comfort, excellent professionals very clean and caring.It is 30 minutes from the center, with child out area inside, upper terrace and very appropriate for rest.Best place for breakfast and dinner.I recommend it.",Jul,2024,Jul 2024,2024-07-01,2024,5
Horta de Torrejais,Marco D,0,Marco Dwrote a review Aug 2024,"Of the best accommodations we have ever been in Portugal! Everything excellent, from the rooms, to the cleanliness, extreme sympathy of the staff, a fantastic breakfast and to cry for more, the owners of the house, Luís and Catarina, to whom we already thank the hospitality, are extremely helpful and leave us very at ease. The pool is wonderful and allows for good moments in family. In short, we loved and left here with the desire to return quickly. Muto thanks 🙏",Aug,2024,Aug 2024,2024-08-01,2024,5
Hotel Cristal Porto,Louise H,0,Louise Hwrote a review Aug 2023,horrible experience even before we got here we had trouble checking into the room. Me and my friend were staying for a tennis tournament and they wouldn’t let us Into our room and would not refund us. They then decided they would let us in. that day we ordered room service and you couldn’t add your room service to the room which was a joke. I then asked to pay in card but they were only accepting cash. The hotel manager called me 3 times and was very rude to me about the situation. The wifi was terrible I could not access anything for the money I paid it was a joke. Terrible place don’t come here it’s awful. So many better hotel around here for less money.,Aug,2023,Aug 2023,2023-08-01,2023,1
Estalagem Da Ponta Do Sol,DDB_Madeira,18,DDB_Madeirawrote a review Aug 2020,"After months of lockdown we treated ourselves for a birthday the last weekend at Estalagem Ponta do Sol.Living on the island for the last 10 years we always go away to Funchal (from Calheta) but this time decided to go to Estalagem as we've heard so many good stories from friends who had stayed there while visiting us, as well as always highly spoken off by our local friends.First of all, the location is excellent, views to the west and south coast from the hotel is breathtaking. A beautiful pool with infinity corner effect from where you can admire the views. The indoor pool is a great addition for colder days but as we were there in the middle of summer, obviously no need for that. Plenty of cozy corners all over the property where you can find the perfect spot to sunbath while admiring the views. Access is made much easier with the lifts that connect all the different levels. Although we did prefer to walk mostly between the levels as the gardens are so beautiful. From the hotel it is a short walk to the beach below and the picturesque town of Ponta do Sol with its alleyways and cozy bars / restaurants.Our room was on the 3 level facing west. Not advertised as a sea view room, but we had 50% sea view and 50% mountain view, to be honest a much prettier picture also at night with the street lights from the town below. At day the mountains / valleys keep changing with the shades as the sun is moving. We could clearly see the amount of thought put in to make it a safe stay referring COVID-19. The chairs all had removable covers that can be washed after each stay. Rooms are decorated minimalistic which make it easier to disinfect. Bathrobes etc all in packaging, as is the cups etc. Our room was spotless and definitely not dated. I did find it useful to have USB sockets built in. Much easier for charging the phone next to the bed. The balcony was spacious too but we did not make much use of it during our stay.Staff were throughout our stay friendly, helpful  and accessible. Keep in mind, with the current pandemic their workload has probably doubled if not more. We could see them constantly disinfect every table, surface etc.  We did not have dinner at the hotel but did go back each evening for a drink to admire the view and lights. Breakfast was served at our table from a small menu, which I actually prefer to a buffet. It was more than sufficient and no problem to ask for seconds. Interesting the amount of staff during the breakfast hours to make sure all guests were served quickly and efficient and at the same time disinfecting the tables for the newly arriving guests.All in all it was one of our most memorable stays on the island. I just can't believe that we only  get around to visit it after 10 years here but we will definitely soon go back for a weekend break!",Aug,2020,Aug 2020,2020-08-01,2020,4
Hotel Madeira,341mandygordon,21,341mandygordonwrote a review May 2019,"This is a fairly small hotel but exceptionally user friendly. All of the staff, without exception, were extremely polite, helpful and courteous. The hotel was spotless, the food was good and very reasonably priced. I look forward to my next visit and would recommend this hotel to friends and family.",May,2019,May 2019,2019-05-01,2019,5
Lisbon Destination Hostel,David G,0,David Gwrote a review Aug 2019,"Every staff member was friendly and helpful with anything I needed - making change, booking my day trips, lending me an iron, etc. The location is very central and just a 15-20 minute walk to the other hostel by the beach with the pool.",Aug,2019,Aug 2019,2019-08-01,2019,5
Algarve Surf Hostel - Lagos,Elorna,15,Elornawrote a review Nov 2019,"This place is wonderful. It has character, surf charm, a homely feel , and is also totally clean, exceptionally well run, and warmly hospitable.I thoroughly enjoyed my stay, only wish I could of stayed longer.Surf lessons were super professional but chilled!Every morning started out with an awesome breakfast ( always a savory and sweet cooked option at breakfast)Location was great- walking distance to the beach or town centre and a few meters from the nearest shop.Staff were always helpful and cheerful.Highlight might still have been the hostel pug and her added cuteness but big shout out to the whole algarve surf hostel crew!",Nov,2019,Nov 2019,2019-11-01,2019,5
PortoBay Liberdade,JulieR171717,19,JulieR171717wrote a review May 2019,"I stayed here while visiting Lisbon and was quite happy with the accommodation, attentive staff and exceptionally comfortable beds. In a high end shopping district, close to town center & Lisbon attractions, I would recommend this hotel for any discerning traveler.",May,2019,May 2019,2019-05-01,2019,5
Lisbon Marriott Hotel,mslovemoney,46,mslovemoneywrote a review Dec 2019,"The Marriott Lisbon is located about 20 minutes from the airport and is about 5 minutes away from downtown and the edge of the city center. The hotel lobby is standard for a Marriott inclusive of a gift shop, concierge lounge, and bar. The ground floor has a restaurant, fitness center, outdoor pool and conference rooms. The standard guest rooms and suites are satisfactory, but are dated and in need of modernizing. The plumbing is old and each morning I had to run water for about 5 minutes to open up the lines to rid the foul air emoting from the plumbing. I notified maintenance and they responded to my requests. As a Lifetime Titanium with Marriott I was attempting to use my suite night awards for my stay. There seemed to be quite a bit of misunderstandings between Marriott reservations who booked my room, and the Lisbon staff who somehow between the two did not attach/receive my suite night awards and somehow mixed up my arrival date. The staff onsite accommodated all of my requests to include an upgrade to a suite. Jessica (front desk staff and trainee) did an amazing job with helping me sort through my arrival process and went above and beyond to ensure I had a wonderful stay. I had one mishap, me and 2 of my friends were stuck in the elevator for an hour (not fun while on holiday) but was glad to have a glass of champagne on hand to pass the time away while stuck inside! Paula Coehlo, manager onsite greeted me afterwards and apologized for the mishap and provided a wonderful chocolate and wine tray for me and my friends for the unplanned incident. Thank you! The lounge staff were also super accommodating. Susanna, the evening staff shared “must-do” activities including local foods to try and the nightlife scene. She was awesome!!!  All trips tend to have an element of surprise, or unexpected event and this was certainly true for this stay, but the Lisbon team met  and even exceeded my expectations and made this trip a joyful one...Obrigado Marriott Lisbon Team!!!",Dec,2019,Dec 2019,2019-12-01,2019,4
Valverde Lisboa Hotel & Garden - Relais & Châteaux,Svetlana N,1,Svetlana Nwrote a review Feb 2016,"Excellent choice!!! Very friendly, supportive and attentive to each and any details stuff (which made a difference). Wonderful restaurant and Great location. It's in a walking distance from Alfama and Baixa.",Feb,2016,Feb 2016,2016-02-01,2016,5
Independente Principe Real,grahamp891,0,grahamp891wrote a review Mar 2017,"Lisbon and the Independente combined to give us a wonderful experience, each and every day of our stay. We had fallen in love with Lisbon the previous year but this time around, the Suites took us to another level. If you want to stay somewhere that has character, style and individuality this is a must. Forget the modern chain, corporate hotels and book in here to enjoy being looked after as a valued visitor to this amazing city. A warm colourful reception area is only matched by the warm friendly welcome from the girls at reception on arrival.The building is Art Deco in style and has been creatively enhanced with restaurants and a bar, which add to the relaxed ambience and atmosphere. Breakfast is served on the terrace and has magnificent views looking over the city and the Tagus. What better start to your day, siting outside in the sun, planning the places to visit, eating a wonderful breakfast and being entertained by the joyful Mamma?The rooms and bathroom are always clean and fresh when you return later in the day. The rooms at the front of the building have stunning views overlooking the park and the city beyond. There is no noise issue even though the road is usually busy with traffic.The central location is perfect for walks to all that this amazing city has to offer. The local area has a good number of interesting, quirky bars and restaurants, allowing you a short walk back to the Independente after an enjoyable evening.We had a wonderful time and we would like to say thanks to all the staff for adding to our wonderful experience in Lisbon. Even the theft of a passport did not dampen our spirits and again a thank you to the Independente for your genuine concerns and in arranging to keep our room for an extra two nights.Hope to see you in the future.Graham and Joyce.",Mar,2017,Mar 2017,2017-03-01,2017,5
Algarve Surf Hostel - Lagos,Alexandre S,0,Alexandre Swrote a review Jun 2018,"I stayed at this hostel for 6 nights and from the beginning it didn't feel like a hostel. It felt like I was over a friend's place with a bunch of people that I didn't know and we were all having a blast. Doing BBQs, having drinks by the pool and going out with the staff and guests for dinner in the city center. I came for the surf but the stay at the hostel was already worth it on its own. I left already making plans to return.",Jun,2018,Jun 2018,2018-06-01,2018,2
"Reid's Palace, A Belmond Hotel, Madeira",theax88,11,theax88wrote a review Nov 2024,"An old-school RmDream Hotel. Great location, wonderful view, nice pool, great breakfast! We were there for the second time.",Nov,2024,Nov 2024,2024-11-01,2024,5
PortoBay Liberdade,northlondoner43,36,northlondoner43wrote a review Apr 2015,"This is one great hotel,the staff make it even better,from the guys on the door to the staff in the breakfast room.must mention Adrianne customer relations girl,she smiled all day and was a good sight to see if you needed anything.The breakfast was excellent set you up for a days sightseeing.Room I had was just as good as any I've had,the linen and towels matched the hotels excellence, and the bed well wish I had at home.This is definitely one to watch as it's quite new but will be amongst the top boutique hotels in Lisbon.Looking forward to returning.",Apr,2015,Apr 2015,2015-04-01,2015,4
Hyatt Regency Lisbon,danlh62,0,danlh62wrote a review May 2023,Staff were very friendly and exceeded expectation throughout my week stay.  The fitness center is very nice and open 24 hours.  We had mainly catered food for our meeting at the hotel and it was excellent.  I like the location near the river for morning runs and evening meals.  The hotel is new and most rooms have balconies.  I would definitely stay here again.,May,2023,May 2023,2023-05-01,2023,5
Saccharum,robmo33,51,robmo33wrote a review May 2017,"We've stayed in a few 5 star hotels and this was overall the best. Food - we only eat breakfast but always plentiful, good selection and good quality. Room - we booked one with a sea view and we were so glad we did. Just listening to and watching the ocean whilst reading a book or napping was great. Nearby - a few decent restaurants in Calheta to choose from and we went to Estalagem hotel in Ponta da Sol; can highly recommend. Also look out Zion Project for an amazing beach bar with music experience. Only down point was the open plan bathroom in the room which meant you 'really' got to know your partner. Not a bad thing really but sometimes a bit of privacy is nice. Not enough to take a star off.Finally, like to call out the last guy who wrote a terrible review - don't be such a wuss and man up in the pool. It's fine once in. And as for getting charged €10 per room service visit - walk to the supermarket like the rest of us and buy a bottle of coke instead of getting someone to deliver individual cans to your room! And it clearly says on the room service menu that there is a €10 charge per visit! *shakes head*",May,2017,May 2017,2017-05-01,2017,4
"Reid's Palace, A Belmond Hotel, Madeira",Tourist814747,2,Tourist814747wrote a review Nov 2018,The hotel is magnificently situated on a private headland. From the moment we arrived the staff were so courteous and made us feel so comfortable. Our room had magnificent views a photograph of which now serves as my screensaver at work. The breakfasts are remarkable but are best taken early so you can dine at a table with a view. Nothing is too much trouble.,Nov,2018,Nov 2018,2018-11-01,2018,5
"Reid's Palace, A Belmond Hotel, Madeira",Cats41Nottingham,84,Cats41Nottinghamwrote a review Jan 2018,"Enjoyed a fantastic holiday in Madeira and Belmond Reid's Palace was a wonderful place to stay. Everything was perfect for us.We enjoyed all our meals there - William Restaurant and Villa Cipriani.  We also had an Afternoon Tea which was delicious.Very helpful and friendly staff, and the most lovely ladies looking after our room.We wouldn't hesitate in returning in the near future.",Jan,2018,Jan 2018,2018-01-01,2018,5
