hotel_name,reviewer,helpful_votes,date,text,month,year,extracted_date_str,extracted_date,year_int,sentiment_score
PortoBay Liberdade,SKKCCP,197,SKKCCPwrote a review Jul 2024,"Beautiful Hotel and the best staff we have ever encountered in all are years of travel. We stayed here for two days before moving on to Madeira, then we came back for one night before flying home. The staff here went above what any typical front desk staff does. Our flight was delayed five times and we asked to pay to stay in one room till later since our son has Epilepsy and sitting at an airport for hours was not optimal. They even arranged for transfers to the airport once flight was ready to leave. My son also has severe nut allergies and the staff at breakfast pulled food from the kitchen so he did not have to eat off the buffet and chance cross contamination. I want to Thank all of the staff for helping make our stay amazing!!The rooms were clean and comfortable with cute balconies we had coffee on each morning. Great location, loved the pool and outdoor lounge area and roof top deck.  I had a wonderful massage as well. This is the perfect boutique hotel near everything but very elegant as well.",Jul,2024,Jul 2024,2024-07-01,2024,5
Tivoli Carvoeiro Algarve Resort,laurence r,2,laurence rwrote a review Apr 2019,"Very nice location, amazing view but breakfast and service very disappointing.Rooms very nice and cleanhousekeeping twice a dayBreakfast has no originality, Always the same, every day, no change for a whole week",Apr,2019,Apr 2019,2019-04-01,2019,2
Villas D. Dinis Charming Residence Adults Only,Florian G,0,Florian Gwrote a review Jun 2025,"I booked this accommodation in early January 2025 to arrive in early July 2025. 6 days before the start of my stay, my booking was cancelled by the hotel via the booking platform, although my payment was already debited from my credit card the day before. Supposedly the hotel is overbooked??? The accommodation did not feel it necessary to get in touch with me personally. I was already on my tour of Portugal at the time and was forced to accept high additional costs in order to be able to start my planned stay in Lagos anyway. I can therefore only advise against booking this hotel.",Jun,2025,Jun 2025,2025-06-01,2025,1
SANA Capitol Hotel,Nedotykomka,18,Nedotykomkawrote a review Jan 2012,"A little but nice hotel near the Marques de Pombal square. Not exactly in the city center but near the metro, and anyway not too far away from Rossio Square (20-30 minutes on foot).My room was pretty little but very comfortable and clean, and so was the bed. The bathroom had a great shower! the breakfast was very satisfying.Not a luxury hotel, but is definitely worth the price!",Jan,2012,Jan 2012,2012-01-01,2012,4
Tivoli Carvoeiro Algarve Resort,dianarE4581LX,0,dianarE4581LXwrote a review Jun 2017,"Make available what you promote , get a gym get a spa , better variety of dining areas , better food and for less money . Have night time entertainment , teach front desk staff to tell the truth . Only thing good at your hotel is the housekeeping staff and stop hiding behind the ocean view that's  a given by GOD",Jun,2017,Jun 2017,2017-06-01,2017,4
Tivoli Carvoeiro Algarve Resort,Terry T,17,Terry Twrote a review May 2017,"Do you research first. If possible visit the resort, if not keep up to date with guest reviews, Do not take anything for granted. Whilst in Carvoeiro hire a car and travel the neighbouring resorts and extensive coastline to discover a plethora of beautiful beached and bays, even when you think you have found your perfect location, you may well be surprised to discover even more around the corner... We were and never take anything for granted....",May,2017,May 2017,2017-05-01,2017,2
Royal Savoy Hotel,kim,31,kimwrote a review May 2018,"Walking along & ended up getting cornered by a dull man trying to sell us time shares. Didn’t make this clear to us however, we were enquiring about sight seeing. When we made it clear we weren’t interested he became angry & very rude and told us to leave.The maintenance staff were also rude when trying to leave the building, looking us up and down when walking down the corridor & just laughed at us and looked at each other when we asked where the lifts were?! Very mature. Also got told he would pay for our taxi back to our hotel as he had took us in a taxi to this place but just got pushed out onto the streets in the blazing heat having to walk back. Avoid at all costs!!",May,2018,May 2018,2018-05-01,2018,1
"Reid's Palace, A Belmond Hotel, Madeira",Mandy C,141,Mandy Cwrote a review Sep 2018,"I stayed here September time it was all exceptional.  I stay in a lot of 5 Star hotels, including some of the other Belmond hotels, and this is one of my favourite's.  I only stayed 4 nights, but next time I will stay longer as there are plenty of excursions and activities you can do if you don't want to just relax.My room was lovely.  I opted for the Original part of the building but if you prefer more modern then the Garden block is more suitable for you.My room was clean, comfortable and balcony gave a beautiful view out onto the ocean.  The 2 swimming pools on the bar area were excellent and there was plenty of sun beds.  One level down onto the Sea deck area, there are plenty more sun beds and one more swimming pool which is fed by the sea.  You can also dive into the sea from there also.  My dinners at the hotel were all excellent.  Williams Restaurant worthy of its Michelin star.  Villa Cipriani was also nice, as was the terrace dinner restaurant.  Breakfast was quite good too.The complimentary extras such as wine tasting one night a week, pilates, aqua fitness and the complimentary shuttle into Funchal during the day time were excellent too.out of the excursions that they can arrange, I did the side car tour, which was wonderful.I used the Spa whilst there, and this was lovely too.I have nothing but praise for this hotel and can't wait to return.",Sep,2018,Sep 2018,2018-09-01,2018,5
Noah Surf House,Kari,3,Kariwrote a review Oct 2021,What an amazing stay at Noah Surf House. The staff is top notch. So friendly and really focused on making it the best stay possible. The location is perfect for watching the beautiful sunset each night and wondering through town. Highly recommended!,Oct,2021,Oct 2021,2021-10-01,2021,5
Crowne Plaza Vilamoura,PP,56,PPwrote a review Oct 2014,"They say you get what you pay for and this sums up our Crowne Plaza experience.   It was a cheap option so for the money £54 a night B& B via travel republic you can't really grumble too much.  However the setting and the building itself is lovely, the rooms in particular with lovely bathrooms and very comfortable beds.   If only someone took charge of the front of house service it would be fantastic.  There was no visible management of any kind in the hotel and it translated in terrible service.  The dining room staff had no system to managing tables and people would end up helping themself from the waiter station for tea coffee etc at breakfast.  The bar staff were rushed off their feet and service very slow. The reception staff in the main were very helpful bar one. No one was managing  the pool area so getting a bed was impossible as towels were deposited very early or maybe even the night before.  The sunbed cushions were filthy and the beanbags look like a health hazard. The grass area was being dug up so hence our daily visit to the beach - 16 euros for 2 beds for the day but happy to pay it.  One night we took dinner in the restaurant - poor and some items cold as no one was overseeing the buffet dishes.  The hotel was also subject to a mix of clientele.  Unfortunately there were a couple of loud, foul mouthed male groups when we were there.  We wouldn't return.",Oct,2014,Oct 2014,2014-10-01,2014,2
Pestana Viking,FigoSomerset,18,FigoSomersetwrote a review Jul 2011,"Lovely hotel set between two small but super beaches.  Quiet location so not for you if you want nightlife and shops.  Scenic walk along the cliffs to Armacao, which is a pleasant little resort.  Rooms are spacious and well-equipped - really good kitchenette area with kettle, fridge, microwave, crockery etc.  Safe costs 2 euros a day.  No hairdryer or iron in the room, but hairdryer available from reception.  Really lovely pool - lots of sunbeds, free pool towels.  Ate in the restaurant twice - a la carte was good, themed buffet every night too.  Was a kids club and activities in the pool for an hour every afternoon.  The staff were very, very helpful indeed.  Spa area and treatments are great. Main gripe was that we booked a room with a sea-view and got a room at the side of the hotel, which was a view of trees with glimpses of water between.  However, this issue was resolved satisfactorily by the reception staff. Used Yellowfish for our transfers from Faro to the hotel - can highly recommend them too.  Local buses to Portimao and Albufeira are fast and cheap, but not particularly regular, so you need to plan carefully, but otherwise are an easy way to get around without a car. We visited both these places and Fieas, The World of Sand at Pera (there is a special bus you can book from the office in town) and this is definitely worth a visit. We would certainly book a Pestana hotel again.",Jul,2011,Jul 2011,2011-07-01,2011,4
O Castelo Guest House,KandE,41,KandEwrote a review Apr 2016,"Just returned from a three-night trip. We spent one night in a street-facing basic room which was perfectly OK but would strongly recommend the seaview with terrace room which we had for our other two nights, not just for the view but for the far superior quality of the room. Staff, location and breakfast were all great, would happily return.",Apr,2016,Apr 2016,2016-04-01,2016,2
Crowne Plaza Vilamoura,Jackie W,3,Jackie Wwrote a review Mar 2016,"Spent a week here lovely clean hotel with pleasant friendly very smart staff, breakfast was amazing loads to choose from fresh ingredients every day. Room very comfy. Bad points not many but a bit of a niggle only one chair to sit on on balcony with 2 of us in the room we had to take it in turns lol coffee machine in room lovely but only allowed 1 cup per day anymore you had to pay 2 euros for each pod go down to Jumbo supermarket in Faro and you can buy 10 for 1euro 59c id call what the hotel was charging a rip off!! Evening food in hotel I would say expensive and not to our taste but that was our opinion, would I go there again probably.",Mar,2016,Mar 2016,2016-03-01,2016,3
Natura Algarve Club,Andrrew007,12,Andrrew007wrote a review Jun 2018,"My Partner and I stayed here for 1 week 09.06.2018,The Hotel was clean tidy, the grounds and pool area were well kept, plenty of sunbeds (Sunbeds all decent not the usual damaged dodgy plastic ones that donâ€™t stay up) and the Staff were all pleasant, reception and bar service was very good, We have only ever stopped in one Hotel that has asked for a deposit (Â£100), This was in Magaluf years ago, so I feared the worse, this was unfounded as no issues at all, No stag / Hen do`s â€“ no nosey carrying on in the night, was a couple of groups but very respectful of the families and younger kids. I think as time moves on they will drop the deposit because the hotel does not seek to attracted  the  party groups.The Strip is 15 mins walk if that â€“ top of road turn left, to bottom of road turn right â€“ easy, plenty of restaurants about, Indian curries seem popular, most of the restaurants have Tourist menus, but seemed better to pick a main off the normal menu.We did walk to the Old town during the day about 1 hour (calling for a pint) but we are blessed with good health â€“ if not 6 euros in a taxi (rank to rank).Lack of branded shops around the area if you like the Brands its 11 euros to Albufaria shoppingRecommend a Bar called 33`s â€“ great atmosphere massive selection of drinks â€“ lucky to watch Portugal v Spain in world cup.Recommend Wander Inn Pub â€“ Great Breakfast and Menu â€“ Bargain 2 meals 15 EurosHave a good Holiday",Jun,2018,Jun 2018,2018-06-01,2018,2
Vila GalÃ© Tavira,aahayes,4,aahayeswrote a review Jul 2016,Never again it's no 4 star just a 3 it's not for the English the first room smelt of damp and the next one not much better it caters more for Germans not English Tavira is a lovely place shame about hotel it's in need of a refurb and staff not very helpful would never return and would say to all English don't bother it's not worth it we were treated second rate to the Germans not on at all.,Jul,2016,Jul 2016,2016-07-01,2016,3
Muthu Clube Praia Da Oura,Pauline23Mel,2,Pauline23Melwrote a review Jun 2019,"After having read a number of reviews that werenâ€™t very complimentary about the hotel, it was with some trepidation that we entered the â€œlions denâ€ on our arrival.  All I can say is some people must be very hard to please.  Reception couldnâ€™t have been more helpful, porterage was provided taking our luggage and belongings direct to our apartment. Very good service.  The only fault and really we shouldnâ€™t complain, was the room was on the small side.  The room had everything you needed, was cleaned every day, beds changed every day and towels changed regularly.  We have no complaints, thoroughly enjoyed our stay.",Jun,2019,Jun 2019,2019-06-01,2019,4
Hotel Travel Park Lisboa,Juan Carlos U,0,Juan Carlos Uwrote a review Sep 2025,"We stayed 3 nights. Our room overlooked an inner courtyard, the shower head had to be adjusted as the safety was not tight, nothing otherworldly.Both the bathroom and the room were good size, both clean. The air conditioning was not noisy so you could sleep well. The parking is next to the hotel and there is a lift, which is appreciated when you walk with several bags.Breakfast was varied.",Sep,2025,Sep 2025,2025-09-01,2025,4
Eurostars Porto Douro,שוקי ש,78,שוקי שwrote a review Jan 2017,"We were lucky that the hotel we originally booked has a flood and they could not accommodate us so they sent us to this hotel. The hotel is new, very clean and modern. Location is great, on the river bank, few minute walk from all the restaurants and rooms are not very big, but big enough. \"action\" on both sides of the river Douro. Breakfast was also very good. Highly recommended hotel.",Jan,2017,Jan 2017,2017-01-01,2017,5
Hotel Travel Park Lisboa,Janja K,12,Janja Kwrote a review Aug 2013,"The Hotel was not far from the airport and the taxi is about 20eur.Hotel is on the main street. Rooms are nice and clean. Hotel has a nice loby, bar and restourant. There is a nice terrase where you can have a morning coffee.Hotel is on a good location if you want to explore the city by foot. Its not far from the metro station but we acctualy didnt use metro at all. Its about 20 min walking to get to the start point of famous Tram 28.Breakfast was nice and there was a variety of food to choose from. We havent had lunch in the hotel since in the city there are so many restourantes to choose from and we were out all day.I would recomend this hotel for business and toursit visits since it is good value for the money and a good location.",Aug,2013,Aug 2013,2013-08-01,2013,4
Hotel Albergaria Dias,luvhols41,33,luvhols41wrote a review Jun 2023,"Hotel probably the cleanest we’ve ever stayed in,spotless.Comfortable room and bed,bathrobes a great touch.Location for the old town fantastic.All staff wonderful,helpful and friendly.We had a great holiday and we definitely return to this hotel,couldn’t fault a thing",Jun,2023,Jun 2023,2023-06-01,2023,5
Bura Surfhouse,Eilidh G,0,Eilidh Gwrote a review Feb 2016,"We (Eilidh and Lewis)  have been here a few times now and recommend it to our friends who are after a really easy going, friendly atmosphere. You really do feel like you're hanging out with mates in your own home. There's always someone knocking about if you need something.It can be boisterous, but usually if you want somewhere to stay that's not got a personality you stay in a boring hotel and don't make eye contact.The area is really nice. There's a supermarket 5 mins walk away. Beach 20 mins walk away. There are nice little bars and fantastic places to eat. Lagos is a real cosy, wee gem.If you're looking for a place to stay where you can kick back and be yourself, then this is the place to go.We'd go back in a heart beat but I'm not sure what the policy is on taking a baby? Anyone? :D",Feb,2016,Feb 2016,2016-02-01,2016,4
Porto PalÃ¡cio Hotel by The Editory,Margo W,56,Margo Wwrote a review May 2013,Typical city centre hotel located on the outskirts of the city.Only interested in taking your money with as little effort as possible on their part. Apart from the actual bedroom everything is an additional excessive cost (e.g.20 euros to use the swimming pool).Room comfortable but very dusty.,May,2013,May 2013,2013-05-01,2013,3
Bura Surfhouse,Morgz B,4,Morgz Bwrote a review Sep 2017,"Our 5 days in Lagos were amazing, and our stay at Bura was made by the staff. They made us feel like family, and a special mention to Bex for the good advice and taking us out and showing us the beach and epic nightlife! Would recommend 100%",Sep,2017,Sep 2017,2017-09-01,2017,5
Vila GalÃ© Tavira,argylllassie,115,argylllassiewrote a review Jul 2008,Stayed here for 3 nights in June 08 and got a great deal through Laterooms for approx Â£65 per night for a double room with breakfast per night!Lovely room with Pool view on top floor which was great.  Rooms are quite luxurious and very spacious - they also have well fitted out bathrooms.  I would request a pool view as some rooms face a busy street or a garage so pool views are quieter! (Garage is a good place to get alcoholic drinks and snacks!)Breakfasts were the best we had on our holiday - everything on offer you could wish for!  Did not eat dinner here so we could not comment.Situation is great - about a 7 minute walk into town centre where there are some nice bars and restaurants - we enjoyed Os Arcos and Bicos ( great local fish).  Irish Bar near bridge was also very good.  Tavira is one of the nicest towns in the Algarve with lovely architecture - a must to see if you are travelling around.Pool was very nice and peaceful - no problems getting sunbeds or parasols.We would stay here again for sure!,Jul,2008,Jul 2008,2008-07-01,2008,5
Quinta do Morgado - Monte da Eira Apartments,Voyager22475005114,0,Voyager22475005114wrote a review Mar 2025,"Very clean, comfortable & quiet apartment in a nice private complex with a beautiful pool area! The reception staff went above & beyond to make our stay wonderful! Amenities close by with a short drive to historic Tavira. Highly recommended for a short or longer term vacation!",Mar,2025,Mar 2025,2025-03-01,2025,5
Pestana Bahia Praia,Lexiplove,0,Lexiplovewrote a review Oct 2018,I enjoyed my stay here. The pool is just so clean and beautiful. It was great to have the beach within walking distance from the hotel. The dinner buffet was not what I normally eat so I didn’t enjoy it. The mattress should definitely be upgraded because my back hurt the entire trip. All in all I would return here for future trips.,Oct,2018,Oct 2018,2018-10-01,2018,4
HF Fenix Lisboa,Sooki_13,36,Sooki_13wrote a review Jun 2018,"My friend and I stayed here early June for 2 nights, we did not check in until after midnight due to our flight being a night flight, this unfortunately meant we had the last room first floor right above the entrance, we was advised on check in that we could change this the next day, however as we was only there for 2 nights we didn’t see the point.  The room was noisy as you can hear traffic and also the service truck from early morning.  Aside from this the room was good everything you need, although we found pillows too soft, hotel is pleasant with good breakfast and service always lots available and cheery staff, the bar closes at 12 and does not offer a night service which I found odd, location is good and reception staff helpful, overall good stay.",Jun,2018,Jun 2018,2018-06-01,2018,3
Pestana Bahia Praia,Pedro L,5,Pedro Lwrote a review Nov 2017,We only spend one night in this hotel and we where extremely unsatisfied with the room cleanliness and safety. First room we checked-in had a open highvoltage power socket next to the bed. The bathroom was smelling very bad. After complaining was given another room. In both rooms the cleanliness was very superficial. Indeed the rooms have been renewed but still a lot of work needs to be done.The breakfast didn't have very fresh products. Juices and coffee were not to enjoy(not a 4 star breakfast).On check-out we where not even asked if everything was fine. Pay and goodbye.,Nov,2017,Nov 2017,2017-11-01,2017,2
Hotel Mare,Cristina C,1,Cristina Cwrote a review Dec 2016,"If you're a light sleeper think twice before staying here. They start preparing breakfast before 7 am on top 5th floor with beautiful views but noisy marble floors. Sound eccos throughout the building. We were on the third floor and we're woken up at 7 am by moving chairs and closing of cabinets. Otherwise nice location, clean and friendly staff.",Dec,2016,Dec 2016,2016-12-01,2016,3
Legendary Lisboa Suites,nathalievb,398,nathalievbwrote a review Jun 2014,"The hotel is located in the citycenter (but take the metro!). There is a stop 300m from the hotel.This is a small apart hotel, ideal for families! There is also  a mcdo in the street.First of all, compliments to the staff, they were all so friendly!We were upgraded to a family flat,it was so big! Two bathrooms, two bedrooms. The room was modern but quite dark, maybe some white thingq or walls will make the room bigger!The breakfast area is really small,and not so cosy. But you can make your own breakfast in your kitchen.",Jun,2014,Jun 2014,2014-06-01,2014,4
Muthu Clube Praia Da Oura,Joanna O,0,Joanna Owrote a review Sep 2025,"The dancers Yoandry,Nirma,cinder,leyanna and the choreographer and DJ Lauro and the singer Yadira are fantastic! They have provided a great show and their dancers are amazing!!",Sep,2025,Sep 2025,2025-09-01,2025,5
M Maison Particuliere Porto,georgepa2018,1,georgepa2018wrote a review Mar 2025,"It is a very nice place, great quality, well located on a pedestrian street.  The rooms are comfortable and the bedding exquisite. The welcome is kind and the decor extremely neat. The problem is that you do not feel very comfortable.... I explain: in the evening you are asked the exact time you want your breakfast and its contents. The next morning it seems difficult to depart from your choices made the day before. So you feel more like a guest, rather than feeling free like home. Likewise when the afternoon takes you to drink coffee, know that it is possible but it will pay.... In short, I think the rules should be reviewed a little. An à la carte breakfast when we wake up would be appreciated as well as the possibility of having eggs in the plate rather than scrambled. Probably a detail but often it makes a difference.",Mar,2025,Mar 2025,2025-03-01,2025,3
Hotel The Cliff Bay,ufetz2025,0,ufetz2025wrote a review Mar 2025,"Perfect service, excellent gastronomy, cozy rooms and a wonderful atmosphere – we felt completely comfortable and would love to come back! An absolute recommendation! 😊",Mar,2025,Mar 2025,2025-03-01,2025,5
Casa Das Muralhas,Francisco Diego,0,Francisco Diegowrote a review Aug 2023,"Although the hotel is really good, I think it lacks something to be a 5*. The pool area, despite it being mid-August, at 5:30 p.m. it was already shady, and in the room, although the beds are really comfortable and large, they needed a refrigerator, to keep the water cool and to be able to cool off during the central hours of the day, since there was no bar until 5:00 p.m. It is also advisable to have somewhere else to put clothes, since this was limited to some hangers.",Aug,2023,Aug 2023,2023-08-01,2023,3
Legendary Lisboa Suites,Elisabete J,286,Elisabete Jwrote a review Apr 2024,"Very spacious and well equipped apartment. Although it has already undergone works, it still needs more renovations. Its location is excellent as it is very close to the metro and other transport, allowing you to quickly reach various parts of the city. Friendly and friendly service.",Apr,2024,Apr 2024,2024-04-01,2024,5
Altis BelÃ©m Hotel & Spa,Michelle B,107,Michelle Bwrote a review May 2016,"From the warm welcome to the efficient departure process, this hotel is special. The view of the dock and harbour from our room was glorious both day and night. Belem is the loveliest part of Lisbon and you are a short train journey into the city centre (or catch the shuttle bus). Breakfasts are a feast. And you can easily park your car.",May,2016,May 2016,2016-05-01,2016,5
Hotel dos Templarios,victoria8,0,victoria8wrote a review Aug 2025,"Great hotel considering its age.   Spacious rooms and bathrooms.  Beautiful art and furnishings throughout.  Breakfast buffet is really great!  Staff are all friendly and professional.The basement gym has new high quality equipment, it just needs some small towels and water please.The pools are really lovely, but some maintenance is required, the corners have missing tiles and the dome needs cleaning and touch up some paint.",Aug,2025,Aug 2025,2025-08-01,2025,4
