hotel_name,reviewer,helpful_votes,date,text,month,year,extracted_date_str,extracted_date,year_int,sentiment_score
Crowne Plaza Vilamoura,yijing84,12,yijing84wrote a review Aug 2016,"Our first impression for the room wasn't that good because of the old cigarette smell at the room entrance (we booked a non-smoking room), probably left by previous guests. We complained to the bellboy and he suggested us to open the door at the balcony to vent the air. It got much better afterwards so we didn't want to go through all the hassle to change the room. Well...we didn't smell much of it over the bedroom, so that was not a big deal.Apart from that, the hotel is excellent. Big room with huge bed and spacious toilet. The pool area is excellent with plenty of sun chairs. All the staffs are friendly and helpful. The location is good, right next to the beach. We swam in the sea everyday and came back to relax on the sun chairs by the pool.They offer good selections for the breakfast. However, the menu was the same throughout our entire 5-nights-stay, so we got a little bored after a few days. They also have a very good restaurant for lunch by the pool. I love the grilled sea bass that I had. The burger was a little dry, so I would recommend you to try the grilled seafood. The price was reasonable.",Aug,2016,Aug 2016,2016-08-01,2016,4
Natura Algarve Club,Lisa j,0,Lisa jwrote a review Apr 2023,Brilliant value for moneyIn a perfect placeSo friendly and helpfulClean and well equipped roomsGood overallI've been 4 times and will returnHome from homeI love it thereSunbathe round the pool all day and out at nightNear the strip and short taxi to old townHas a supermarket at the top of the road or a Aldi ten mins walk away,Apr,2023,Apr 2023,2023-04-01,2023,5
Muthu Clube Praia Da Oura,MrAlan07,56,MrAlan07wrote a review May 2024,"The Jet2 staff,flights and transfers were brilliant.I would have given 5 stars ,but reason I gave three stars was no reflection on Jet2 but reason was the all inclusive at Club Praia Da Oura was a very poor standard.The buffet food was just warm verging on cold.There was no bottled water.The grill restaurant food was cold and dry.When I returned home I ended up in hospital with food/machine water poisoning and had a stomach infection.This would not put me off booking with Jet2 again but would never go all inclusive again in Club Praia Da Oura totally disgusting.",May,2024,May 2024,2024-05-01,2024,3
Crowne Plaza Vilamoura,m01986,0,m01986wrote a review Jul 2015,"Overall a very clean, spacious hotel with nice sized rooms. Location is great as it is about 20 minutes from Faro Airport, a short walk to the Main Marina which has so many lovely places to eat and drink and a couple minutes walk to the beautiful beaches.The rooms have a spacious bathroom, nice comfy beds and a private balcony to sit and relax. We stayed on the 11th floor so nice and quiet.Breakfast buffet ad a good choice, the only compliant I have is that the water is not hot enough for teas and coffees so make sure you ask for extra hot water if you like a hot beverage with your breakfast.I thought the chefs really catered excellently for my brother in law who has a gluten and dairy free diet and he was very happy with the dishes they cooked for him.Spa is nice but you do have to pay a fee to use even though you are staing in the hotel.Like most pools the loungers get taken very quickly by 7am! But there are other areas around the pool to sunbathe.Overall a fantastic family break with good facilities and friendly staff.I would definitely come back to Vilamoura.",Jul,2015,Jul 2015,2015-07-01,2015,4
Crowne Plaza Vilamoura,Tracey M,122,Tracey Mwrote a review Oct 2014,Stayed 5 nights on half board option. Evening meal only average could have been hotter. Hotel room very clean and comfortable. Could do with having 2 chairs on the balcony as my husband and I do like to sit out there at times but this was not possible. All staff were nice and friendly and reception area was bright and relaxing. Hotel only 5 mins walk from the marina which means that it is nice and quiet. Would stay there again.,Oct,2014,Oct 2014,2014-10-01,2014,3
Hotel Gat Rossio,baseballfamily,5,baseballfamilywrote a review Nov 2015,"Can't beat this location.  We arrived at night and Aerobus dropped us off within a block of the hotel.  It was enchanting to turn the corner and see the pedestrian walkway with the restaurants set up and people out for the evening.  The hotel is basic but clean and comfortable.  Only complaint was the bathroom - it could use an upgrade and there was no where to put your toiletries but water pressure was good.  You are within easy walking distance of everything but also have the train station, metro and trams steps away.  Breakfast was well done with fresh squeezed orange juice, fresh bread, good coffee.  Only lacking in fresh fruit.",Nov,2015,Nov 2015,2015-11-01,2015,4
Cabanas da Viscondessa,JS3Travel,33,JS3Travelwrote a review Aug 2022,"We booked for a family group of 7 including 3 different generations right down to under 2 years old... A tall order to find accommodations that would be all things to all people. This spot was fantastic. One cabin accommodated us similar to a duplex where the other unit was a short walk away and was perfect for o family of 3. I have been to many islands over 4 visits and I can say this property is like no other! If you want to experience a forested hillside with million dollar views and a true \"island vibe\" this is your place.We booked rental cars to offset the 15 minute drive to the populated zones and found incredible balance of peace and convenient location by doing so. The onsite dining was great, but is the only walkable food option. In exchange, you enjoy true peace, quiet, star gazing, birds, trees, flowers and those amazing vistasOur journey to get to the Cabinas was full of drama with a delayed flight, a diverted flight and a surprise ferry boat needed to arrive about 24 hours later than expected and will no baggage... \"No problem, we will note your challenge and look forward to seeing you\" was the response. The staff helped us retrieve our bags, made sure we had some dinner (even though food service was closed at that particular time) and made our group feel comfortable. While none of our travel issue had anything to do with the property, the staff was empathetic and helpful.The vibe here is relaxed and professional. It's an eco-resort without pretentious flare and fabulous air conditioning if you need it. Management has embraced a stewardship and respect for the natural property and the island in general that felt genuine and inviting.Our whole group only had one complaint... our travel issues left is one day short at the property and we hated to hated to leave!This is a prime location for nature lovers, photographers, peace-seekers, or anyone who wants the booked property to be a big part of the Sao Jorge enjoyment experience. Treat this as 1-2 days of exploration for maximum enjoyment because if you treat this location simply as a staging point to go to other spots on the island, you are missing a big part of the value.The cabins are fantastic and more like a modern eco-spa than we imagined. For extra points, grab some provisions from the local market in Velas and take advantage of the full kitchen and private deck in your unit.We would 100% return and plan days just to soak in the property.",Aug,2022,Aug 2022,2022-08-01,2022,5
Hotel Albergaria Dias,Merle L,39,Merle Lwrote a review Jul 2016,"I can't remember how many times we have been back to this fabulous, friendly, fantastic and faultless hotel but here we are again.  Our arrival this time was even more friendly - hugs and kisses this time - so I think that everyone was pleased to see us?  It was delightful to see both Mr Dias snr and Mr Dias jnr again and they are still exceptionally proud of their hotel.  They pointed out all the spendid certificates that are filling up the walls in Reception and why not?I will not waste space by repeating what others have written because everything is just the same high standard so I will just give you an example of the help received.We celebrated our 49th Wedding Anniversary during our stay and Cecilia, on Reception, was a gem.My husband wanted to arrange some flowers and chocolates for the actual day and she organised him!  She organised the flower delivery for the correct day, explained where he could buy hand made chocolates and then she put them in the hotel's  fridge until they were required. On the actual morning, whilst we were at breakfast she went into action - the flowers and chocolates were delivered to our room - and rose petals were scattered on the carpet. What a wonderful surprize but typical of the kindness and service of this hotel.There will be changes soon as Mr Dias snr has bought the empty property at the bottom of the garden and will be transforming it into more accommodation once \"planning permission\" is granted.  We are sure that it too will be an excellent addition to this amazing hotel.Please book early and enjoy your stay - you will not be disapointed.",Jul,2016,Jul 2016,2016-07-01,2016,5
Canto de Luz,edward947,2,edward947wrote a review Nov 2023,"Prearrival information was very helpful.  The room was beautiful with lots of light from floor to ceiling windows.  We were in City 3.  The street was very busy, but with the double pane windows closed, the room was totally quiet.   The shower was one of the best in all of our travels.  Most importantly, the staff was very friendly and helpful.  We would definitely stay here again when in Porto.  If there is a downside, the hotel is up a steep hill, but of the charm of Porto, but if walking is a challenge, the hill might be an issue.",Nov,2023,Nov 2023,2023-11-01,2023,4
Vila GalÃ© Tavira,Jesterdej,36,Jesterdejwrote a review Jun 2012,"Nice and clean hotel, rooms look OK and somewhat above, the standard of 3 stars I would say. Very nice bathroom. Big nice outdoor pool. Great breakfast.",Jun,2012,Jun 2012,2012-06-01,2012,3
Bura Surfhouse,pdekoeyer,0,pdekoeyerwrote a review Jul 2017,"The term surfhouse is quite misleading as it is 20 mins walk from town beaches, and a 45 minute drive from surf beaches. The vibe is much more like a party hostel and none of the staff had any idea about surfing itself, rather were more interested in promoting party boats and nightlife.The hostel does not offer the surf transport/equipment or lessons, but sub contracts them out to another surf company and charges a commission for this. The surf is only suitable for beginners as they provide foam boards and go there in the middle of the day when the beaches are crowded. As an intermediate surfer this was quite frustrating.The staff were incredibly disorganised and too worried about partying themselves rather than doing their job. All activities are an extra cost. Rooms are hot and dirty, beds squeaky and there are not enough bathrooms.If you want to surf properly, rent a decent board in town then head to arrifana, aljezur or sagres.",Jul,2017,Jul 2017,2017-07-01,2017,2
Monte do Zeca,Agusbaile,11,Agusbailewrote a review Jun 2014,"My husband and I stayed in the Monte de Zeca for 3 nights.Great location, great food but simple, beautiful setting.We had an appartment with 2 rooms and a barbecue. It was very clean.We enjoyed getting fresh bread every morning at the door. The staff are very nice and helpful.The information book in the appartment was interesting.The only problem was that the bed was little bit small and not very confortable.The doors are small which means you can bang your head easily.",Jun,2014,Jun 2014,2014-06-01,2014,4
Vila GalÃ© Tavira,chrisandmac,30,chrisandmacwrote a review Jun 2012,"An adequate hotel if you get a cheap rate. Our room faced the petrol station - good to watch the storks nesting but not pretty. Room was very clean and housekeeping excellent. BUT we found the beds extremely hard. Prewarned by other Tripadvisor reviews we had taken two small foam cushions with us and that saved our hips - we are active late 50s and both had sore hips after the first night so how the many much more elderly guests cope I don't know.  On the positive side the A/C was one of the best we've found - quiet enough to sleep to and works well.Breakfast is OK but evening buffet varied between quite good and very bland/dry. We were on a dance holiday and so didn't have high expectations of the food anyway but if you have the choice, there are so many good restaurants in Tavira that B&B is definitely the way to go. Best thing is the free transfer bus  to the sister Vila Gale Albacora - from here you can get to the beach, Tavira island, or wander through the salt marshes watching fantastic bird life.    We would definitely go back to Tavira but if we could afford it would stay at the Pousada de Graca - we had coffee there and it looks fab!",Jun,2012,Jun 2012,2012-06-01,2012,3
Canto de Luz,lydiaberger,0,lydiabergerwrote a review Aug 2023,Very tasteful suite and friendly staff! Delicious breakfast served at the table. The port wine as a welcome drink is also nice. Very well located for exploring Porto. Definitely recommended!,Aug,2023,Aug 2023,2023-08-01,2023,5
Vila GalÃ© Tavira,Jammymildred,59,Jammymildredwrote a review Jul 2013,"Before visiting Vila Gale we read some comments about it being more suitable for older guests and lots of \"Saga\" visitors.  The hotel does have Saga visitors but when we went it was very busy with mostly families and young children and very noisy generally.  Our complaint is that the evenings in the bar and pool area are very noisy.  Three nights a week the children's \"fun club\" has their entertainment in the bar and if you go out to the pool area, there is a \"DJ\" with very noisy music blaring out.   Therefore, if you want a quieter drink, your only option is to sit in the foyer area, which is okay but at the end of the day, you are still in Reception!   Drinks expensive also.  My Pina Colada was poured into a glass from a sort of large plastic container - ready mixed - and not good at 6.50 euros....Entertainment in general was a bit corny.  The hotel needs to take care of the needs of ALL its visitors with a separate area for children's entertainment and an area for adults who do not wish to be deafened!  Breakfast buffet was excellent - masses of choice and hard-working efficient staff keeping everything topped up.  Beds were a bit uncomfortable and double rooms had 2 singles pushed together - not acceptable in a 4 star hotel.  Room cleaning a bit hit and miss and not of a high standard.",Jul,2013,Jul 2013,2013-07-01,2013,3
Porto PalÃ¡cio Hotel by The Editory,Dominik B,0,Dominik Bwrote a review Jun 2017,Big room with comfy bed and everything else that you would expect to find in a 5 star hotel (mini bar etc). The roof top bar is nice but a bit expensive. The only thing we didn't like was the wlan connection in our room - very slow and kept kicking us out.,Jun,2017,Jun 2017,2017-06-01,2017,4
Muthu Clube Praia Da Oura,Luisa E,0,Luisa Ewrote a review Sep 2025,"First of all thank all the staff of Muthu and in particular the wonderful and magnificent animators who helped us and involved us in everything to make us feel great, Boris and leyanna thank you guys",Sep,2025,Sep 2025,2025-09-01,2025,5
Muthu Clube Praia Da Oura,Dani Z,0,Dani Zwrote a review Jul 2025,"Very good everything, recommendable place, very attentive waiters, well presented food. To repeat. Next to the beach.",Jul,2025,Jul 2025,2025-07-01,2025,5
Hotel Principe Lisboa,jmeem42016,570,jmeem42016wrote a review Oct 2013,"This was our second stay at the Principe and we were not disappointed.  They have parking for 7,5 euros/day and are right next to the St. Sebastian metro station.  The rooms are small and not much furniture but its very clean and the free breakfast is good.  Also free wifi.  We will most likely stay here again because the staff are friendly and the service is good.",Oct,2013,Oct 2013,2013-10-01,2013,4
Legendary Lisboa Suites,YorkSue,78,YorkSuewrote a review Apr 2013,"Stayed here for a weekend break. Great location, handy for metro and a pleasant walk into the old town. Just down the street for the sight seeing bus tours which are highly recommended. We were upgraded from a studio to a suite, spacious, comfortable and well equipped. Well worth booking a visit.",Apr,2013,Apr 2013,2013-04-01,2013,5
Casa Vela Boutique House,Paul B,14,Paul Bwrote a review Sep 2019,"Excellent Guest House and the Garden is spectacular with plenty of space and very tranquil.There was a good choice at breakfast and there is an honesty drinks cabinet.The actual room we were in \"India\" to be honest it didn't have the best of views as when the curtains were opened we faced a stone wall with a small gap to the side which was 'The View'On a positive note it did keep the room cool during the day, but I believe this particular issue should have been pointed out before we booked and the price should be cheaper than the other rooms. However we didn't let this spoil our holiday and I still give the place a five star review because everything else exceeded our expectations.",Sep,2019,Sep 2019,2019-09-01,2019,4
Yes! Lisbon Hostel,Simon W,0,Simon Wwrote a review Dec 2015,"We are 4 guys on a football trip to watch Benfica. The hostel is clean and affordable with very good facilities. lots of hot powerful showers, free breakfast and Wifi, ps4, guitars, dead cheap Sagres lager, freshly juiced OJ, super comfy mattresses and good smelling bedding. reception were always helpful and friendly.  could not recommend this higher. i have stayed in actual hotels that aren't as good as Yes!",Dec,2015,Dec 2015,2015-12-01,2015,3
HF Fenix Lisboa,Frankenmarjan,54,Frankenmarjanwrote a review May 2013,We stayed in Fenix during a short holiday  in May. We chose for Fenix because of a pleasant stay in Fenix Prague. The location is perfect. The metro is on the other site of the street. The room was spacious for a city hotel and very comfortable. Breakfast was very good.,May,2013,May 2013,2013-05-01,2013,5
Yes! Lisbon Hostel,Ruby H,11,Ruby Hwrote a review Jan 2016,"Clean rooms and well-organized and modern. The location is center to most things visitors will want to see/do in Lisbon. Many transportation options within 1 km. At night the neighborhood wad surprisingly quiet. There were a lot of activities available to guests organized by the hostel. Staff are very friendly, helpful and enjoy sharing experiences.",Jan,2016,Jan 2016,2016-01-01,2016,5
Yes! Lisbon Hostel,Jeremy H,3,Jeremy Hwrote a review Sep 2016,"Do you like food?Do you like beers and sangria?Do you like FUN?Come to this hostel. The moment after ringing the doorbell to get buzzed into the building, you enter this majestic hostel. Greeted with a friendly reception, the hostel itself also bodes with an inviting warmth and community.Included in the Price: Free Breakfast (you just have to clean your dishes in the kitchen yourself after). For 10 euro each night - recieve a 4 course dinner: starter usually being some type of bread and dip; second course, a soup; followed by a main (typically, cod, chicken, or some pork, but is always delicious); finally concluding with a dessert. During this time, you can also fill yourself up on free beer or sangria! What a deal!.....BUT WAIT....there's more!!!Basically, you can sign up anytime before 11:30 to join the pubcrawl that leaves from the hostel. Of course, prior to leaving, the Hostel pours a shot for each person; preceding the shot is a chant.The pubcrawl starts at 2 bars, followed by a club. I have neglected some of my memory during these pubcrawls for obvious reasons - they're too fun!!! But, here is what I DO remember:The free beer and sangria continues into the first bar.The second bar, a free shot is usually given and any other drinks are bought. However!!! I believe, there are also nights that free drinks continues onto the second bar too (I'm not totally sure haha)The final destination - a club - is usually late at night; but, they usually try to save the best for last. By this time, not many drinks are needed anymore; if they are, they must be bought.The entire Hostel is such a friendly environment. Everyone quickly becomes friends, brought together with food and drinks or just good times!Free walking tour every morning leaves from the hostel @ 10:30. One day the tour will cover the east side of town; the next day will the west side of town.There are also tours offered by the Hostel to amazing locations around and close to Lisbon.The Hostel is located two blocks from the water, and only 1 block from PraÃ§a do ComÃ©rcio (the main public square in Lisbon).I could talk all day about this amazing hostel all day! If you are staying anywhere in Portugal, make note to stay here.",Sep,2016,Sep 2016,2016-09-01,2016,4
HF Fenix Lisboa,kenasch,54,kenaschwrote a review May 2024,Great location with a large park just across the street. The room was good overall and decent size. A floor lamp apparently had a bad switch and I finally had to unplug it to turn it off at night. The bed is hard but manageable. The biggest issue was that I mistakenly used my room key at the room next door and it opened. A very surprised and startled guest greeted me. This is a huge security concern which I reported to the desk.,May,2024,May 2024,2024-05-01,2024,4
HF Fenix Lisboa,Lior S,32,Lior Swrote a review Nov 2016,"It's a nice hotel, especially for businesses travels as it is located just above the metro station.anyway it is not far from the center of Lisbon (10-15 min walking in a nice boulevard)The rooms are quite big and clean but a bit darker.Breakfast is excellent with wide range of choices.Staff is helpful.",Nov,2016,Nov 2016,2016-11-01,2016,4
Hotel Alegria,Peyton M,2,Peyton Mwrote a review May 2017,"I stayed 2 separate nights in 2 different rooms, both Saturday nights. Hotel Algeria was perfect in every way - charming decor, comfortable beds, good showers, noise-canceling windows, and amazing front desk staff. As a solo female I felt quite safe walking in the neighborhood which was within easy walking access to the heart of the city. Thanks for a memorable stay!",May,2017,May 2017,2017-05-01,2017,5
Pousada Viseu,Antony B,87,Antony Bwrote a review May 2019,The building has been beautifully converted from a hospital to a wonderful hotel. We had probably one of the best rooms (426) on the fourth floor with a view over the whole city.The staff were friendly and the breakfast up to the usual Pestana standard.It was a short walk into the city and with help from the reception staff we visited many areas of the city. It is a city which they are rightly proud of with many narrow streets and back lanes with small shops.,May,2019,May 2019,2019-05-01,2019,5
Pousada Viseu,Getaway61555161094,0,Getaway61555161094wrote a review Aug 2023,"Second visit to the Pestana hotel/guesthouse Viseu. I always feel welcome with very professional operators, whether at the reception, restaurant, bar or at the pool bar (Ismael makes a good cocktail). To the next.",Aug,2023,Aug 2023,2023-08-01,2023,5
Apartamentos Bellevue Nr. 1,Lorrainechristina,0,Lorrainechristinawrote a review Aug 2019,Had a fantastic stay here at the Casa Teresa. The owners are so helpful and welcoming nothing too much trouble. Everything in the villa was so clean like home from home. The pool area was kept clean and very friendly families around the pool who love it there and return year after year and i can see why! The apartments ate situated in a great place close to restaurants and the main square which have entertainment on every night down by the beach. Will definitely be returning! Thank you Dieter and Sigi.,Aug,2019,Aug 2019,2019-08-01,2019,5
Pousada Viseu,Hollin D,147,Hollin Dwrote a review Aug 2018,"This palace is a former hospital but it looks more like a place for Royals.  It sits in the hills in a charming little city.  The hotel has outstanding amenities like a spa with sauna, hot tub and indoor pool.  The outdoor pool is gorgeous with a view not to be missed.  Our room has two floors and floor to ceiling windows.  It is magnificent.  The bathroom is wonderful with all the amenities you could ask for.  The staff is very helpful and accommodating.  We will definitely return to this city and this wonderful hotel.",Aug,2018,Aug 2018,2018-08-01,2018,5
